Protein id	Contig id	Start	Stop	Strand	Element symbol	Element name	Scope	Type	Subtype	Class	Subclass	Method	Target length	Reference sequence length	% Coverage of reference	% Identity to reference	Alignment length	Closest reference accession	Closest reference name	HMM accession	HMM description
NA	ERZ3164739.105	211	711	-	focG	F1C fimbria minor subunit FocG	plus	VIRULENCE	VIRULENCE	NA	NA	BLASTX	167	166	100.00	98.80	167	AAB20438.1	F1C fimbria minor subunit FocG	NA	NA
NA	ERZ3164739.12	124841	126928	+	iha	bifunctional siderophore receptor/adhesin Iha	plus	VIRULENCE	VIRULENCE	NA	NA	EXACTX	696	696	100.00	100.00	696	AAG55323.1	bifunctional siderophore receptor/adhesin Iha	NA	NA
NA	ERZ3164739.17	19916	21103	+	emrD	multidrug efflux MFS transporter EmrD	plus	AMR	AMR	EFFLUX	EFFLUX	BLASTX	396	396	100.00	99.49	396	EFF04178.1	multidrug efflux MFS transporter EmrD	NA	NA
NA	ERZ3164739.19	2255	3091	-	sul1	sulfonamide-resistant dihydropteroate synthase Sul1	core	AMR	AMR	SULFONAMIDE	SULFONAMIDE	EXACTX	279	279	100.00	100.00	279	WP_000259031.1	sulfonamide-resistant dihydropteroate synthase Sul1	NA	NA
NA	ERZ3164739.19	3088	3432	-	qacEdelta1	quaternary ammonium compound efflux SMR transporter QacE delta 1	core	STRESS	BIOCIDE	QUATERNARY AMMONIUM	QUATERNARY AMMONIUM	ALLELEX	115	115	100.00	100.00	115	WP_000679427.1	quaternary ammonium compound efflux SMR transporter QacE delta 1	NA	NA
NA	ERZ3164739.19	3599	4387	-	aadA1	ANT(3'')-Ia family aminoglycoside nucleotidyltransferase AadA1	core	AMR	AMR	AMINOGLYCOSIDE	STREPTOMYCIN	EXACTX	263	263	100.00	100.00	263	WP_001206317.1	ANT(3'')-Ia family aminoglycoside nucleotidyltransferase AadA1	NA	NA
NA	ERZ3164739.19	4483	4953	-	dfrA1	trimethoprim-resistant dihydrofolate reductase DfrA1	core	AMR	AMR	TRIMETHOPRIM	TRIMETHOPRIM	EXACTX	157	157	100.00	100.00	157	WP_000777555.1	trimethoprim-resistant dihydrofolate reductase DfrA1	NA	NA
NA	ERZ3164739.2	12925	22542	+	clbB	colibactin hybrid non-ribosomal peptide synthetase/type I polyketide synthase ClbB	plus	VIRULENCE	VIRULENCE	NA	NA	EXACTX	3206	3206	100.00	100.00	3206	AMQ58400.1	colibactin hybrid non-ribosomal peptide synthetase/type I polyketide synthase ClbB	NA	NA
NA	ERZ3164739.2	52641	57005	+	clbN	colibactin non-ribosomal peptide synthetase ClbN	plus	VIRULENCE	VIRULENCE	NA	NA	EXACTX	1455	1455	100.00	100.00	1455	AMH08480.1	colibactin non-ribosomal peptide synthetase ClbN	NA	NA
NA	ERZ3164739.2	100308	102107	+	ybtP	yersiniabactin ABC transporter ATP-binding/permease protein YbtP	plus	VIRULENCE	VIRULENCE	NA	NA	BLASTX	600	600	100.00	99.83	600	CAA21388.1	yersiniabactin ABC transporter ATP-binding/permease protein YbtP	NA	NA
NA	ERZ3164739.2	102097	103896	+	ybtQ	yersiniabactin ABC transporter ATP-binding/permease protein YbtQ	plus	VIRULENCE	VIRULENCE	NA	NA	BLASTX	600	600	100.00	99.67	600	AAC69584.1	yersiniabactin ABC transporter ATP-binding/permease protein YbtQ	NA	NA
NA	ERZ3164739.2	161998	162327	+	emrE	multidrug efflux SMR transporter EmrE	plus	STRESS	BIOCIDE	EFFLUX	EFFLUX	BLASTX	110	110	100.00	98.18	110	CAA77936.1	multidrug efflux SMR transporter EmrE	NA	NA
NA	ERZ3164739.27	19821	24068	+	fdeC	inverse autotransporter adhesin FdeC	plus	VIRULENCE	VIRULENCE	NA	NA	BLASTX	1416	1416	100.00	99.86	1416	ABE05822.1	inverse autotransporter adhesin FdeC	NA	NA
NA	ERZ3164739.3	5193	8294	-	acrF	multidrug efflux RND transporter permease subunit AcrF	plus	AMR	AMR	EFFLUX	EFFLUX	BLASTX	1034	1034	100.00	99.32	1034	AAC76298.1	multidrug efflux RND transporter permease subunit AcrF	NA	NA
NA	ERZ3164739.37	14923	16053	-	blaEC	BlaEC family class C beta-lactamase	plus	AMR	AMR	BETA-LACTAM	BETA-LACTAM	BLASTX	377	377	100.00	99.73	377	AAZ85965.1	cephalosporin-hydrolyzing class C beta-lactamase EC-5	NA	NA
NA	ERZ3164739.38	1668	3548	+	iroN	siderophore salmochelin receptor IroN	plus	VIRULENCE	VIRULENCE	NA	NA	PARTIALX	627	725	86.48	100.00	627	AAN79707.1	siderophore salmochelin receptor IroN	NA	NA
NA	ERZ3164739.38	3891	4844	-	iroE	catecholate siderophore esterase IroE	plus	VIRULENCE	VIRULENCE	NA	NA	BLASTX	318	318	100.00	99.06	318	ACJ63530.1	catecholate siderophore esterase IroE	NA	NA
NA	ERZ3164739.38	4932	6158	-	iroD	catecholate siderophore esterase IroD	plus	VIRULENCE	VIRULENCE	NA	NA	BLASTX	409	409	100.00	99.51	409	ACJ63529.1	catecholate siderophore esterase IroD	NA	NA
NA	ERZ3164739.38	6265	9921	-	iroC	salmochelin/enterobactin export ABC transporter IroC	plus	VIRULENCE	VIRULENCE	NA	NA	BLASTX	1219	1219	100.00	99.59	1219	AUH19662.1	salmochelin/enterobactin export ABC transporter IroC	NA	NA
NA	ERZ3164739.38	10064	11176	-	iroB	salmochelin biosynthesis C-glycosyltransferase IroB	plus	VIRULENCE	VIRULENCE	NA	NA	BLASTX	371	371	100.00	99.19	371	EOW04219.1	salmochelin biosynthesis C-glycosyltransferase IroB	NA	NA
NA	ERZ3164739.40	1391	3436	+	ireA	TonB-dependent siderophore receptor IreA	plus	VIRULENCE	VIRULENCE	NA	NA	EXACTX	682	682	100.00	100.00	682	ABJ02430.1	TonB-dependent siderophore receptor IreA	NA	NA
NA	ERZ3164739.40	23908	24471	+	papA	P fimbria major subunit PapA	plus	VIRULENCE	VIRULENCE	NA	NA	BLASTX	188	184	100.00	85.11	188	ENA25238.1	P fimbria major subunit PapA	NA	NA
NA	ERZ3164739.41	14922	19007	-	vactox	vacuolating autotransporter toxin Vat	plus	VIRULENCE	VIRULENCE	NA	NA	BLASTX	1362	1376	98.98	99.93	1362	CAD66214.1	vacuolating autotransporter toxin Vat	NA	NA
NA	ERZ3164739.45	971	2167	-	tet(A)	tetracycline efflux MFS transporter Tet(A)	core	AMR	AMR	TETRACYCLINE	TETRACYCLINE	EXACTX	399	399	100.00	100.00	399	WP_000804064.1	tetracycline efflux MFS transporter Tet(A)	NA	NA
NA	ERZ3164739.45	4203	4634	-	merR	mercury resistance transcriptional regulator MerR	plus	STRESS	METAL	MERCURY	MERCURY	BLASTX	144	144	100.00	93.75	144	CAA77320.1	mercury resistance transcriptional regulator MerR	NA	NA
NA	ERZ3164739.45	4706	5053	+	merT	mercuric transport protein MerT	plus	STRESS	METAL	MERCURY	MERCURY	EXACTX	116	116	100.00	100.00	116	AAB59075.1	mercuric transport protein MerT	NA	NA
NA	ERZ3164739.45	5070	5342	+	merP	mercury resistance system periplasmic binding protein MerP	plus	STRESS	METAL	MERCURY	MERCURY	BLASTX	91	91	100.00	90.11	91	AAC38219.1	mercury resistance system periplasmic binding protein MerP	NA	NA
NA	ERZ3164739.45	5381	5800	+	merC	organomercurial transporter MerC	plus	STRESS	METAL	MERCURY	ORGANOMERCURY	EXACTX	140	140	100.00	100.00	140	AAC33908.1	organomercurial transporter MerC	NA	NA
NA	ERZ3164739.45	6566	7423	-	blaTEM-1	broad-spectrum class A beta-lactamase TEM-1	core	AMR	AMR	BETA-LACTAM	BETA-LACTAM	ALLELEX	286	286	100.00	100.00	286	WP_000027057.1	broad-spectrum class A beta-lactamase TEM-1	NA	NA
NA	ERZ3164739.47	1259	1483	+	mchB	microcin H47	plus	VIRULENCE	VIRULENCE	NA	NA	EXACTX	75	75	100.00	100.00	75	CAB54534.2	microcin H47	NA	NA
NA	ERZ3164739.47	5206	7299	+	mchF	microcin H47 export transporter peptidase/ATP-binding subunit MchF	plus	VIRULENCE	VIRULENCE	NA	NA	BLASTX	698	698	100.00	99.00	698	CAD56186.1	microcin H47 export transporter peptidase/ATP-binding subunit MchF	NA	NA
NA	ERZ3164739.54	3	494	+	papH	P fimbrial minor subunit PapH	plus	VIRULENCE	VIRULENCE	NA	NA	PARTIAL_CONTIG_ENDX	164	195	84.10	99.39	164	CAA43563.1	P fimbrial minor subunit PapH	NA	NA
NA	ERZ3164739.54	556	3063	+	papC	P fimbrial usher protein PapC	plus	VIRULENCE	VIRULENCE	NA	NA	BLASTX	836	836	100.00	96.31	841	CAA43564.1	P fimbrial usher protein PapC	NA	NA
NA	ERZ3164739.56	1465	4092	+	sfaF	S/F1C fimbrial biogenesis usher protein SfaF/FocD	plus	VIRULENCE	VIRULENCE	NA	NA	BLASTX	876	876	100.00	99.54	876	EIL44824.1	S/F1C fimbrial biogenesis usher protein SfaF/FocD	NA	NA
NA	ERZ3164739.57	948	3362	-	cnf1	cytotoxic necrotizing factor CNF1	plus	VIRULENCE	VIRULENCE	NA	NA	PARTIALX	805	1014	79.39	99.63	805	CAK02719.1	cytotoxic necrotizing factor CNF1	NA	NA
NA	ERZ3164739.62	635	1132	+	papF	P fimbrial tip protein PapF	plus	VIRULENCE	VIRULENCE	NA	NA	BLASTX	166	167	100.00	91.02	167	CAA43569.1	P fimbrial tip protein PapF	NA	NA
NA	ERZ3164739.62	1179	2186	+	papG-II	P fimbria tip G-adhesin PapG-II	plus	VIRULENCE	VIRULENCE	NA	NA	BLASTX	336	337	100.00	98.52	337	AAA24293.1	P fimbria tip G-adhesin PapG-II	NA	NA
NA	ERZ3164739.7	103240	103503	-	ariR	biofilm/acid-resistance regulator AriR	plus	STRESS	ACID	NA	NA	BLASTX	88	88	100.00	97.73	88	AAC74250.1	biofilm/acid-resistance regulator AriR	NA	NA
NA	ERZ3164739.7	136469	136759	+	iss	increased serum survival lipoprotein Iss	plus	VIRULENCE	VIRULENCE	NA	NA	EXACTX	97	97	100.00	100.00	97	CAR12622.1	increased serum survival lipoprotein Iss	NA	NA
NA	ERZ3164739.7	145416	145745	-	emrE	multidrug efflux SMR transporter EmrE	plus	STRESS	BIOCIDE	EFFLUX	EFFLUX	BLASTX	110	110	100.00	99.09	110	CAA77936.1	multidrug efflux SMR transporter EmrE	NA	NA
NA	ERZ3164739.70	375	2666	+	hlyA-alpha	RTX toxin hemolysin HlyA	plus	VIRULENCE	VIRULENCE	NA	NA	PARTIAL_CONTIG_ENDX	764	1024	74.61	98.04	764	CAQ77251.1	RTX toxin hemolysin HlyA	NA	NA
NA	ERZ3164739.73	1	966	-	papG-III	P fimbria tip G-adhesin PapG-III	plus	VIRULENCE	VIRULENCE	NA	NA	BLASTX	322	335	96.12	98.76	322	CAA43558.1	P fimbria tip G-adhesin PapG-III	NA	NA
NA	ERZ3164739.73	1013	1513	-	papF	P fimbrial tip protein PapF	plus	VIRULENCE	VIRULENCE	NA	NA	BLASTX	167	167	100.00	97.60	167	CAA43569.1	P fimbrial tip protein PapF	NA	NA
