Protein id	Contig id	Start	Stop	Strand	Element symbol	Element name	Scope	Type	Subtype	Class	Subclass	Method	Target length	Reference sequence length	% Coverage of reference	% Identity to reference	Alignment length	Closest reference accession	Closest reference name	HMM accession	HMM description
NA	ERZ3165011.102	71	610	-	papA	P fimbria major subunit PapA	plus	VIRULENCE	VIRULENCE	NA	NA	BLASTX	180	185	96.22	85.64	181	CAA43562.1	P fimbria major subunit PapA	NA	NA
NA	ERZ3165011.14	15329	24946	+	clbB	colibactin hybrid non-ribosomal peptide synthetase/type I polyketide synthase ClbB	plus	VIRULENCE	VIRULENCE	NA	NA	EXACTX	3206	3206	100.00	100.00	3206	AMQ58400.1	colibactin hybrid non-ribosomal peptide synthetase/type I polyketide synthase ClbB	NA	NA
NA	ERZ3165011.14	49392	53756	+	clbN	colibactin non-ribosomal peptide synthetase ClbN	plus	VIRULENCE	VIRULENCE	NA	NA	EXACTX	1455	1455	100.00	100.00	1455	AMH08480.1	colibactin non-ribosomal peptide synthetase ClbN	NA	NA
NA	ERZ3165011.14	97059	98858	+	ybtP	yersiniabactin ABC transporter ATP-binding/permease protein YbtP	plus	VIRULENCE	VIRULENCE	NA	NA	BLASTX	600	600	100.00	99.83	600	CAA21388.1	yersiniabactin ABC transporter ATP-binding/permease protein YbtP	NA	NA
NA	ERZ3165011.14	98848	100647	+	ybtQ	yersiniabactin ABC transporter ATP-binding/permease protein YbtQ	plus	VIRULENCE	VIRULENCE	NA	NA	BLASTX	600	600	100.00	99.67	600	AAC69584.1	yersiniabactin ABC transporter ATP-binding/permease protein YbtQ	NA	NA
NA	ERZ3165011.15	13220	14350	+	blaEC	BlaEC family class C beta-lactamase	plus	AMR	AMR	BETA-LACTAM	BETA-LACTAM	BLASTX	377	377	100.00	99.73	377	AAZ85965.1	cephalosporin-hydrolyzing class C beta-lactamase EC-5	NA	NA
NA	ERZ3165011.16	52694	53023	-	emrE	multidrug efflux SMR transporter EmrE	plus	STRESS	BIOCIDE	EFFLUX	EFFLUX	BLASTX	110	110	100.00	98.18	110	CAA77936.1	multidrug efflux SMR transporter EmrE	NA	NA
NA	ERZ3165011.2	362076	365177	+	acrF	multidrug efflux RND transporter permease subunit AcrF	plus	AMR	AMR	EFFLUX	EFFLUX	BLASTX	1034	1034	100.00	99.42	1034	AAC76298.1	multidrug efflux RND transporter permease subunit AcrF	NA	NA
NA	ERZ3165011.24	34270	35496	+	mdtM	multidrug efflux MFS transporter MdtM	plus	AMR	AMR	EFFLUX	EFFLUX	BLASTX	409	410	99.76	97.31	409	AAC77293.1	multidrug efflux MFS transporter MdtM	NA	NA
NA	ERZ3165011.37	30989	31252	-	ariR	biofilm/acid-resistance regulator AriR	plus	STRESS	ACID	NA	NA	BLASTX	88	88	100.00	97.73	88	AAC74250.1	biofilm/acid-resistance regulator AriR	NA	NA
NA	ERZ3165011.45	13658	17785	+	vactox	vacuolating autotransporter toxin Vat	plus	VIRULENCE	VIRULENCE	NA	NA	BLASTX	1376	1376	100.00	99.64	1376	CAD66214.1	vacuolating autotransporter toxin Vat	NA	NA
NA	ERZ3165011.48	3082	3582	-	focG	F1C fimbria minor subunit FocG	plus	VIRULENCE	VIRULENCE	NA	NA	BLASTX	167	166	100.00	98.80	167	AAB20438.1	F1C fimbria minor subunit FocG	NA	NA
NA	ERZ3165011.48	4147	6774	-	sfaF	S/F1C fimbrial biogenesis usher protein SfaF/FocD	plus	VIRULENCE	VIRULENCE	NA	NA	BLASTX	876	876	100.00	99.43	876	ASJ31253.1	S/F1C fimbrial biogenesis usher protein SfaF/FocD	NA	NA
NA	ERZ3165011.48	14081	16174	-	mchF	microcin H47 export transporter peptidase/ATP-binding subunit MchF	plus	VIRULENCE	VIRULENCE	NA	NA	BLASTX	698	698	100.00	99.14	698	CAD56186.1	microcin H47 export transporter peptidase/ATP-binding subunit MchF	NA	NA
NA	ERZ3165011.48	19897	20121	-	mchB	microcin H47	plus	VIRULENCE	VIRULENCE	NA	NA	EXACTX	75	75	100.00	100.00	75	CAB54534.2	microcin H47	NA	NA
NA	ERZ3165011.5	203556	203987	-	marR_S3N	Escherichia ampicillin/chloramphenicol/quinolone/rifampin/tetracycline resistant MarR	core	AMR	POINT	MULTIDRUG	AMPICILLIN/CHLORAMPHENICOL/QUINOLONE/RIFAMPIN/TETRACYCLINE	POINTX	144	144	100.00	97.92	144	WP_000843414.1	transcriptional regulator MarR	NA	NA
NA	ERZ3165011.53	161	592	-	merR	mercury resistance transcriptional regulator MerR	plus	STRESS	METAL	MERCURY	MERCURY	BLASTX	144	144	100.00	93.75	144	CAA77320.1	mercury resistance transcriptional regulator MerR	NA	NA
NA	ERZ3165011.53	664	1011	+	merT	mercuric transport protein MerT	plus	STRESS	METAL	MERCURY	MERCURY	EXACTX	116	116	100.00	100.00	116	AAB59075.1	mercuric transport protein MerT	NA	NA
NA	ERZ3165011.53	1028	1300	+	merP	mercury resistance system periplasmic binding protein MerP	plus	STRESS	METAL	MERCURY	MERCURY	BLASTX	91	91	100.00	90.11	91	AAC38219.1	mercury resistance system periplasmic binding protein MerP	NA	NA
NA	ERZ3165011.53	1339	1758	+	merC	organomercurial transporter MerC	plus	STRESS	METAL	MERCURY	ORGANOMERCURY	EXACTX	140	140	100.00	100.00	140	AAC33908.1	organomercurial transporter MerC	NA	NA
NA	ERZ3165011.53	12261	13097	-	sul1	sulfonamide-resistant dihydropteroate synthase Sul1	core	AMR	AMR	SULFONAMIDE	SULFONAMIDE	EXACTX	279	279	100.00	100.00	279	WP_000259031.1	sulfonamide-resistant dihydropteroate synthase Sul1	NA	NA
NA	ERZ3165011.53	13094	13438	-	qacEdelta1	quaternary ammonium compound efflux SMR transporter QacE delta 1	core	STRESS	BIOCIDE	QUATERNARY AMMONIUM	QUATERNARY AMMONIUM	ALLELEX	115	115	100.00	100.00	115	WP_000679427.1	quaternary ammonium compound efflux SMR transporter QacE delta 1	NA	NA
NA	ERZ3165011.53	13605	14393	-	aadA1	ANT(3'')-Ia family aminoglycoside nucleotidyltransferase AadA1	core	AMR	AMR	AMINOGLYCOSIDE	STREPTOMYCIN	EXACTX	263	263	100.00	100.00	263	WP_001209508.1	ANT(3'')-Ia family aminoglycoside nucleotidyltransferase AadA1	NA	NA
NA	ERZ3165011.53	14509	15336	-	blaOXA-1	oxacillin-hydrolyzing class D beta-lactamase OXA-1	core	AMR	AMR	BETA-LACTAM	CEPHALOSPORIN	ALLELEX	276	276	100.00	100.00	276	WP_001334766.1	oxacillin-hydrolyzing class D beta-lactamase OXA-1	NA	NA
NA	ERZ3165011.62	1927	3648	+	iucA	aerobactin synthase IucA	plus	VIRULENCE	VIRULENCE	NA	NA	BLASTX	574	576	100.00	98.61	576	EGI25746.1	aerobactin synthase IucA	NA	NA
NA	ERZ3165011.62	3652	4596	+	iucB	N(6)-hydroxylysine O-acetyltransferase IucB	plus	VIRULENCE	VIRULENCE	NA	NA	BLASTX	315	315	100.00	99.37	315	AAN82074.1	N(6)-hydroxylysine O-acetyltransferase IucB	NA	NA
NA	ERZ3165011.62	4599	6338	+	iucC	NIS family aerobactin synthetase IucC	plus	VIRULENCE	VIRULENCE	NA	NA	BLASTX	580	580	100.00	99.14	580	AAN82073.1	NIS family aerobactin synthetase IucC	NA	NA
NA	ERZ3165011.62	6338	7612	+	iucD	NADPH-dependent L-lysine N(6)-monooxygenase IucD	plus	VIRULENCE	VIRULENCE	NA	NA	BLASTX	425	445	95.51	97.65	425	AAD44749.1	NADPH-dependent L-lysine N(6)-monooxygenase IucD	NA	NA
NA	ERZ3165011.62	7709	9895	+	iutA	ferric aerobactin receptor IutA	plus	VIRULENCE	VIRULENCE	NA	NA	BLASTX	729	731	99.73	89.85	729	AAN45165.2	ferric aerobactin receptor IutA	NA	NA
NA	ERZ3165011.62	10842	14726	+	sat	serine protease autotransporter toxin Sat	plus	VIRULENCE	VIRULENCE	NA	NA	EXACTX	1295	1295	100.00	100.00	1295	CAE55775.1	serine protease autotransporter toxin Sat	NA	NA
NA	ERZ3165011.72	934	2046	+	iroB	salmochelin biosynthesis C-glycosyltransferase IroB	plus	VIRULENCE	VIRULENCE	NA	NA	BLASTX	371	371	100.00	99.19	371	EOW04219.1	salmochelin biosynthesis C-glycosyltransferase IroB	NA	NA
NA	ERZ3165011.72	2189	5845	+	iroC	salmochelin/enterobactin export ABC transporter IroC	plus	VIRULENCE	VIRULENCE	NA	NA	BLASTX	1219	1219	100.00	99.51	1219	AUH19662.1	salmochelin/enterobactin export ABC transporter IroC	NA	NA
NA	ERZ3165011.72	5952	7178	+	iroD	catecholate siderophore esterase IroD	plus	VIRULENCE	VIRULENCE	NA	NA	BLASTX	409	409	100.00	99.51	409	ACJ63529.1	catecholate siderophore esterase IroD	NA	NA
NA	ERZ3165011.72	7266	8219	+	iroE	catecholate siderophore esterase IroE	plus	VIRULENCE	VIRULENCE	NA	NA	BLASTX	318	318	100.00	99.06	318	ACJ63530.1	catecholate siderophore esterase IroE	NA	NA
NA	ERZ3165011.72	8270	10444	-	iroN	siderophore salmochelin receptor IroN	plus	VIRULENCE	VIRULENCE	NA	NA	EXACTX	725	725	100.00	100.00	725	AAN79707.1	siderophore salmochelin receptor IroN	NA	NA
NA	ERZ3165011.74	648	2735	+	iha	bifunctional siderophore receptor/adhesin Iha	plus	VIRULENCE	VIRULENCE	NA	NA	EXACTX	696	696	100.00	100.00	696	ADN47767.1	bifunctional siderophore receptor/adhesin Iha	NA	NA
NA	ERZ3165011.8	82003	83190	-	emrD	multidrug efflux MFS transporter EmrD	plus	AMR	AMR	EFFLUX	EFFLUX	BLASTX	396	396	100.00	99.24	396	EFF04178.1	multidrug efflux MFS transporter EmrD	NA	NA
NA	ERZ3165011.8	89403	90791	+	uhpT_E350Q	Escherichia fosfomycin resistant UhpT	core	AMR	POINT	FOSFOMYCIN	FOSFOMYCIN	POINTX	463	463	100.00	99.78	463	WP_000879194.1	hexose phosphate transporter UhpT	NA	NA
NA	ERZ3165011.96	954	2156	-	tet(B)	tetracycline efflux MFS transporter Tet(B)	core	AMR	AMR	TETRACYCLINE	TETRACYCLINE	EXACTX	401	401	100.00	100.00	401	WP_001089068.1	tetracycline efflux MFS transporter Tet(B)	NA	NA
