Protein id	Contig id	Start	Stop	Strand	Element symbol	Element name	Scope	Type	Subtype	Class	Subclass	Method	Target length	Reference sequence length	% Coverage of reference	% Identity to reference	Alignment length	Closest reference accession	Closest reference name	HMM accession	HMM description
NA	ERZ3164912.11	72348	76595	-	fdeC	inverse autotransporter adhesin FdeC	plus	VIRULENCE	VIRULENCE	NA	NA	BLASTX	1416	1416	100.00	94.21	1416	ABE05822.1	inverse autotransporter adhesin FdeC	NA	NA
NA	ERZ3164912.12	5597	8698	-	acrF	multidrug efflux RND transporter permease subunit AcrF	plus	AMR	AMR	EFFLUX	EFFLUX	BLASTX	1034	1034	100.00	99.61	1034	AAC76298.1	multidrug efflux RND transporter permease subunit AcrF	NA	NA
NA	ERZ3164912.15	13483	14613	+	blaEC	BlaEC family class C beta-lactamase	plus	AMR	AMR	BETA-LACTAM	BETA-LACTAM	BLASTX	377	377	100.00	98.41	377	WP_063610930.1	extended-spectrum class C beta-lactamase EC-15	NA	NA
NA	ERZ3164912.17	72639	73208	-	lpfA-O113	long polar fimbria major subunit LpfA-O113	plus	VIRULENCE	VIRULENCE	NA	NA	EXACTX	190	190	100.00	100.00	190	AAT76975.1	long polar fimbria major subunit LpfA-O113	NA	NA
NA	ERZ3164912.21	9819	10082	+	ariR	biofilm/acid-resistance regulator AriR	plus	STRESS	ACID	NA	NA	EXACTX	88	88	100.00	100.00	88	AAC74250.1	biofilm/acid-resistance regulator AriR	NA	NA
NA	ERZ3164912.24	2553	2879	-	emrE	multidrug efflux SMR transporter EmrE	plus	STRESS	BIOCIDE	EFFLUX	EFFLUX	INTERNAL_STOP	109	110	99.09	97.25	109	CAA77936.1	multidrug efflux SMR transporter EmrE	NA	NA
NA	ERZ3164912.25	35982	37208	+	mdtM	multidrug efflux MFS transporter MdtM	plus	AMR	AMR	EFFLUX	EFFLUX	BLASTX	409	410	99.76	98.04	409	AAC77293.1	multidrug efflux MFS transporter MdtM	NA	NA
NA	ERZ3164912.3	97812	99701	+	parE_S458A	Escherichia quinolone resistant ParE	core	AMR	POINT	QUINOLONE	QUINOLONE	POINTX	630	630	100.00	99.68	630	WP_033554192.1	DNA topoisomerase IV subunit B ParE	NA	NA
NA	ERZ3164912.3	108365	110620	+	parC_S80I	Escherichia quinolone resistant ParC	core	AMR	POINT	QUINOLONE	QUINOLONE	POINTX	752	752	100.00	99.87	752	WP_001281881.1	DNA topoisomerase IV subunit A ParC	NA	NA
NA	ERZ3164912.31	11777	14401	+	gyrA_D87N	Escherichia quinolone resistant GyrA	core	AMR	POINT	QUINOLONE	QUINOLONE	POINTX	875	878	99.66	98.97	875	WP_001281243.1	DNA gyrase subunit A GyrA	NA	NA
NA	ERZ3164912.31	11777	14401	+	gyrA_S83L	Escherichia quinolone resistant GyrA	core	AMR	POINT	QUINOLONE	QUINOLONE	POINTX	875	878	99.66	98.97	875	WP_001281243.1	DNA gyrase subunit A GyrA	NA	NA
NA	ERZ3164912.56	393	2579	-	iutA	ferric aerobactin receptor IutA	plus	VIRULENCE	VIRULENCE	NA	NA	BLASTX	729	731	99.73	89.85	729	AAN45165.2	ferric aerobactin receptor IutA	NA	NA
NA	ERZ3164912.56	2676	3950	-	iucD	NADPH-dependent L-lysine N(6)-monooxygenase IucD	plus	VIRULENCE	VIRULENCE	NA	NA	BLASTX	425	445	95.51	97.65	425	AAD44749.1	NADPH-dependent L-lysine N(6)-monooxygenase IucD	NA	NA
NA	ERZ3164912.56	3950	5689	-	iucC	NIS family aerobactin synthetase IucC	plus	VIRULENCE	VIRULENCE	NA	NA	BLASTX	580	580	100.00	97.59	580	AAN82073.1	NIS family aerobactin synthetase IucC	NA	NA
NA	ERZ3164912.56	5692	6636	-	iucB	N(6)-hydroxylysine O-acetyltransferase IucB	plus	VIRULENCE	VIRULENCE	NA	NA	BLASTX	315	315	100.00	96.19	315	AAN82074.1	N(6)-hydroxylysine O-acetyltransferase IucB	NA	NA
NA	ERZ3164912.56	6640	8361	-	iucA	aerobactin synthase IucA	plus	VIRULENCE	VIRULENCE	NA	NA	BLASTX	574	576	100.00	95.31	576	EGI25746.1	aerobactin synthase IucA	NA	NA
NA	ERZ3164912.6	59677	60750	-	espX1	type III secretion system effector EspX1	plus	VIRULENCE	VIRULENCE	NA	NA	PARTIALX	358	473	75.69	89.66	358	ADD54679.1	type III secretion system effector EspX1	NA	NA
NA	ERZ3164912.63	161	592	-	merR	mercury resistance transcriptional regulator MerR	plus	STRESS	METAL	MERCURY	MERCURY	BLASTX	144	144	100.00	93.75	144	CAA77320.1	mercury resistance transcriptional regulator MerR	NA	NA
NA	ERZ3164912.63	664	1011	+	merT	mercuric transport protein MerT	plus	STRESS	METAL	MERCURY	MERCURY	EXACTX	116	116	100.00	100.00	116	AAB59075.1	mercuric transport protein MerT	NA	NA
NA	ERZ3164912.63	1028	1300	+	merP	mercury resistance system periplasmic binding protein MerP	plus	STRESS	METAL	MERCURY	MERCURY	BLASTX	91	91	100.00	90.11	91	AAC38219.1	mercury resistance system periplasmic binding protein MerP	NA	NA
NA	ERZ3164912.63	1339	1758	+	merC	organomercurial transporter MerC	plus	STRESS	METAL	MERCURY	ORGANOMERCURY	EXACTX	140	140	100.00	100.00	140	AAC33908.1	organomercurial transporter MerC	NA	NA
NA	ERZ3164912.64	133	462	-	qacL	quaternary ammonium compound efflux SMR transporter QacL	core	STRESS	BIOCIDE	QUATERNARY AMMONIUM	QUATERNARY AMMONIUM	EXACTX	110	110	100.00	100.00	110	WP_000800531.1	quaternary ammonium compound efflux SMR transporter QacL	NA	NA
NA	ERZ3164912.64	635	1423	-	aadA1	ANT(3'')-Ia family aminoglycoside nucleotidyltransferase AadA1	core	AMR	AMR	AMINOGLYCOSIDE	STREPTOMYCIN	EXACTX	263	263	100.00	100.00	263	WP_001206316.1	ANT(3'')-Ia family aminoglycoside nucleotidyltransferase AadA1	NA	NA
NA	ERZ3164912.64	1519	2775	-	cmlA1	chloramphenicol efflux MFS transporter CmlA1	core	AMR	AMR	PHENICOL	CHLORAMPHENICOL	EXACTX	419	419	100.00	100.00	419	WP_000095725.1	chloramphenicol efflux MFS transporter CmlA1	NA	NA
NA	ERZ3164912.64	3040	3828	-	aadA2	ANT(3'')-Ia family aminoglycoside nucleotidyltransferase AadA2	core	AMR	AMR	AMINOGLYCOSIDE	STREPTOMYCIN	EXACTX	263	263	100.00	100.00	263	WP_001206356.1	ANT(3'')-Ia family aminoglycoside nucleotidyltransferase AadA2	NA	NA
NA	ERZ3164912.64	4239	4733	-	dfrA12	trimethoprim-resistant dihydrofolate reductase DfrA12	core	AMR	AMR	TRIMETHOPRIM	TRIMETHOPRIM	EXACTX	165	165	100.00	100.00	165	WP_001083725.1	trimethoprim-resistant dihydrofolate reductase DfrA12	NA	NA
NA	ERZ3164912.65	137	1039	+	mph(A)	Mph(A) family macrolide 2'-phosphotransferase	core	AMR	AMR	MACROLIDE	AZITHROMYCIN/ERYTHROMYCIN/SPIRAMYCIN/TELITHROMYCIN	EXACTX	301	301	100.00	100.00	301	WP_000219391.1	Mph(A) family macrolide 2'-phosphotransferase	NA	NA
NA	ERZ3164912.65	4751	5221	-	dfrA14	trimethoprim-resistant dihydrofolate reductase DfrA14	core	AMR	AMR	TRIMETHOPRIM	TRIMETHOPRIM	EXACTX	157	157	100.00	100.00	157	WP_004201280.1	trimethoprim-resistant dihydrofolate reductase DfrA14	NA	NA
NA	ERZ3164912.7	160400	160831	-	pcoE	copper resistance system metallochaperone PcoE	plus	STRESS	METAL	COPPER	COPPER	BLASTX	144	144	100.00	92.36	144	CAA58532.1	copper resistance system metallochaperone PcoE	NA	NA
NA	ERZ3164912.7	161052	162449	-	pcoS	copper resistance membrane spanning protein PcoS	plus	STRESS	METAL	COPPER	COPPER	BLASTX	466	466	100.00	99.57	466	CAA58530.1	copper resistance membrane spanning protein PcoS	NA	NA
NA	ERZ3164912.7	162449	163126	-	pcoR	copper response regulator transcription factor PcoR	plus	STRESS	METAL	COPPER	COPPER	EXACTX	226	226	100.00	100.00	226	CAA58529.1	copper response regulator transcription factor PcoR	NA	NA
NA	ERZ3164912.7	163184	164110	-	pcoD	copper resistance inner membrane protein PcoD	plus	STRESS	METAL	COPPER	COPPER	EXACTX	309	309	100.00	100.00	309	CAA58528.1	copper resistance inner membrane protein PcoD	NA	NA
NA	ERZ3164912.7	164118	164495	-	pcoC	copper resistance system metallochaperone PcoC	plus	STRESS	METAL	COPPER	COPPER	EXACTX	126	126	100.00	100.00	126	CAA58527.1	copper resistance system metallochaperone PcoC	NA	NA
NA	ERZ3164912.7	164538	165425	-	pcoB	copper-binding protein PcoB	plus	STRESS	METAL	COPPER	COPPER	EXACTX	296	296	100.00	100.00	296	CAA58526.1	copper-binding protein PcoB	NA	NA
NA	ERZ3164912.7	165434	167248	-	pcoA	multicopper oxidase PcoA	plus	STRESS	METAL	COPPER	COPPER	BLASTX	605	605	100.00	99.50	605	CAA58525.1	multicopper oxidase PcoA	NA	NA
NA	ERZ3164912.7	169233	171698	-	silP	Ag(+)-translocating P-type ATPase SilP	plus	STRESS	METAL	SILVER	SILVER	BLASTX	822	824	99.64	95.14	823	AAD11750.1	Ag(+)-translocating P-type ATPase SilP	NA	NA
NA	ERZ3164912.7	172334	175477	-	silA	Cu(+)/Ag(+) efflux RND transporter permease subunit SilA	plus	STRESS	METAL	COPPER/SILVER	COPPER/SILVER	BLASTX	1048	1048	100.00	98.66	1048	AAD11749.1	Cu(+)/Ag(+) efflux RND transporter permease subunit SilA	NA	NA
NA	ERZ3164912.7	175491	176780	-	silB	Cu(+)/Ag(+) efflux RND transporter periplasmic adaptor subunit SilB	plus	STRESS	METAL	COPPER/SILVER	COPPER/SILVER	BLASTX	430	430	100.00	96.28	430	AAD11748.1	Cu(+)/Ag(+) efflux RND transporter periplasmic adaptor subunit SilB	NA	NA
NA	ERZ3164912.7	176897	177247	-	silF	Cu(+)/Ag(+) efflux RND transporter periplasmic metallochaperone SilF	plus	STRESS	METAL	COPPER/SILVER	COPPER/SILVER	BLASTX	117	117	100.00	97.44	117	KGL71342.1	Cu(+)/Ag(+) efflux RND transporter periplasmic metallochaperone SilF	NA	NA
NA	ERZ3164912.7	177278	178660	-	silC	Cu(+)/Ag(+) efflux RND transporter outer membrane channel SilC	plus	STRESS	METAL	COPPER/SILVER	COPPER/SILVER	BLASTX	461	461	100.00	98.05	461	SPD96884.1	Cu(+)/Ag(+) efflux RND transporter outer membrane channel SilC	NA	NA
NA	ERZ3164912.7	178850	179527	+	silR	copper/silver response regulator transcription factor SilR	plus	STRESS	METAL	COPPER/SILVER	COPPER/SILVER	BLASTX	226	226	100.00	97.79	226	SPD96883.1	copper/silver response regulator transcription factor SilR	NA	NA
NA	ERZ3164912.7	179523	180995	+	silS	copper/silver sensor histidine kinase SilS	plus	STRESS	METAL	COPPER/SILVER	COPPER/SILVER	BLASTX	491	491	100.00	98.37	491	SPD96882.1	copper/silver sensor histidine kinase SilS	NA	NA
NA	ERZ3164912.7	181249	181677	+	silE	silver-binding protein SilE	plus	STRESS	METAL	SILVER	SILVER	EXACTX	143	143	100.00	100.00	143	AAD11743.1	silver-binding protein SilE	NA	NA
NA	ERZ3164912.70	1519	2715	-	tet(A)	tetracycline efflux MFS transporter Tet(A)	core	AMR	AMR	TETRACYCLINE	TETRACYCLINE	BLASTX	399	399	100.00	99.75	399	WP_000804064.1	tetracycline efflux MFS transporter Tet(A)	NA	NA
NA	ERZ3164912.74	913	2829	+	tet(M)	tetracycline resistance ribosomal protection protein Tet(M)	core	AMR	AMR	TETRACYCLINE	TETRACYCLINE	BLASTX	639	639	100.00	98.12	639	WP_063856397.1	tetracycline resistance ribosomal protection protein Tet(M)	NA	NA
NA	ERZ3164912.77	145	933	-	sul3	sulfonamide-resistant dihydropteroate synthase Sul3	core	AMR	AMR	SULFONAMIDE	SULFONAMIDE	EXACTX	263	263	100.00	100.00	263	WP_000034420.1	sulfonamide-resistant dihydropteroate synthase Sul3	NA	NA
NA	ERZ3164912.81	1171	2028	-	aac(3)-IId	aminoglycoside N-acetyltransferase AAC(3)-IId	core	AMR	AMR	AMINOGLYCOSIDE	GENTAMICIN	EXACTX	286	286	100.00	100.00	286	WP_000557454.1	aminoglycoside N-acetyltransferase AAC(3)-IId	NA	NA
NA	ERZ3164912.95	106	963	+	blaTEM-1	broad-spectrum class A beta-lactamase TEM-1	core	AMR	AMR	BETA-LACTAM	BETA-LACTAM	ALLELEX	286	286	100.00	100.00	286	WP_000027057.1	broad-spectrum class A beta-lactamase TEM-1	NA	NA
