Protein id	Contig id	Start	Stop	Strand	Element symbol	Element name	Scope	Type	Subtype	Class	Subclass	Method	Target length	Reference sequence length	% Coverage of reference	% Identity to reference	Alignment length	Closest reference accession	Closest reference name	HMM accession	HMM description
NA	ERZ3166146.1	202054	203469	+	espX1	type III secretion system effector EspX1	plus	VIRULENCE	VIRULENCE	NA	NA	BLASTX	472	473	99.79	92.16	472	ADD54679.1	type III secretion system effector EspX1	NA	NA
NA	ERZ3166146.10	60160	61959	+	ybtP	yersiniabactin ABC transporter ATP-binding/permease protein YbtP	plus	VIRULENCE	VIRULENCE	NA	NA	BLASTX	600	600	100.00	99.67	600	CAA21388.1	yersiniabactin ABC transporter ATP-binding/permease protein YbtP	NA	NA
NA	ERZ3166146.10	61949	63748	+	ybtQ	yersiniabactin ABC transporter ATP-binding/permease protein YbtQ	plus	VIRULENCE	VIRULENCE	NA	NA	BLASTX	600	600	100.00	99.50	600	AAC69584.1	yersiniabactin ABC transporter ATP-binding/permease protein YbtQ	NA	NA
NA	ERZ3166146.10	100157	100486	+	emrE	multidrug efflux SMR transporter EmrE	plus	STRESS	BIOCIDE	EFFLUX	EFFLUX	BLASTX	110	110	100.00	98.18	110	CAA77936.1	multidrug efflux SMR transporter EmrE	NA	NA
NA	ERZ3166146.100	793	1263	+	dfrA17	trimethoprim-resistant dihydrofolate reductase DfrA17	core	AMR	AMR	TRIMETHOPRIM	TRIMETHOPRIM	EXACTX	157	157	100.00	100.00	157	WP_001389366.1	trimethoprim-resistant dihydrofolate reductase DfrA17	NA	NA
NA	ERZ3166146.100	1397	2182	+	aadA5	ANT(3'')-Ia family aminoglycoside nucleotidyltransferase AadA5	core	AMR	AMR	AMINOGLYCOSIDE	STREPTOMYCIN	EXACTX	262	262	100.00	100.00	262	WP_000503573.1	ANT(3'')-Ia family aminoglycoside nucleotidyltransferase AadA5	NA	NA
NA	ERZ3166146.100	2391	2735	+	qacEdelta1	quaternary ammonium compound efflux SMR transporter QacE delta 1	core	STRESS	BIOCIDE	QUATERNARY AMMONIUM	QUATERNARY AMMONIUM	ALLELEX	115	115	100.00	100.00	115	WP_000679427.1	quaternary ammonium compound efflux SMR transporter QacE delta 1	NA	NA
NA	ERZ3166146.100	2732	3568	+	sul1	sulfonamide-resistant dihydropteroate synthase Sul1	core	AMR	AMR	SULFONAMIDE	SULFONAMIDE	EXACTX	279	279	100.00	100.00	279	WP_000259031.1	sulfonamide-resistant dihydropteroate synthase Sul1	NA	NA
NA	ERZ3166146.100	8885	9787	-	mph(A)	Mph(A) family macrolide 2'-phosphotransferase	core	AMR	AMR	MACROLIDE	AZITHROMYCIN/ERYTHROMYCIN/SPIRAMYCIN/TELITHROMYCIN	EXACTX	301	301	100.00	100.00	301	WP_000219391.1	Mph(A) family macrolide 2'-phosphotransferase	NA	NA
NA	ERZ3166146.119	1478	2674	-	tet(A)	tetracycline efflux MFS transporter Tet(A)	core	AMR	AMR	TETRACYCLINE	TETRACYCLINE	EXACTX	399	399	100.00	100.00	399	WP_000804064.1	tetracycline efflux MFS transporter Tet(A)	NA	NA
NA	ERZ3166146.119	3731	4564	-	aph(6)-Id	aminoglycoside O-phosphotransferase APH(6)-Id	core	AMR	AMR	AMINOGLYCOSIDE	STREPTOMYCIN	EXACTX	278	278	100.00	100.00	278	WP_000480972.1	aminoglycoside O-phosphotransferase APH(6)-Id	NA	NA
NA	ERZ3166146.119	4567	5367	-	aph(3'')-Ib	aminoglycoside O-phosphotransferase APH(3'')-Ib	core	AMR	AMR	AMINOGLYCOSIDE	STREPTOMYCIN	EXACTX	267	267	100.00	100.00	267	WP_001082319.1	aminoglycoside O-phosphotransferase APH(3'')-Ib	NA	NA
NA	ERZ3166146.119	5431	6243	-	sul2	sulfonamide-resistant dihydropteroate synthase Sul2	core	AMR	AMR	SULFONAMIDE	SULFONAMIDE	EXACTX	271	271	100.00	100.00	271	WP_001043260.1	sulfonamide-resistant dihydropteroate synthase Sul2	NA	NA
NA	ERZ3166146.120	1862	5746	-	sat	serine protease autotransporter toxin Sat	plus	VIRULENCE	VIRULENCE	NA	NA	EXACTX	1295	1295	100.00	100.00	1295	CAE55775.1	serine protease autotransporter toxin Sat	NA	NA
NA	ERZ3166146.124	303	1160	+	blaTEM-1	broad-spectrum class A beta-lactamase TEM-1	core	AMR	AMR	BETA-LACTAM	BETA-LACTAM	ALLELEX	286	286	100.00	100.00	286	WP_000027057.1	broad-spectrum class A beta-lactamase TEM-1	NA	NA
NA	ERZ3166146.130	709	1653	-	iucB	N(6)-hydroxylysine O-acetyltransferase IucB	plus	VIRULENCE	VIRULENCE	NA	NA	BLASTX	315	315	100.00	99.68	315	AAN82074.1	N(6)-hydroxylysine O-acetyltransferase IucB	NA	NA
NA	ERZ3166146.130	1657	3378	-	iucA	aerobactin synthase IucA	plus	VIRULENCE	VIRULENCE	NA	NA	BLASTX	574	576	100.00	98.44	576	EGI25746.1	aerobactin synthase IucA	NA	NA
NA	ERZ3166146.135	594	1094	+	papF	P fimbrial tip protein PapF	plus	VIRULENCE	VIRULENCE	NA	NA	BLASTX	167	167	100.00	98.20	167	CAA43569.1	P fimbrial tip protein PapF	NA	NA
NA	ERZ3166146.142	5	2191	-	iutA	ferric aerobactin receptor IutA	plus	VIRULENCE	VIRULENCE	NA	NA	BLASTX	729	731	99.73	89.85	729	AAN45165.2	ferric aerobactin receptor IutA	NA	NA
NA	ERZ3166146.142	2288	3562	-	iucD	NADPH-dependent L-lysine N(6)-monooxygenase IucD	plus	VIRULENCE	VIRULENCE	NA	NA	BLASTX	425	445	95.51	97.65	425	AAD44749.1	NADPH-dependent L-lysine N(6)-monooxygenase IucD	NA	NA
NA	ERZ3166146.158	1712	1996	+	papA	P fimbria major subunit PapA	plus	VIRULENCE	VIRULENCE	NA	NA	PARTIALX	95	185	51.89	86.46	96	CAA43562.1	P fimbria major subunit PapA	NA	NA
NA	ERZ3166146.16	31851	34475	-	gyrA_S83L	Escherichia quinolone resistant GyrA	core	AMR	POINT	QUINOLONE	QUINOLONE	POINTX	875	878	99.66	99.09	875	WP_001281243.1	DNA gyrase subunit A GyrA	NA	NA
NA	ERZ3166146.161	187	1044	-	aac(3)-IId	aminoglycoside N-acetyltransferase AAC(3)-IId	core	AMR	AMR	AMINOGLYCOSIDE	GENTAMICIN	EXACTX	286	286	100.00	100.00	286	WP_000557454.1	aminoglycoside N-acetyltransferase AAC(3)-IId	NA	NA
NA	ERZ3166146.209	2	955	-	iucC	NIS family aerobactin synthetase IucC	plus	VIRULENCE	VIRULENCE	NA	NA	PARTIAL_CONTIG_ENDX	318	580	54.83	99.37	318	AAN82073.1	NIS family aerobactin synthetase IucC	NA	NA
NA	ERZ3166146.27	181	444	+	ariR	biofilm/acid-resistance regulator AriR	plus	STRESS	ACID	NA	NA	EXACTX	88	88	100.00	100.00	88	AAC74250.1	biofilm/acid-resistance regulator AriR	NA	NA
NA	ERZ3166146.4	27227	29482	-	parC_S80I	Escherichia quinolone resistant ParC	core	AMR	POINT	QUINOLONE	QUINOLONE	POINTX	752	752	100.00	99.87	752	WP_001281881.1	DNA topoisomerase IV subunit A ParC	NA	NA
NA	ERZ3166146.55	22828	25929	+	acrF	multidrug efflux RND transporter permease subunit AcrF	plus	AMR	AMR	EFFLUX	EFFLUX	BLASTX	1034	1034	100.00	99.90	1034	AAC76298.1	multidrug efflux RND transporter permease subunit AcrF	NA	NA
NA	ERZ3166146.57	16081	17211	-	blaEC	BlaEC family class C beta-lactamase	plus	AMR	AMR	BETA-LACTAM	BETA-LACTAM	BLASTX	377	377	100.00	98.41	377	WP_063610930.1	extended-spectrum class C beta-lactamase EC-15	NA	NA
NA	ERZ3166146.74	15512	19759	-	fdeC	inverse autotransporter adhesin FdeC	plus	VIRULENCE	VIRULENCE	NA	NA	BLASTX	1416	1416	100.00	94.14	1416	ABE05822.1	inverse autotransporter adhesin FdeC	NA	NA
NA	ERZ3166146.75	5914	8001	-	iha	bifunctional siderophore receptor/adhesin Iha	plus	VIRULENCE	VIRULENCE	NA	NA	EXACTX	696	696	100.00	100.00	696	ADN47767.1	bifunctional siderophore receptor/adhesin Iha	NA	NA
NA	ERZ3166146.76	18480	19706	-	mdtM	multidrug efflux MFS transporter MdtM	plus	AMR	AMR	EFFLUX	EFFLUX	BLASTX	409	410	99.76	97.31	409	AAC77293.1	multidrug efflux MFS transporter MdtM	NA	NA
NA	ERZ3166146.97	8469	9641	+	senB	enterotoxin production-related protein TieB	plus	VIRULENCE	VIRULENCE	NA	NA	EXACTX	391	391	100.00	100.00	391	AAZ89288.1	enterotoxin production-related protein TieB	NA	NA
NA	ERZ3166146.99	709	1653	-	iucB	N(6)-hydroxylysine O-acetyltransferase IucB	plus	VIRULENCE	VIRULENCE	NA	NA	BLASTX	315	315	100.00	96.19	315	AAN82074.1	N(6)-hydroxylysine O-acetyltransferase IucB	NA	NA
NA	ERZ3166146.99	1657	3378	-	iucA	aerobactin synthase IucA	plus	VIRULENCE	VIRULENCE	NA	NA	BLASTX	574	576	100.00	96.01	576	EGI25746.1	aerobactin synthase IucA	NA	NA
