Protein id	Contig id	Start	Stop	Strand	Element symbol	Element name	Scope	Type	Subtype	Class	Subclass	Method	Target length	Reference sequence length	% Coverage of reference	% Identity to reference	Alignment length	Closest reference accession	Closest reference name	HMM accession	HMM description
NA	ERZ3164757.130	484	747	-	ariR	biofilm/acid-resistance regulator AriR	plus	STRESS	ACID	NA	NA	BLASTX	88	88	100.00	97.73	88	AAC74250.1	biofilm/acid-resistance regulator AriR	NA	NA
NA	ERZ3164757.142	68	2830	+	vactox	vacuolating autotransporter toxin Vat	plus	VIRULENCE	VIRULENCE	NA	NA	PARTIALX	921	1376	66.93	100.00	921	CAD66214.1	vacuolating autotransporter toxin Vat	NA	NA
NA	ERZ3164757.15	12928	14058	+	blaEC	BlaEC family class C beta-lactamase	plus	AMR	AMR	BETA-LACTAM	BETA-LACTAM	BLASTX	377	377	100.00	99.73	377	AAZ85965.1	cephalosporin-hydrolyzing class C beta-lactamase EC-5	NA	NA
NA	ERZ3164757.25	23563	27927	-	clbN	colibactin non-ribosomal peptide synthetase ClbN	plus	VIRULENCE	VIRULENCE	NA	NA	EXACTX	1455	1455	100.00	100.00	1455	AMH08480.1	colibactin non-ribosomal peptide synthetase ClbN	NA	NA
NA	ERZ3164757.25	58026	64091	-	clbB	colibactin hybrid non-ribosomal peptide synthetase/type I polyketide synthase ClbB	plus	VIRULENCE	VIRULENCE	NA	NA	PARTIALX	2022	3206	63.07	100.00	2022	AMQ58400.1	colibactin hybrid non-ribosomal peptide synthetase/type I polyketide synthase ClbB	NA	NA
NA	ERZ3164757.30	322	4566	+	fdeC	inverse autotransporter adhesin FdeC	plus	VIRULENCE	VIRULENCE	NA	NA	BLASTX	1415	1416	100.00	97.95	1416	ABE05822.1	inverse autotransporter adhesin FdeC	NA	NA
NA	ERZ3164757.33	33221	33652	-	marR_S3N	Escherichia ampicillin/chloramphenicol/quinolone/rifampin/tetracycline resistant MarR	core	AMR	POINT	MULTIDRUG	AMPICILLIN/CHLORAMPHENICOL/QUINOLONE/RIFAMPIN/TETRACYCLINE	POINTX	144	144	100.00	97.92	144	WP_000843414.1	transcriptional regulator MarR	NA	NA
NA	ERZ3164757.39	17395	18207	+	sul2	sulfonamide-resistant dihydropteroate synthase Sul2	core	AMR	AMR	SULFONAMIDE	SULFONAMIDE	EXACTX	271	271	100.00	100.00	271	WP_001043260.1	sulfonamide-resistant dihydropteroate synthase Sul2	NA	NA
NA	ERZ3164757.39	18271	19071	+	aph(3'')-Ib	aminoglycoside O-phosphotransferase APH(3'')-Ib	core	AMR	AMR	AMINOGLYCOSIDE	STREPTOMYCIN	EXACTX	267	267	100.00	100.00	267	WP_001082319.1	aminoglycoside O-phosphotransferase APH(3'')-Ib	NA	NA
NA	ERZ3164757.39	19333	20190	-	blaTEM-1	broad-spectrum class A beta-lactamase TEM-1	core	AMR	AMR	BETA-LACTAM	BETA-LACTAM	ALLELEX	286	286	100.00	100.00	286	WP_000027057.1	broad-spectrum class A beta-lactamase TEM-1	NA	NA
NA	ERZ3164757.39	24134	24862	+	aph(6)-Id	aminoglycoside O-phosphotransferase APH(6)-Id	core	AMR	AMR	AMINOGLYCOSIDE	STREPTOMYCIN	PARTIALX	243	278	87.41	100.00	243	WP_000480968.1	aminoglycoside O-phosphotransferase APH(6)-Id	NA	NA
NA	ERZ3164757.4	30103	34662	-	sslE	lipoprotein metalloprotease SslE	plus	VIRULENCE	VIRULENCE	NA	NA	BLASTX	1520	1520	100.00	94.09	1522	ADE89421.1	lipoprotein metalloprotease SslE	NA	NA
NA	ERZ3164757.47	19878	21677	+	ybtP	yersiniabactin ABC transporter ATP-binding/permease protein YbtP	plus	VIRULENCE	VIRULENCE	NA	NA	BLASTX	600	600	100.00	99.83	600	CAA21388.1	yersiniabactin ABC transporter ATP-binding/permease protein YbtP	NA	NA
NA	ERZ3164757.47	21667	23466	+	ybtQ	yersiniabactin ABC transporter ATP-binding/permease protein YbtQ	plus	VIRULENCE	VIRULENCE	NA	NA	BLASTX	600	600	100.00	99.67	600	AAC69584.1	yersiniabactin ABC transporter ATP-binding/permease protein YbtQ	NA	NA
NA	ERZ3164757.67	5193	8294	-	acrF	multidrug efflux RND transporter permease subunit AcrF	plus	AMR	AMR	EFFLUX	EFFLUX	BLASTX	1034	1034	100.00	99.42	1034	AAC76298.1	multidrug efflux RND transporter permease subunit AcrF	NA	NA
NA	ERZ3164757.7	102178	102468	-	iss	increased serum survival lipoprotein Iss	plus	VIRULENCE	VIRULENCE	NA	NA	EXACTX	97	97	100.00	100.00	97	ADN71659.1	increased serum survival lipoprotein Iss	NA	NA
NA	ERZ3164757.72	4348	4677	-	emrE	multidrug efflux SMR transporter EmrE	plus	STRESS	BIOCIDE	EFFLUX	EFFLUX	BLASTX	110	110	100.00	98.18	110	CAA77936.1	multidrug efflux SMR transporter EmrE	NA	NA
NA	ERZ3164757.78	4027	5214	+	emrD	multidrug efflux MFS transporter EmrD	plus	AMR	AMR	EFFLUX	EFFLUX	BLASTX	396	396	100.00	99.24	396	EFF04178.1	multidrug efflux MFS transporter EmrD	NA	NA
NA	ERZ3164757.79	9126	9674	+	papA	P fimbria major subunit PapA	plus	VIRULENCE	VIRULENCE	NA	NA	BLASTX	183	184	100.00	83.70	184	ENA25238.1	P fimbria major subunit PapA	NA	NA
NA	ERZ3164757.79	10386	12893	+	papC	P fimbrial usher protein PapC	plus	VIRULENCE	VIRULENCE	NA	NA	BLASTX	836	836	100.00	96.55	841	CAA43564.1	P fimbrial usher protein PapC	NA	NA
NA	ERZ3164757.79	15488	15988	+	papF	P fimbrial tip protein PapF	plus	VIRULENCE	VIRULENCE	NA	NA	BLASTX	167	167	100.00	97.01	167	CAA43569.1	P fimbrial tip protein PapF	NA	NA
NA	ERZ3164757.79	16035	17039	+	papG-III	P fimbria tip G-adhesin PapG-III	plus	VIRULENCE	VIRULENCE	NA	NA	BLASTX	335	335	100.00	98.51	335	CAA43558.1	P fimbria tip G-adhesin PapG-III	NA	NA
NA	ERZ3164757.83	2241	2729	-	sfaS	S-fimbrial adhesin minor subunit SfaS	plus	VIRULENCE	VIRULENCE	NA	NA	BLASTX	163	163	100.00	99.39	163	ABE06598.1	S-fimbrial adhesin minor subunit SfaS	NA	NA
NA	ERZ3164757.83	3294	5921	-	sfaF	S/F1C fimbrial biogenesis usher protein SfaF/FocD	plus	VIRULENCE	VIRULENCE	NA	NA	BLASTX	876	876	100.00	99.32	876	ASJ31253.1	S/F1C fimbrial biogenesis usher protein SfaF/FocD	NA	NA
NA	ERZ3164757.89	2766	3878	+	iroB	salmochelin biosynthesis C-glycosyltransferase IroB	plus	VIRULENCE	VIRULENCE	NA	NA	BLASTX	371	371	100.00	99.46	371	EOW04219.1	salmochelin biosynthesis C-glycosyltransferase IroB	NA	NA
NA	ERZ3164757.89	4021	7677	+	iroC	salmochelin/enterobactin export ABC transporter IroC	plus	VIRULENCE	VIRULENCE	NA	NA	BLASTX	1219	1219	100.00	99.43	1219	AUH19662.1	salmochelin/enterobactin export ABC transporter IroC	NA	NA
NA	ERZ3164757.89	7784	9010	+	iroD	catecholate siderophore esterase IroD	plus	VIRULENCE	VIRULENCE	NA	NA	BLASTX	409	409	100.00	99.27	409	ACJ63529.1	catecholate siderophore esterase IroD	NA	NA
NA	ERZ3164757.89	9098	10051	+	iroE	catecholate siderophore esterase IroE	plus	VIRULENCE	VIRULENCE	NA	NA	BLASTX	318	318	100.00	99.06	318	ACJ63530.1	catecholate siderophore esterase IroE	NA	NA
NA	ERZ3164757.89	10102	12276	-	iroN	siderophore salmochelin receptor IroN	plus	VIRULENCE	VIRULENCE	NA	NA	BLASTX	725	725	100.00	99.31	725	ABB61187.1	siderophore salmochelin receptor IroN	NA	NA
