Protein id	Contig id	Start	Stop	Strand	Element symbol	Element name	Scope	Type	Subtype	Class	Subclass	Method	Target length	Reference sequence length	% Coverage of reference	% Identity to reference	Alignment length	Closest reference accession	Closest reference name	HMM accession	HMM description
NA	ERZ3164810.1	293660	293989	-	emrE	multidrug efflux SMR transporter EmrE	plus	STRESS	BIOCIDE	EFFLUX	EFFLUX	BLASTX	110	110	100.00	98.18	110	CAA77936.1	multidrug efflux SMR transporter EmrE	NA	NA
NA	ERZ3164810.1	352090	353889	-	ybtQ	yersiniabactin ABC transporter ATP-binding/permease protein YbtQ	plus	VIRULENCE	VIRULENCE	NA	NA	BLASTX	600	600	100.00	99.50	600	AAC69584.1	yersiniabactin ABC transporter ATP-binding/permease protein YbtQ	NA	NA
NA	ERZ3164810.1	353879	355678	-	ybtP	yersiniabactin ABC transporter ATP-binding/permease protein YbtP	plus	VIRULENCE	VIRULENCE	NA	NA	BLASTX	600	600	100.00	99.83	600	CAA21388.1	yersiniabactin ABC transporter ATP-binding/permease protein YbtP	NA	NA
NA	ERZ3164810.1	398982	403346	-	clbN	colibactin non-ribosomal peptide synthetase ClbN	plus	VIRULENCE	VIRULENCE	NA	NA	EXACTX	1455	1455	100.00	100.00	1455	AMH08480.1	colibactin non-ribosomal peptide synthetase ClbN	NA	NA
NA	ERZ3164810.1	433445	443062	-	clbB	colibactin hybrid non-ribosomal peptide synthetase/type I polyketide synthase ClbB	plus	VIRULENCE	VIRULENCE	NA	NA	EXACTX	3206	3206	100.00	100.00	3206	AMQ58400.1	colibactin hybrid non-ribosomal peptide synthetase/type I polyketide synthase ClbB	NA	NA
NA	ERZ3164810.16	76034	76297	-	ariR	biofilm/acid-resistance regulator AriR	plus	STRESS	ACID	NA	NA	BLASTX	88	88	100.00	97.73	88	AAC74250.1	biofilm/acid-resistance regulator AriR	NA	NA
NA	ERZ3164810.18	57738	61985	-	fdeC	inverse autotransporter adhesin FdeC	plus	VIRULENCE	VIRULENCE	NA	NA	BLASTX	1416	1416	100.00	99.79	1416	ABE05822.1	inverse autotransporter adhesin FdeC	NA	NA
NA	ERZ3164810.18	81686	85813	+	vactox	vacuolating autotransporter toxin Vat	plus	VIRULENCE	VIRULENCE	NA	NA	BLASTX	1376	1376	100.00	99.93	1376	AAN78874.1	vacuolating autotransporter toxin Vat	NA	NA
NA	ERZ3164810.19	3128	4315	+	emrD	multidrug efflux MFS transporter EmrD	plus	AMR	AMR	EFFLUX	EFFLUX	BLASTX	396	396	100.00	99.49	396	EFF04178.1	multidrug efflux MFS transporter EmrD	NA	NA
NA	ERZ3164810.2	407125	408132	-	papG-II	P fimbria tip G-adhesin PapG-II	plus	VIRULENCE	VIRULENCE	NA	NA	BLASTX	336	337	100.00	98.52	337	AAA24293.1	P fimbria tip G-adhesin PapG-II	NA	NA
NA	ERZ3164810.2	408179	408676	-	papF	P fimbrial tip protein PapF	plus	VIRULENCE	VIRULENCE	NA	NA	BLASTX	166	167	100.00	91.02	167	CAA43569.1	P fimbrial tip protein PapF	NA	NA
NA	ERZ3164810.2	411277	413784	-	papC	P fimbrial usher protein PapC	plus	VIRULENCE	VIRULENCE	NA	NA	BLASTX	836	836	100.00	96.31	841	CAA43564.1	P fimbrial usher protein PapC	NA	NA
NA	ERZ3164810.2	413846	414406	-	papH	P fimbrial minor subunit PapH	plus	VIRULENCE	VIRULENCE	NA	NA	BLASTX	187	195	95.90	93.05	187	CAA43563.1	P fimbrial minor subunit PapH	NA	NA
NA	ERZ3164810.22	62851	63981	-	blaEC-5	cephalosporin-hydrolyzing class C beta-lactamase EC-5	plus	AMR	AMR	BETA-LACTAM	CEPHALOSPORIN	ALLELEX	377	377	100.00	100.00	377	AAZ85965.1	cephalosporin-hydrolyzing class C beta-lactamase EC-5	NA	NA
NA	ERZ3164810.29	44285	48397	+	pic	serine protease autotransporter toxin Pic	plus	VIRULENCE	VIRULENCE	NA	NA	EXACTX	1371	1371	100.00	100.00	1371	AAN78833.1	serine protease autotransporter toxin Pic	NA	NA
NA	ERZ3164810.38	328	618	+	iss	increased serum survival lipoprotein Iss	plus	VIRULENCE	VIRULENCE	NA	NA	EXACTX	97	97	100.00	100.00	97	ADN71659.1	increased serum survival lipoprotein Iss	NA	NA
NA	ERZ3164810.4	335373	338474	+	acrF	multidrug efflux RND transporter permease subunit AcrF	plus	AMR	AMR	EFFLUX	EFFLUX	BLASTX	1034	1034	100.00	99.52	1034	AAC76298.1	multidrug efflux RND transporter permease subunit AcrF	NA	NA
NA	ERZ3164810.42	15474	16586	+	iroB	salmochelin biosynthesis C-glycosyltransferase IroB	plus	VIRULENCE	VIRULENCE	NA	NA	BLASTX	371	371	100.00	99.19	371	EOW04219.1	salmochelin biosynthesis C-glycosyltransferase IroB	NA	NA
NA	ERZ3164810.42	16729	20385	+	iroC	salmochelin/enterobactin export ABC transporter IroC	plus	VIRULENCE	VIRULENCE	NA	NA	BLASTX	1219	1219	100.00	99.59	1219	AUH19662.1	salmochelin/enterobactin export ABC transporter IroC	NA	NA
NA	ERZ3164810.42	20492	21718	+	iroD	catecholate siderophore esterase IroD	plus	VIRULENCE	VIRULENCE	NA	NA	BLASTX	409	409	100.00	99.51	409	ACJ63529.1	catecholate siderophore esterase IroD	NA	NA
NA	ERZ3164810.42	21806	22759	+	iroE	catecholate siderophore esterase IroE	plus	VIRULENCE	VIRULENCE	NA	NA	BLASTX	318	318	100.00	99.06	318	ACJ63530.1	catecholate siderophore esterase IroE	NA	NA
NA	ERZ3164810.42	22810	24984	-	iroN	siderophore salmochelin receptor IroN	plus	VIRULENCE	VIRULENCE	NA	NA	EXACTX	725	725	100.00	100.00	725	AAN79707.1	siderophore salmochelin receptor IroN	NA	NA
NA	ERZ3164810.46	13007	13231	+	mchB	microcin H47	plus	VIRULENCE	VIRULENCE	NA	NA	EXACTX	75	75	100.00	100.00	75	CAB54534.2	microcin H47	NA	NA
NA	ERZ3164810.46	17069	19045	+	mchF	microcin H47 export transporter peptidase/ATP-binding subunit MchF	plus	VIRULENCE	VIRULENCE	NA	NA	BLASTX	659	698	94.41	99.09	659	CAD56186.1	microcin H47 export transporter peptidase/ATP-binding subunit MchF	NA	NA
