Protein id	Contig id	Start	Stop	Strand	Element symbol	Element name	Scope	Type	Subtype	Class	Subclass	Method	Target length	Reference sequence length	% Coverage of reference	% Identity to reference	Alignment length	Closest reference accession	Closest reference name	HMM accession	HMM description
NA	ERZ3166325.10	59040	61295	-	parC_E84V	Escherichia quinolone resistant ParC	core	AMR	POINT	QUINOLONE	QUINOLONE	POINTX	752	752	100.00	99.20	752	WP_001281881.1	DNA topoisomerase IV subunit A ParC	NA	NA
NA	ERZ3166325.10	59040	61295	-	parC_S80I	Escherichia quinolone resistant ParC	core	AMR	POINT	QUINOLONE	QUINOLONE	POINTX	752	752	100.00	99.20	752	WP_001281881.1	DNA topoisomerase IV subunit A ParC	NA	NA
NA	ERZ3166325.10	76291	78180	-	parE_I529L	Escherichia quinolone resistant ParE	core	AMR	POINT	QUINOLONE	QUINOLONE	POINTX	630	630	100.00	99.52	630	WP_033554192.1	DNA topoisomerase IV subunit B ParE	NA	NA
NA	ERZ3166325.109	159	710	+	aac(6')-Ib-cr5	fluoroquinolone-acetylating aminoglycoside 6'-N-acetyltransferase AAC(6')-Ib-cr5	core	AMR	AMR	AMINOGLYCOSIDE/QUINOLONE	AMIKACIN/KANAMYCIN/QUINOLONE/TOBRAMYCIN	ALLELEX	184	184	100.00	100.00	184	WP_063840321.1	fluoroquinolone-acetylating aminoglycoside 6'-N-acetyltransferase AAC(6')-Ib-cr5	NA	NA
NA	ERZ3166325.109	844	1671	+	blaOXA-1	oxacillin-hydrolyzing class D beta-lactamase OXA-1	core	AMR	AMR	BETA-LACTAM	CEPHALOSPORIN	ALLELEX	276	276	100.00	100.00	276	WP_001334766.1	oxacillin-hydrolyzing class D beta-lactamase OXA-1	NA	NA
NA	ERZ3166325.109	1812	2252	+	catB3	type B-3 chloramphenicol O-acetyltransferase CatB3	core	AMR	AMR	PHENICOL	CHLORAMPHENICOL	PARTIALX	147	210	70.00	100.00	147	WP_000186237.1	type B-3 chloramphenicol O-acetyltransferase CatB3	NA	NA
NA	ERZ3166325.12	5193	8294	-	acrF	multidrug efflux RND transporter permease subunit AcrF	plus	AMR	AMR	EFFLUX	EFFLUX	BLASTX	1034	1034	100.00	99.52	1034	AAC76298.1	multidrug efflux RND transporter permease subunit AcrF	NA	NA
NA	ERZ3166325.125	6	512	-	papA	P fimbria major subunit PapA	plus	VIRULENCE	VIRULENCE	NA	NA	BLASTX	169	185	90.27	85.29	170	CAA43562.1	P fimbria major subunit PapA	NA	NA
NA	ERZ3166325.13	118671	119000	-	emrE	multidrug efflux SMR transporter EmrE	plus	STRESS	BIOCIDE	EFFLUX	EFFLUX	BLASTX	110	110	100.00	98.18	110	CAA77936.1	multidrug efflux SMR transporter EmrE	NA	NA
NA	ERZ3166325.16	14871	15134	+	ariR	biofilm/acid-resistance regulator AriR	plus	STRESS	ACID	NA	NA	BLASTX	88	88	100.00	97.73	88	AAC74250.1	biofilm/acid-resistance regulator AriR	NA	NA
NA	ERZ3166325.2	135007	137631	-	gyrA_D87N	Escherichia quinolone resistant GyrA	core	AMR	POINT	QUINOLONE	QUINOLONE	POINTX	875	878	99.66	98.86	875	WP_001281243.1	DNA gyrase subunit A GyrA	NA	NA
NA	ERZ3166325.2	135007	137631	-	gyrA_S83L	Escherichia quinolone resistant GyrA	core	AMR	POINT	QUINOLONE	QUINOLONE	POINTX	875	878	99.66	98.86	875	WP_001281243.1	DNA gyrase subunit A GyrA	NA	NA
NA	ERZ3166325.28	57541	59340	+	ybtP	yersiniabactin ABC transporter ATP-binding/permease protein YbtP	plus	VIRULENCE	VIRULENCE	NA	NA	BLASTX	600	600	100.00	99.50	600	CAA21388.1	yersiniabactin ABC transporter ATP-binding/permease protein YbtP	NA	NA
NA	ERZ3166325.28	59330	61129	+	ybtQ	yersiniabactin ABC transporter ATP-binding/permease protein YbtQ	plus	VIRULENCE	VIRULENCE	NA	NA	BLASTX	600	600	100.00	99.50	600	AAC69584.1	yersiniabactin ABC transporter ATP-binding/permease protein YbtQ	NA	NA
NA	ERZ3166325.3	205906	210150	-	fdeC	inverse autotransporter adhesin FdeC	plus	VIRULENCE	VIRULENCE	NA	NA	BLASTX	1415	1416	100.00	96.75	1416	ABE05822.1	inverse autotransporter adhesin FdeC	NA	NA
NA	ERZ3166325.32	2274	5315	-	cnf1	cytotoxic necrotizing factor CNF1	plus	VIRULENCE	VIRULENCE	NA	NA	EXACTX	1014	1014	100.00	100.00	1014	ABE10324.1	cytotoxic necrotizing factor CNF1	NA	NA
NA	ERZ3166325.32	9913	12984	-	hlyA-alpha	RTX toxin hemolysin HlyA	plus	VIRULENCE	VIRULENCE	NA	NA	BLASTX	1024	1024	100.00	97.27	1024	CAQ77251.1	RTX toxin hemolysin HlyA	NA	NA
NA	ERZ3166325.39	14924	16054	-	blaEC	BlaEC family class C beta-lactamase	plus	AMR	AMR	BETA-LACTAM	BETA-LACTAM	BLASTX	377	377	100.00	98.94	377	AAZ85965.1	cephalosporin-hydrolyzing class C beta-lactamase EC-5	NA	NA
NA	ERZ3166325.4	198603	199829	+	mdtM	multidrug efflux MFS transporter MdtM	plus	AMR	AMR	EFFLUX	EFFLUX	BLASTX	409	410	99.76	97.31	409	AAC77293.1	multidrug efflux MFS transporter MdtM	NA	NA
NA	ERZ3166325.42	15347	15637	+	iss	increased serum survival lipoprotein Iss	plus	VIRULENCE	VIRULENCE	NA	NA	EXACTX	97	97	100.00	100.00	97	ADN71659.1	increased serum survival lipoprotein Iss	NA	NA
NA	ERZ3166325.46	5916	8003	-	iha	bifunctional siderophore receptor/adhesin Iha	plus	VIRULENCE	VIRULENCE	NA	NA	EXACTX	696	696	100.00	100.00	696	ADN47767.1	bifunctional siderophore receptor/adhesin Iha	NA	NA
NA	ERZ3166325.52	8668	9864	-	tet(A)	tetracycline efflux MFS transporter Tet(A)	core	AMR	AMR	TETRACYCLINE	TETRACYCLINE	EXACTX	399	399	100.00	100.00	399	WP_000804064.1	tetracycline efflux MFS transporter Tet(A)	NA	NA
NA	ERZ3166325.58	1	759	-	iucD	NADPH-dependent L-lysine N(6)-monooxygenase IucD	plus	VIRULENCE	VIRULENCE	NA	NA	PARTIAL_CONTIG_ENDX	253	445	56.85	97.63	253	AAD44749.1	NADPH-dependent L-lysine N(6)-monooxygenase IucD	NA	NA
NA	ERZ3166325.58	759	2498	-	iucC	NIS family aerobactin synthetase IucC	plus	VIRULENCE	VIRULENCE	NA	NA	BLASTX	580	580	100.00	99.14	580	AAN82073.1	NIS family aerobactin synthetase IucC	NA	NA
NA	ERZ3166325.58	2501	3445	-	iucB	N(6)-hydroxylysine O-acetyltransferase IucB	plus	VIRULENCE	VIRULENCE	NA	NA	BLASTX	315	315	100.00	99.37	315	AAN82074.1	N(6)-hydroxylysine O-acetyltransferase IucB	NA	NA
NA	ERZ3166325.58	3449	5170	-	iucA	aerobactin synthase IucA	plus	VIRULENCE	VIRULENCE	NA	NA	BLASTX	574	576	100.00	98.61	576	EGI25746.1	aerobactin synthase IucA	NA	NA
NA	ERZ3166325.6	82517	83704	-	emrD	multidrug efflux MFS transporter EmrD	plus	AMR	AMR	EFFLUX	EFFLUX	BLASTX	396	396	100.00	98.99	396	EFF04178.1	multidrug efflux MFS transporter EmrD	NA	NA
NA	ERZ3166325.6	91254	92642	+	uhpT_E350Q	Escherichia fosfomycin resistant UhpT	core	AMR	POINT	FOSFOMYCIN	FOSFOMYCIN	POINTX	463	463	100.00	99.78	463	WP_000879194.1	hexose phosphate transporter UhpT	NA	NA
NA	ERZ3166325.60	1554	2024	+	dfrA17	trimethoprim-resistant dihydrofolate reductase DfrA17	core	AMR	AMR	TRIMETHOPRIM	TRIMETHOPRIM	EXACTX	157	157	100.00	100.00	157	WP_001389366.1	trimethoprim-resistant dihydrofolate reductase DfrA17	NA	NA
NA	ERZ3166325.60	2158	2943	+	aadA5	ANT(3'')-Ia family aminoglycoside nucleotidyltransferase AadA5	core	AMR	AMR	AMINOGLYCOSIDE	STREPTOMYCIN	EXACTX	262	262	100.00	100.00	262	WP_000503573.1	ANT(3'')-Ia family aminoglycoside nucleotidyltransferase AadA5	NA	NA
NA	ERZ3166325.60	3152	3496	+	qacEdelta1	quaternary ammonium compound efflux SMR transporter QacE delta 1	core	STRESS	BIOCIDE	QUATERNARY AMMONIUM	QUATERNARY AMMONIUM	ALLELEX	115	115	100.00	100.00	115	WP_000679427.1	quaternary ammonium compound efflux SMR transporter QacE delta 1	NA	NA
NA	ERZ3166325.60	3493	4329	+	sul1	sulfonamide-resistant dihydropteroate synthase Sul1	core	AMR	AMR	SULFONAMIDE	SULFONAMIDE	EXACTX	279	279	100.00	100.00	279	WP_000259031.1	sulfonamide-resistant dihydropteroate synthase Sul1	NA	NA
NA	ERZ3166325.60	9646	10548	-	mph(A)	Mph(A) family macrolide 2'-phosphotransferase	core	AMR	AMR	MACROLIDE	AZITHROMYCIN/ERYTHROMYCIN/SPIRAMYCIN/TELITHROMYCIN	EXACTX	301	301	100.00	100.00	301	WP_000219391.1	Mph(A) family macrolide 2'-phosphotransferase	NA	NA
NA	ERZ3166325.68	828	3335	+	papC	P fimbrial usher protein PapC	plus	VIRULENCE	VIRULENCE	NA	NA	BLASTX	836	836	100.00	96.20	841	CAA43564.1	P fimbrial usher protein PapC	NA	NA
NA	ERZ3166325.68	5936	6433	+	papF	P fimbrial tip protein PapF	plus	VIRULENCE	VIRULENCE	NA	NA	BLASTX	166	167	100.00	91.02	167	CAA43569.1	P fimbrial tip protein PapF	NA	NA
NA	ERZ3166325.68	6480	7487	+	papG-II	P fimbria tip G-adhesin PapG-II	plus	VIRULENCE	VIRULENCE	NA	NA	BLASTX	336	337	100.00	97.92	337	AAA24293.1	P fimbria tip G-adhesin PapG-II	NA	NA
NA	ERZ3166325.79	1010	4894	+	sat	serine protease autotransporter toxin Sat	plus	VIRULENCE	VIRULENCE	NA	NA	EXACTX	1295	1295	100.00	100.00	1295	CAE55775.1	serine protease autotransporter toxin Sat	NA	NA
NA	ERZ3166325.8	171984	173708	-	ptsI_V25I	Escherichia fosfomycin resistant PtsI	core	AMR	POINT	FOSFOMYCIN	FOSFOMYCIN	POINTX	575	575	100.00	99.65	575	WP_000623140.1	phosphoenolpyruvate--protein phosphotransferase PtsI	NA	NA
NA	ERZ3166325.89	1813	2685	-	blaCTX-M-15	extended-spectrum class A beta-lactamase CTX-M-15	core	AMR	AMR	BETA-LACTAM	CEPHALOSPORIN	ALLELEX	291	291	100.00	100.00	291	WP_000239590.1	extended-spectrum class A beta-lactamase CTX-M-15	NA	NA
NA	ERZ3166325.95	5	2191	-	iutA	ferric aerobactin receptor IutA	plus	VIRULENCE	VIRULENCE	NA	NA	BLASTX	729	731	99.73	89.85	729	AAN45165.2	ferric aerobactin receptor IutA	NA	NA
NA	ERZ3166325.98	1767	2624	-	aac(3)-IIe	aminoglycoside N-acetyltransferase AAC(3)-IIe	core	AMR	AMR	AMINOGLYCOSIDE	GENTAMICIN	EXACTX	286	286	100.00	100.00	286	WP_000557452.1	aminoglycoside N-acetyltransferase AAC(3)-IIe	NA	NA
