Protein id	Contig id	Start	Stop	Strand	Element symbol	Element name	Scope	Type	Subtype	Class	Subclass	Method	Target length	Reference sequence length	% Coverage of reference	% Identity to reference	Alignment length	Closest reference accession	Closest reference name	HMM accession	HMM description
NA	ERZ3166318.15	13220	14350	+	blaEC	BlaEC family class C beta-lactamase	plus	AMR	AMR	BETA-LACTAM	BETA-LACTAM	BLASTX	377	377	100.00	98.94	377	AAZ85965.1	cephalosporin-hydrolyzing class C beta-lactamase EC-5	NA	NA
NA	ERZ3166318.16	101804	102067	-	ariR	biofilm/acid-resistance regulator AriR	plus	STRESS	ACID	NA	NA	BLASTX	88	88	100.00	97.73	88	AAC74250.1	biofilm/acid-resistance regulator AriR	NA	NA
NA	ERZ3166318.2	110368	112992	+	gyrA_S83L	Escherichia quinolone resistant GyrA	core	AMR	POINT	QUINOLONE	QUINOLONE	POINTX	875	878	99.66	98.86	875	WP_001281243.1	DNA gyrase subunit A GyrA	NA	NA
NA	ERZ3166318.23	12661	14385	+	ptsI_V25I	Escherichia fosfomycin resistant PtsI	core	AMR	POINT	FOSFOMYCIN	FOSFOMYCIN	POINTX	575	575	100.00	99.65	575	WP_000623140.1	phosphoenolpyruvate--protein phosphotransferase PtsI	NA	NA
NA	ERZ3166318.27	11757	12086	-	emrE	multidrug efflux SMR transporter EmrE	plus	STRESS	BIOCIDE	EFFLUX	EFFLUX	BLASTX	110	110	100.00	99.09	110	CAA77936.1	multidrug efflux SMR transporter EmrE	NA	NA
NA	ERZ3166318.3	35875	37674	+	ybtP	yersiniabactin ABC transporter ATP-binding/permease protein YbtP	plus	VIRULENCE	VIRULENCE	NA	NA	BLASTX	600	600	100.00	99.50	600	CAA21388.1	yersiniabactin ABC transporter ATP-binding/permease protein YbtP	NA	NA
NA	ERZ3166318.3	37664	39463	+	ybtQ	yersiniabactin ABC transporter ATP-binding/permease protein YbtQ	plus	VIRULENCE	VIRULENCE	NA	NA	BLASTX	600	600	100.00	99.33	600	AAC69584.1	yersiniabactin ABC transporter ATP-binding/permease protein YbtQ	NA	NA
NA	ERZ3166318.3	75054	75383	+	emrE	multidrug efflux SMR transporter EmrE	plus	STRESS	BIOCIDE	EFFLUX	EFFLUX	BLASTX	110	110	100.00	98.18	110	CAA77936.1	multidrug efflux SMR transporter EmrE	NA	NA
NA	ERZ3166318.39	1927	3648	+	iucA	aerobactin synthase IucA	plus	VIRULENCE	VIRULENCE	NA	NA	BLASTX	574	576	100.00	98.61	576	EGI25746.1	aerobactin synthase IucA	NA	NA
NA	ERZ3166318.39	3652	4596	+	iucB	N(6)-hydroxylysine O-acetyltransferase IucB	plus	VIRULENCE	VIRULENCE	NA	NA	BLASTX	315	315	100.00	99.37	315	AAN82074.1	N(6)-hydroxylysine O-acetyltransferase IucB	NA	NA
NA	ERZ3166318.39	4599	6338	+	iucC	NIS family aerobactin synthetase IucC	plus	VIRULENCE	VIRULENCE	NA	NA	BLASTX	580	580	100.00	99.14	580	AAN82073.1	NIS family aerobactin synthetase IucC	NA	NA
NA	ERZ3166318.39	6338	7612	+	iucD	NADPH-dependent L-lysine N(6)-monooxygenase IucD	plus	VIRULENCE	VIRULENCE	NA	NA	BLASTX	425	445	95.51	97.65	425	AAD44749.1	NADPH-dependent L-lysine N(6)-monooxygenase IucD	NA	NA
NA	ERZ3166318.39	7709	9895	+	iutA	ferric aerobactin receptor IutA	plus	VIRULENCE	VIRULENCE	NA	NA	BLASTX	729	731	99.73	89.85	729	AAN45165.2	ferric aerobactin receptor IutA	NA	NA
NA	ERZ3166318.39	10842	14726	+	sat	serine protease autotransporter toxin Sat	plus	VIRULENCE	VIRULENCE	NA	NA	BLASTX	1295	1295	100.00	99.85	1295	CAE55775.1	serine protease autotransporter toxin Sat	NA	NA
NA	ERZ3166318.4	5193	8294	-	acrF	multidrug efflux RND transporter permease subunit AcrF	plus	AMR	AMR	EFFLUX	EFFLUX	BLASTX	1034	1034	100.00	99.42	1034	AAC76298.1	multidrug efflux RND transporter permease subunit AcrF	NA	NA
NA	ERZ3166318.4	241877	243766	+	parE_I529L	Escherichia quinolone resistant ParE	core	AMR	POINT	QUINOLONE	QUINOLONE	POINTX	630	630	100.00	99.52	630	WP_033554192.1	DNA topoisomerase IV subunit B ParE	NA	NA
NA	ERZ3166318.40	15710	16567	-	blaTEM-1	broad-spectrum class A beta-lactamase TEM-1	core	AMR	AMR	BETA-LACTAM	BETA-LACTAM	ALLELEX	286	286	100.00	100.00	286	WP_000027057.1	broad-spectrum class A beta-lactamase TEM-1	NA	NA
NA	ERZ3166318.45	142	1350	+	mdtM	multidrug efflux MFS transporter MdtM	plus	AMR	AMR	EFFLUX	EFFLUX	BLASTX	403	410	98.29	97.52	403	AAC77293.1	multidrug efflux MFS transporter MdtM	NA	NA
NA	ERZ3166318.49	648	2735	+	iha	bifunctional siderophore receptor/adhesin Iha	plus	VIRULENCE	VIRULENCE	NA	NA	EXACTX	696	696	100.00	100.00	696	ADN47767.1	bifunctional siderophore receptor/adhesin Iha	NA	NA
NA	ERZ3166318.5	205951	210195	-	fdeC	inverse autotransporter adhesin FdeC	plus	VIRULENCE	VIRULENCE	NA	NA	BLASTX	1415	1416	100.00	96.82	1416	ABE05822.1	inverse autotransporter adhesin FdeC	NA	NA
NA	ERZ3166318.51	134	1036	+	mph(A)	Mph(A) family macrolide 2'-phosphotransferase	core	AMR	AMR	MACROLIDE	AZITHROMYCIN/ERYTHROMYCIN/SPIRAMYCIN/TELITHROMYCIN	EXACTX	301	301	100.00	100.00	301	WP_000219391.1	Mph(A) family macrolide 2'-phosphotransferase	NA	NA
NA	ERZ3166318.51	6353	7189	-	sul1	sulfonamide-resistant dihydropteroate synthase Sul1	core	AMR	AMR	SULFONAMIDE	SULFONAMIDE	EXACTX	279	279	100.00	100.00	279	WP_000259031.1	sulfonamide-resistant dihydropteroate synthase Sul1	NA	NA
NA	ERZ3166318.51	7186	7530	-	qacEdelta1	quaternary ammonium compound efflux SMR transporter QacE delta 1	core	STRESS	BIOCIDE	QUATERNARY AMMONIUM	QUATERNARY AMMONIUM	ALLELEX	115	115	100.00	100.00	115	WP_000679427.1	quaternary ammonium compound efflux SMR transporter QacE delta 1	NA	NA
NA	ERZ3166318.51	7739	8524	-	aadA5	ANT(3'')-Ia family aminoglycoside nucleotidyltransferase AadA5	core	AMR	AMR	AMINOGLYCOSIDE	STREPTOMYCIN	BLASTX	262	262	100.00	99.62	262	WP_000503573.1	ANT(3'')-Ia family aminoglycoside nucleotidyltransferase AadA5	NA	NA
NA	ERZ3166318.51	8658	9128	-	dfrA17	trimethoprim-resistant dihydrofolate reductase DfrA17	core	AMR	AMR	TRIMETHOPRIM	TRIMETHOPRIM	EXACTX	157	157	100.00	100.00	157	WP_001389366.1	trimethoprim-resistant dihydrofolate reductase DfrA17	NA	NA
NA	ERZ3166318.56	1665	2837	-	senB	enterotoxin production-related protein TieB	plus	VIRULENCE	VIRULENCE	NA	NA	EXACTX	391	391	100.00	100.00	391	AAZ89288.1	enterotoxin production-related protein TieB	NA	NA
NA	ERZ3166318.57	548	1360	+	sul2	sulfonamide-resistant dihydropteroate synthase Sul2	core	AMR	AMR	SULFONAMIDE	SULFONAMIDE	EXACTX	271	271	100.00	100.00	271	WP_001043260.1	sulfonamide-resistant dihydropteroate synthase Sul2	NA	NA
NA	ERZ3166318.57	1424	2224	+	aph(3'')-Ib	aminoglycoside O-phosphotransferase APH(3'')-Ib	core	AMR	AMR	AMINOGLYCOSIDE	STREPTOMYCIN	EXACTX	267	267	100.00	100.00	267	WP_001082319.1	aminoglycoside O-phosphotransferase APH(3'')-Ib	NA	NA
NA	ERZ3166318.57	2227	3060	+	aph(6)-Id	aminoglycoside O-phosphotransferase APH(6)-Id	core	AMR	AMR	AMINOGLYCOSIDE	STREPTOMYCIN	EXACTX	278	278	100.00	100.00	278	WP_000480972.1	aminoglycoside O-phosphotransferase APH(6)-Id	NA	NA
NA	ERZ3166318.57	4117	5313	+	tet(A)	tetracycline efflux MFS transporter Tet(A)	core	AMR	AMR	TETRACYCLINE	TETRACYCLINE	EXACTX	399	399	100.00	100.00	399	WP_000804064.1	tetracycline efflux MFS transporter Tet(A)	NA	NA
NA	ERZ3166318.69	2262	2546	+	papA	P fimbria major subunit PapA	plus	VIRULENCE	VIRULENCE	NA	NA	PARTIALX	95	185	51.89	86.46	96	CAA43562.1	P fimbria major subunit PapA	NA	NA
NA	ERZ3166318.7	82335	83522	-	emrD	multidrug efflux MFS transporter EmrD	plus	AMR	AMR	EFFLUX	EFFLUX	BLASTX	396	396	100.00	98.99	396	EFF04178.1	multidrug efflux MFS transporter EmrD	NA	NA
NA	ERZ3166318.7	91072	92460	+	uhpT_E350Q	Escherichia fosfomycin resistant UhpT	core	AMR	POINT	FOSFOMYCIN	FOSFOMYCIN	POINTX	463	463	100.00	99.78	463	WP_000879194.1	hexose phosphate transporter UhpT	NA	NA
NA	ERZ3166318.84	103	960	+	aac(3)-IId	aminoglycoside N-acetyltransferase AAC(3)-IId	core	AMR	AMR	AMINOGLYCOSIDE	GENTAMICIN	EXACTX	286	286	100.00	100.00	286	WP_000557454.1	aminoglycoside N-acetyltransferase AAC(3)-IId	NA	NA
