Protein id	Contig id	Start	Stop	Strand	Element symbol	Element name	Scope	Type	Subtype	Class	Subclass	Method	Target length	Reference sequence length	% Coverage of reference	% Identity to reference	Alignment length	Closest reference accession	Closest reference name	HMM accession	HMM description
NA	ERZ3164400.11	98242	99471	+	mdtM	multidrug efflux MFS transporter MdtM	plus	AMR	AMR	EFFLUX	EFFLUX	EXACTX	410	410	100.00	100.00	410	AAC77293.1	multidrug efflux MFS transporter MdtM	NA	NA
NA	ERZ3164400.124	916	1206	-	iss	increased serum survival lipoprotein Iss	plus	VIRULENCE	VIRULENCE	NA	NA	EXACTX	97	97	100.00	100.00	97	ADR26561.1	increased serum survival lipoprotein Iss	NA	NA
NA	ERZ3164400.131	682	1338	-	catA1	type A-1 chloramphenicol O-acetyltransferase	core	AMR	AMR	PHENICOL	CHLORAMPHENICOL	EXACTX	219	219	100.00	100.00	219	WP_000412211.1	type A-1 chloramphenicol O-acetyltransferase	NA	NA
NA	ERZ3164400.155	268	381	-	astA	heat-stable enterotoxin EAST1	plus	VIRULENCE	VIRULENCE	NA	NA	EXACTX	38	38	100.00	100.00	38	AAM88299.1	heat-stable enterotoxin EAST1	NA	NA
NA	ERZ3164400.2	5803	8904	-	acrF	multidrug efflux RND transporter permease subunit AcrF	plus	AMR	AMR	EFFLUX	EFFLUX	BLASTX	1034	1034	100.00	99.61	1034	AAC76298.1	multidrug efflux RND transporter permease subunit AcrF	NA	NA
NA	ERZ3164400.2	264342	266597	+	parC_E84K	Escherichia quinolone resistant ParC	core	AMR	POINT	QUINOLONE	QUINOLONE	POINTX	752	752	100.00	99.87	752	WP_001281881.1	DNA topoisomerase IV subunit A ParC	NA	NA
NA	ERZ3164400.34	8791	13038	-	fdeC	inverse autotransporter adhesin FdeC	plus	VIRULENCE	VIRULENCE	NA	NA	BLASTX	1416	1416	100.00	94.21	1416	ABE05822.1	inverse autotransporter adhesin FdeC	NA	NA
NA	ERZ3164400.38	30142	32187	-	ireA	TonB-dependent siderophore receptor IreA	plus	VIRULENCE	VIRULENCE	NA	NA	BLASTX	682	682	100.00	99.85	682	AAN83596.1	TonB-dependent siderophore receptor IreA	NA	NA
NA	ERZ3164400.45	9849	10418	-	lpfA-O113	long polar fimbria major subunit LpfA-O113	plus	VIRULENCE	VIRULENCE	NA	NA	EXACTX	190	190	100.00	100.00	190	AAT76975.1	long polar fimbria major subunit LpfA-O113	NA	NA
NA	ERZ3164400.46	12816	13060	+	ampC_C-42T	Escherichia cephalosporin resistant ampC promoter	core	AMR	POINT	BETA-LACTAM	CEPHALOSPORIN	POINTN	245	245	100.00	97.55	245	NZ_CP041538.1:1149245-1149489	ampC/blaEC promoter region	NA	NA
NA	ERZ3164400.46	12928	14058	+	blaEC	BlaEC family class C beta-lactamase	plus	AMR	AMR	BETA-LACTAM	BETA-LACTAM	BLASTX	377	377	100.00	99.47	377	WP_063610930.1	extended-spectrum class C beta-lactamase EC-15	NA	NA
NA	ERZ3164400.5	11372	12445	-	espX1	type III secretion system effector EspX1	plus	VIRULENCE	VIRULENCE	NA	NA	PARTIALX	358	473	75.69	89.39	358	ADD54679.1	type III secretion system effector EspX1	NA	NA
NA	ERZ3164400.52	2946	3254	+	cvaC	colicin V	plus	VIRULENCE	VIRULENCE	NA	NA	EXACTX	103	103	100.00	100.00	103	CAA40746.1	colicin V	NA	NA
NA	ERZ3164400.52	3430	5523	-	cvaB	colicin V export peptidase/ABC transporter CvaB	plus	VIRULENCE	VIRULENCE	NA	NA	EXACTX	698	698	100.00	100.00	698	CAA40744.1	colicin V export peptidase/ABC transporter CvaB	NA	NA
NA	ERZ3164400.52	10704	12878	+	iroN	siderophore salmochelin receptor IroN	plus	VIRULENCE	VIRULENCE	NA	NA	EXACTX	725	725	100.00	100.00	725	AAN76093.1	siderophore salmochelin receptor IroN	NA	NA
NA	ERZ3164400.52	12929	13882	-	iroE	catecholate siderophore esterase IroE	plus	VIRULENCE	VIRULENCE	NA	NA	BLASTX	318	318	100.00	99.69	318	ACJ63530.1	catecholate siderophore esterase IroE	NA	NA
NA	ERZ3164400.52	13970	15196	-	iroD	catecholate siderophore esterase IroD	plus	VIRULENCE	VIRULENCE	NA	NA	BLASTX	409	409	100.00	99.76	409	ACJ63529.1	catecholate siderophore esterase IroD	NA	NA
NA	ERZ3164400.52	15303	18959	-	iroC	salmochelin/enterobactin export ABC transporter IroC	plus	VIRULENCE	VIRULENCE	NA	NA	BLASTX	1219	1219	100.00	99.51	1219	AUH19662.1	salmochelin/enterobactin export ABC transporter IroC	NA	NA
NA	ERZ3164400.52	19102	20214	-	iroB	salmochelin biosynthesis C-glycosyltransferase IroB	plus	VIRULENCE	VIRULENCE	NA	NA	BLASTX	371	371	100.00	99.73	371	EOW04219.1	salmochelin biosynthesis C-glycosyltransferase IroB	NA	NA
NA	ERZ3164400.54	17955	18218	+	ariR	biofilm/acid-resistance regulator AriR	plus	STRESS	ACID	NA	NA	EXACTX	88	88	100.00	100.00	88	AAC74250.1	biofilm/acid-resistance regulator AriR	NA	NA
NA	ERZ3164400.59	5074	5544	+	dfrA1	trimethoprim-resistant dihydrofolate reductase DfrA1	core	AMR	AMR	TRIMETHOPRIM	TRIMETHOPRIM	EXACTX	157	157	100.00	100.00	157	WP_000777555.1	trimethoprim-resistant dihydrofolate reductase DfrA1	NA	NA
NA	ERZ3164400.59	5640	6428	+	aadA1	ANT(3'')-Ia family aminoglycoside nucleotidyltransferase AadA1	core	AMR	AMR	AMINOGLYCOSIDE	STREPTOMYCIN	EXACTX	263	263	100.00	100.00	263	WP_001206316.1	ANT(3'')-Ia family aminoglycoside nucleotidyltransferase AadA1	NA	NA
NA	ERZ3164400.59	6595	6939	+	qacEdelta1	quaternary ammonium compound efflux SMR transporter QacE delta 1	core	STRESS	BIOCIDE	QUATERNARY AMMONIUM	QUATERNARY AMMONIUM	ALLELEX	115	115	100.00	100.00	115	WP_000679427.1	quaternary ammonium compound efflux SMR transporter QacE delta 1	NA	NA
NA	ERZ3164400.59	6936	7772	+	sul1	sulfonamide-resistant dihydropteroate synthase Sul1	core	AMR	AMR	SULFONAMIDE	SULFONAMIDE	EXACTX	279	279	100.00	100.00	279	WP_000259031.1	sulfonamide-resistant dihydropteroate synthase Sul1	NA	NA
NA	ERZ3164400.59	16659	17078	-	merC	organomercurial transporter MerC	plus	STRESS	METAL	MERCURY	ORGANOMERCURY	EXACTX	140	140	100.00	100.00	140	AAC33908.1	organomercurial transporter MerC	NA	NA
NA	ERZ3164400.59	17117	17389	-	merP	mercury resistance system periplasmic binding protein MerP	plus	STRESS	METAL	MERCURY	MERCURY	BLASTX	91	91	100.00	90.11	91	AAC38219.1	mercury resistance system periplasmic binding protein MerP	NA	NA
NA	ERZ3164400.59	17406	17753	-	merT	mercuric transport protein MerT	plus	STRESS	METAL	MERCURY	MERCURY	EXACTX	116	116	100.00	100.00	116	AAB59075.1	mercuric transport protein MerT	NA	NA
NA	ERZ3164400.59	17825	18256	+	merR	mercury resistance transcriptional regulator MerR	plus	STRESS	METAL	MERCURY	MERCURY	BLASTX	144	144	100.00	93.75	144	CAA77320.1	mercury resistance transcriptional regulator MerR	NA	NA
NA	ERZ3164400.6	168358	170982	+	gyrA_D87N	Escherichia quinolone resistant GyrA	core	AMR	POINT	QUINOLONE	QUINOLONE	POINTX	875	878	99.66	98.97	875	WP_001281243.1	DNA gyrase subunit A GyrA	NA	NA
NA	ERZ3164400.6	168358	170982	+	gyrA_S83L	Escherichia quinolone resistant GyrA	core	AMR	POINT	QUINOLONE	QUINOLONE	POINTX	875	878	99.66	98.97	875	WP_001281243.1	DNA gyrase subunit A GyrA	NA	NA
NA	ERZ3164400.63	539	2725	-	iutA	ferric aerobactin receptor IutA	plus	VIRULENCE	VIRULENCE	NA	NA	BLASTX	729	731	99.73	89.71	729	AAN45165.2	ferric aerobactin receptor IutA	NA	NA
NA	ERZ3164400.63	2822	4096	-	iucD	NADPH-dependent L-lysine N(6)-monooxygenase IucD	plus	VIRULENCE	VIRULENCE	NA	NA	BLASTX	425	445	95.51	97.65	425	AAD44749.1	NADPH-dependent L-lysine N(6)-monooxygenase IucD	NA	NA
NA	ERZ3164400.63	4096	5835	-	iucC	NIS family aerobactin synthetase IucC	plus	VIRULENCE	VIRULENCE	NA	NA	BLASTX	580	580	100.00	97.59	580	AAN82073.1	NIS family aerobactin synthetase IucC	NA	NA
NA	ERZ3164400.63	5838	6782	-	iucB	N(6)-hydroxylysine O-acetyltransferase IucB	plus	VIRULENCE	VIRULENCE	NA	NA	BLASTX	315	315	100.00	95.87	315	AAN82074.1	N(6)-hydroxylysine O-acetyltransferase IucB	NA	NA
NA	ERZ3164400.63	6786	8507	-	iucA	aerobactin synthase IucA	plus	VIRULENCE	VIRULENCE	NA	NA	BLASTX	574	576	100.00	95.31	576	EGI25746.1	aerobactin synthase IucA	NA	NA
NA	ERZ3164400.65	9664	9954	+	iss	increased serum survival lipoprotein Iss	plus	VIRULENCE	VIRULENCE	NA	NA	EXACTX	97	97	100.00	100.00	97	CAR12622.1	increased serum survival lipoprotein Iss	NA	NA
NA	ERZ3164400.70	7336	8532	+	tet(A)	tetracycline efflux MFS transporter Tet(A)	core	AMR	AMR	TETRACYCLINE	TETRACYCLINE	EXACTX	399	399	100.00	100.00	399	WP_000804064.1	tetracycline efflux MFS transporter Tet(A)	NA	NA
NA	ERZ3164400.71	4726	7233	-	papC	P fimbrial usher protein PapC	plus	VIRULENCE	VIRULENCE	NA	NA	BLASTX	836	836	100.00	96.31	841	CAA43564.1	P fimbrial usher protein PapC	NA	NA
NA	ERZ3164400.71	7294	7854	-	papH	P fimbrial minor subunit PapH	plus	VIRULENCE	VIRULENCE	NA	NA	BLASTX	187	195	95.90	93.05	187	CAA43563.1	P fimbrial minor subunit PapH	NA	NA
NA	ERZ3164400.71	7944	8489	-	papA	P fimbria major subunit PapA	plus	VIRULENCE	VIRULENCE	NA	NA	BLASTX	182	184	100.00	83.15	184	ENA25238.1	P fimbria major subunit PapA	NA	NA
NA	ERZ3164400.82	4155	4967	-	aph(3')-Ia	aminoglycoside O-phosphotransferase APH(3')-Ia	core	AMR	AMR	AMINOGLYCOSIDE	KANAMYCIN	EXACTX	271	271	100.00	100.00	271	WP_000018326.1	aminoglycoside O-phosphotransferase APH(3')-Ia	NA	NA
NA	ERZ3164400.82	5854	6940	-	blaTEMp_G162T	Escherichia amoxicillin-clavulanic acid/piperacillin-tazobactam/ticarcillin-clavulanic acid resistant blaTEM promoter	core	AMR	POINT	BETA-LACTAM	AMOXICILLIN-CLAVULANIC_ACID/PIPERACILLIN-TAZOBACTAM/TICARCILLIN-CLAVULANIC_ACID	POINTN	1087	1176	92.43	99.54	1087	NZ_CP095603.1:148777-149952	blaTEM promoter region	NA	NA
NA	ERZ3164400.82	5875	6732	-	blaTEM-1	broad-spectrum class A beta-lactamase TEM-1	core	AMR	AMR	BETA-LACTAM	BETA-LACTAM	ALLELEX	286	286	100.00	100.00	286	WP_000027057.1	broad-spectrum class A beta-lactamase TEM-1	NA	NA
NA	ERZ3164400.93	1755	1868	+	astA	heat-stable enterotoxin EAST1	plus	VIRULENCE	VIRULENCE	NA	NA	EXACTX	38	38	100.00	100.00	38	AAD43578.1	heat-stable enterotoxin EAST1	NA	NA
