Protein id	Contig id	Start	Stop	Strand	Element symbol	Element name	Scope	Type	Subtype	Class	Subclass	Method	Target length	Reference sequence length	% Coverage of reference	% Identity to reference	Alignment length	Closest reference accession	Closest reference name	HMM accession	HMM description
NA	ERZ3164393.1	57640	59895	+	parC_S80I	Escherichia quinolone resistant ParC	core	AMR	POINT	QUINOLONE	QUINOLONE	POINTX	752	752	100.00	99.73	752	WP_001281881.1	DNA topoisomerase IV subunit A ParC	NA	NA
NA	ERZ3164393.108	636	4766	+	tsh	temperature-sensitive protease autotransporter hemagglutinin Tsh	plus	VIRULENCE	VIRULENCE	NA	NA	BLASTX	1377	1377	100.00	99.85	1377	AAT35241.2	temperature-sensitive protease autotransporter hemagglutinin Tsh	NA	NA
NA	ERZ3164393.12	59147	60565	+	espX1	type III secretion system effector EspX1	plus	VIRULENCE	VIRULENCE	NA	NA	BLASTX	473	473	100.00	92.81	473	ADD54679.1	type III secretion system effector EspX1	NA	NA
NA	ERZ3164393.13	104579	108826	-	fdeC	inverse autotransporter adhesin FdeC	plus	VIRULENCE	VIRULENCE	NA	NA	BLASTX	1416	1416	100.00	94.84	1416	ABE05822.1	inverse autotransporter adhesin FdeC	NA	NA
NA	ERZ3164393.147	736	1572	-	sul1	sulfonamide-resistant dihydropteroate synthase Sul1	core	AMR	AMR	SULFONAMIDE	SULFONAMIDE	EXACTX	279	279	100.00	100.00	279	WP_000259031.1	sulfonamide-resistant dihydropteroate synthase Sul1	NA	NA
NA	ERZ3164393.147	1569	1913	-	qacEdelta1	quaternary ammonium compound efflux SMR transporter QacE delta 1	core	STRESS	BIOCIDE	QUATERNARY AMMONIUM	QUATERNARY AMMONIUM	ALLELEX	115	115	100.00	100.00	115	WP_000679427.1	quaternary ammonium compound efflux SMR transporter QacE delta 1	NA	NA
NA	ERZ3164393.15	92826	94520	+	eilA	HilA family transcriptional regulator EilA	plus	VIRULENCE	VIRULENCE	NA	NA	BLASTX	565	565	100.00	99.47	565	ACB16655.1	HilA family transcriptional regulator EilA	NA	NA
NA	ERZ3164393.155	1068	1862	-	aadA13	ANT(3'')-Ia family aminoglycoside nucleotidyltransferase AadA13	core	AMR	AMR	AMINOGLYCOSIDE	STREPTOMYCIN	EXACTX	265	265	100.00	100.00	265	WP_001424636.1	ANT(3'')-Ia family aminoglycoside nucleotidyltransferase AadA13	NA	NA
NA	ERZ3164393.16	86991	88178	-	emrD	multidrug efflux MFS transporter EmrD	plus	AMR	AMR	EFFLUX	EFFLUX	BLASTX	396	396	100.00	99.75	396	EFF04178.1	multidrug efflux MFS transporter EmrD	NA	NA
NA	ERZ3164393.175	123	911	-	aadA1	ANT(3'')-Ia family aminoglycoside nucleotidyltransferase AadA1	core	AMR	AMR	AMINOGLYCOSIDE	STREPTOMYCIN	EXACTX	263	263	100.00	100.00	263	WP_001206317.1	ANT(3'')-Ia family aminoglycoside nucleotidyltransferase AadA1	NA	NA
NA	ERZ3164393.175	1007	1477	-	dfrA1	trimethoprim-resistant dihydrofolate reductase DfrA1	core	AMR	AMR	TRIMETHOPRIM	TRIMETHOPRIM	EXACTX	157	157	100.00	100.00	157	WP_000777555.1	trimethoprim-resistant dihydrofolate reductase DfrA1	NA	NA
NA	ERZ3164393.19	84069	85868	+	ybtP	yersiniabactin ABC transporter ATP-binding/permease protein YbtP	plus	VIRULENCE	VIRULENCE	NA	NA	BLASTX	600	600	100.00	99.50	600	CAA21388.1	yersiniabactin ABC transporter ATP-binding/permease protein YbtP	NA	NA
NA	ERZ3164393.19	85858	87657	+	ybtQ	yersiniabactin ABC transporter ATP-binding/permease protein YbtQ	plus	VIRULENCE	VIRULENCE	NA	NA	BLASTX	600	600	100.00	99.67	600	AAC69584.1	yersiniabactin ABC transporter ATP-binding/permease protein YbtQ	NA	NA
NA	ERZ3164393.20	49424	50650	-	mdtM	multidrug efflux MFS transporter MdtM	plus	AMR	AMR	EFFLUX	EFFLUX	BLASTX	409	410	99.76	98.29	409	AAC77293.1	multidrug efflux MFS transporter MdtM	NA	NA
NA	ERZ3164393.21	45133	47676	-	cyaA_S352T	Escherichia fosmidomycin resistant CyaA	core	AMR	POINT	FOSMIDOMYCIN	FOSMIDOMYCIN	POINTX	848	848	100.00	99.29	848	WP_000281668.1	adenylate cyclase CyaA	NA	NA
NA	ERZ3164393.23	5193	8294	-	acrF	multidrug efflux RND transporter permease subunit AcrF	plus	AMR	AMR	EFFLUX	EFFLUX	BLASTX	1034	1034	100.00	99.32	1034	AAC76298.1	multidrug efflux RND transporter permease subunit AcrF	NA	NA
NA	ERZ3164393.263	301	414	+	astA	heat-stable enterotoxin EAST1	plus	VIRULENCE	VIRULENCE	NA	NA	BLASTX	38	38	100.00	97.37	38	AAM88299.1	heat-stable enterotoxin EAST1	NA	NA
NA	ERZ3164393.27	47132	47368	+	emrE	multidrug efflux SMR transporter EmrE	plus	STRESS	BIOCIDE	EFFLUX	EFFLUX	PARTIALX	79	110	71.82	98.73	79	CAA77936.1	multidrug efflux SMR transporter EmrE	NA	NA
NA	ERZ3164393.27	56222	56512	-	iss	increased serum survival lipoprotein Iss	plus	VIRULENCE	VIRULENCE	NA	NA	EXACTX	97	97	100.00	100.00	97	BAG76115.1	increased serum survival lipoprotein Iss	NA	NA
NA	ERZ3164393.4	125788	128412	-	gyrA_D87G	Escherichia quinolone/triclosan resistant GyrA	core	AMR	POINT	QUINOLONE/TRICLOSAN	QUINOLONE/TRICLOSAN	POINTX	875	878	99.66	98.86	875	WP_001281243.1	DNA gyrase subunit A GyrA	NA	NA
NA	ERZ3164393.4	125788	128412	-	gyrA_S83L	Escherichia quinolone resistant GyrA	core	AMR	POINT	QUINOLONE	QUINOLONE	POINTX	875	878	99.66	98.86	875	WP_001281243.1	DNA gyrase subunit A GyrA	NA	NA
NA	ERZ3164393.46	23768	24898	-	blaEC	BlaEC family class C beta-lactamase	plus	AMR	AMR	BETA-LACTAM	BETA-LACTAM	BLASTX	377	377	100.00	97.88	377	AAZ85968.1	cephalosporin-hydrolyzing class C beta-lactamase EC-8	NA	NA
NA	ERZ3164393.55	5092	5991	+	hlyE	hemolysin HlyE	plus	VIRULENCE	VIRULENCE	NA	NA	INTERNAL_STOP	300	300	100.00	99.33	300	AAD28079.1	hemolysin HlyE	NA	NA
NA	ERZ3164393.55	27503	27829	+	emrE	multidrug efflux SMR transporter EmrE	plus	STRESS	BIOCIDE	EFFLUX	EFFLUX	INTERNAL_STOP	109	110	99.09	97.25	109	CAA77936.1	multidrug efflux SMR transporter EmrE	NA	NA
NA	ERZ3164393.58	17239	18096	+	blaTEM-1	broad-spectrum class A beta-lactamase TEM-1	core	AMR	AMR	BETA-LACTAM	BETA-LACTAM	ALLELEX	286	286	100.00	100.00	286	WP_000027057.1	broad-spectrum class A beta-lactamase TEM-1	NA	NA
NA	ERZ3164393.58	19139	20335	-	tet(A)	tetracycline efflux MFS transporter Tet(A)	core	AMR	AMR	TETRACYCLINE	TETRACYCLINE	BLASTX	399	399	100.00	99.75	399	WP_000804064.1	tetracycline efflux MFS transporter Tet(A)	NA	NA
NA	ERZ3164393.58	22155	22586	-	merR	mercury resistance transcriptional regulator MerR	plus	STRESS	METAL	MERCURY	MERCURY	BLASTX	144	144	100.00	93.75	144	CAA77320.1	mercury resistance transcriptional regulator MerR	NA	NA
NA	ERZ3164393.58	22658	23005	+	merT	mercuric transport protein MerT	plus	STRESS	METAL	MERCURY	MERCURY	EXACTX	116	116	100.00	100.00	116	AAB59075.1	mercuric transport protein MerT	NA	NA
NA	ERZ3164393.58	23022	23294	+	merP	mercury resistance system periplasmic binding protein MerP	plus	STRESS	METAL	MERCURY	MERCURY	BLASTX	91	91	100.00	90.11	91	AAC38219.1	mercury resistance system periplasmic binding protein MerP	NA	NA
NA	ERZ3164393.58	23333	23752	+	merC	organomercurial transporter MerC	plus	STRESS	METAL	MERCURY	ORGANOMERCURY	EXACTX	140	140	100.00	100.00	140	AAC33908.1	organomercurial transporter MerC	NA	NA
NA	ERZ3164393.63	726	1016	+	iss	increased serum survival lipoprotein Iss	plus	VIRULENCE	VIRULENCE	NA	NA	EXACTX	97	97	100.00	100.00	97	ADR26561.1	increased serum survival lipoprotein Iss	NA	NA
NA	ERZ3164393.63	4164	5276	+	iroB	salmochelin biosynthesis C-glycosyltransferase IroB	plus	VIRULENCE	VIRULENCE	NA	NA	BLASTX	371	371	100.00	99.73	371	EOW04219.1	salmochelin biosynthesis C-glycosyltransferase IroB	NA	NA
NA	ERZ3164393.63	5419	9075	+	iroC	salmochelin/enterobactin export ABC transporter IroC	plus	VIRULENCE	VIRULENCE	NA	NA	BLASTX	1219	1219	100.00	99.43	1219	AUH19662.1	salmochelin/enterobactin export ABC transporter IroC	NA	NA
NA	ERZ3164393.63	9182	10408	+	iroD	catecholate siderophore esterase IroD	plus	VIRULENCE	VIRULENCE	NA	NA	EXACTX	409	409	100.00	100.00	409	ACJ63529.1	catecholate siderophore esterase IroD	NA	NA
NA	ERZ3164393.63	10496	11449	+	iroE	catecholate siderophore esterase IroE	plus	VIRULENCE	VIRULENCE	NA	NA	BLASTX	318	318	100.00	99.69	318	ACJ63530.1	catecholate siderophore esterase IroE	NA	NA
NA	ERZ3164393.63	11500	13674	-	iroN	siderophore salmochelin receptor IroN	plus	VIRULENCE	VIRULENCE	NA	NA	EXACTX	725	725	100.00	100.00	725	AAN76093.1	siderophore salmochelin receptor IroN	NA	NA
NA	ERZ3164393.63	18844	20937	+	cvaB	colicin V export peptidase/ABC transporter CvaB	plus	VIRULENCE	VIRULENCE	NA	NA	EXACTX	698	698	100.00	100.00	698	CAA40744.1	colicin V export peptidase/ABC transporter CvaB	NA	NA
NA	ERZ3164393.63	21113	21421	-	cvaC	colicin V	plus	VIRULENCE	VIRULENCE	NA	NA	EXACTX	103	103	100.00	100.00	103	CAA40746.1	colicin V	NA	NA
NA	ERZ3164393.67	14676	16760	+	iha	bifunctional siderophore receptor/adhesin Iha	plus	VIRULENCE	VIRULENCE	NA	NA	EXACTX	695	695	100.00	100.00	695	ACB20136.1	bifunctional siderophore receptor/adhesin Iha	NA	NA
NA	ERZ3164393.71	2467	4188	+	iucA	aerobactin synthase IucA	plus	VIRULENCE	VIRULENCE	NA	NA	BLASTX	574	576	100.00	95.31	576	EGI25746.1	aerobactin synthase IucA	NA	NA
NA	ERZ3164393.71	4192	5136	+	iucB	N(6)-hydroxylysine O-acetyltransferase IucB	plus	VIRULENCE	VIRULENCE	NA	NA	BLASTX	315	315	100.00	96.19	315	AAN82074.1	N(6)-hydroxylysine O-acetyltransferase IucB	NA	NA
NA	ERZ3164393.71	5139	6878	+	iucC	NIS family aerobactin synthetase IucC	plus	VIRULENCE	VIRULENCE	NA	NA	BLASTX	580	580	100.00	97.07	580	AAN82073.1	NIS family aerobactin synthetase IucC	NA	NA
NA	ERZ3164393.71	6878	8152	+	iucD	NADPH-dependent L-lysine N(6)-monooxygenase IucD	plus	VIRULENCE	VIRULENCE	NA	NA	BLASTX	425	445	95.51	97.41	425	AAD44749.1	NADPH-dependent L-lysine N(6)-monooxygenase IucD	NA	NA
NA	ERZ3164393.71	8249	10435	+	iutA	ferric aerobactin receptor IutA	plus	VIRULENCE	VIRULENCE	NA	NA	BLASTX	729	731	99.73	89.16	729	AAN45165.2	ferric aerobactin receptor IutA	NA	NA
NA	ERZ3164393.75	8723	8986	-	ariR	biofilm/acid-resistance regulator AriR	plus	STRESS	ACID	NA	NA	BLASTX	88	88	100.00	98.86	88	AAC74250.1	biofilm/acid-resistance regulator AriR	NA	NA
NA	ERZ3164393.80	3418	4236	+	cdtB	cytolethal distending toxin type I nuclease subunit CdtB	plus	VIRULENCE	VIRULENCE	NA	NA	EXACTX	273	273	100.00	100.00	273	BAF63361.1	cytolethal distending toxin type I nuclease subunit CdtB	NA	NA
NA	ERZ3164393.99	201	2246	+	ireA	TonB-dependent siderophore receptor IreA	plus	VIRULENCE	VIRULENCE	NA	NA	BLASTX	682	682	100.00	99.71	682	AAN83596.1	TonB-dependent siderophore receptor IreA	NA	NA
