Protein id	Contig id	Start	Stop	Strand	Element symbol	Element name	Scope	Type	Subtype	Class	Subclass	Method	Target length	Reference sequence length	% Coverage of reference	% Identity to reference	Alignment length	Closest reference accession	Closest reference name	HMM accession	HMM description
NA	ERZ3165618.11	14702	24319	+	clbB	colibactin hybrid non-ribosomal peptide synthetase/type I polyketide synthase ClbB	plus	VIRULENCE	VIRULENCE	NA	NA	EXACTX	3206	3206	100.00	100.00	3206	AMQ58400.1	colibactin hybrid non-ribosomal peptide synthetase/type I polyketide synthase ClbB	NA	NA
NA	ERZ3165618.11	54418	58782	+	clbN	colibactin non-ribosomal peptide synthetase ClbN	plus	VIRULENCE	VIRULENCE	NA	NA	EXACTX	1455	1455	100.00	100.00	1455	AMH08480.1	colibactin non-ribosomal peptide synthetase ClbN	NA	NA
NA	ERZ3165618.11	102087	103886	+	ybtP	yersiniabactin ABC transporter ATP-binding/permease protein YbtP	plus	VIRULENCE	VIRULENCE	NA	NA	BLASTX	600	600	100.00	99.83	600	CAA21388.1	yersiniabactin ABC transporter ATP-binding/permease protein YbtP	NA	NA
NA	ERZ3165618.11	103876	105675	+	ybtQ	yersiniabactin ABC transporter ATP-binding/permease protein YbtQ	plus	VIRULENCE	VIRULENCE	NA	NA	BLASTX	600	600	100.00	99.67	600	AAC69584.1	yersiniabactin ABC transporter ATP-binding/permease protein YbtQ	NA	NA
NA	ERZ3165618.110	43	531	+	sfaS	S-fimbrial adhesin minor subunit SfaS	plus	VIRULENCE	VIRULENCE	NA	NA	BLASTX	163	163	100.00	99.39	163	ABE06598.1	S-fimbrial adhesin minor subunit SfaS	NA	NA
NA	ERZ3165618.15	81795	82982	-	emrD	multidrug efflux MFS transporter EmrD	plus	AMR	AMR	EFFLUX	EFFLUX	BLASTX	396	396	100.00	99.24	396	EFF04178.1	multidrug efflux MFS transporter EmrD	NA	NA
NA	ERZ3165618.17	12928	14058	+	blaEC	BlaEC family class C beta-lactamase	plus	AMR	AMR	BETA-LACTAM	BETA-LACTAM	BLASTX	377	377	100.00	99.73	377	AAZ85965.1	cephalosporin-hydrolyzing class C beta-lactamase EC-5	NA	NA
NA	ERZ3165618.2	30103	34662	-	sslE	lipoprotein metalloprotease SslE	plus	VIRULENCE	VIRULENCE	NA	NA	BLASTX	1520	1520	100.00	94.09	1522	ADE89421.1	lipoprotein metalloprotease SslE	NA	NA
NA	ERZ3165618.2	356005	359106	+	acrF	multidrug efflux RND transporter permease subunit AcrF	plus	AMR	AMR	EFFLUX	EFFLUX	BLASTX	1034	1034	100.00	99.42	1034	AAC76298.1	multidrug efflux RND transporter permease subunit AcrF	NA	NA
NA	ERZ3165618.20	9717	9980	+	ariR	biofilm/acid-resistance regulator AriR	plus	STRESS	ACID	NA	NA	BLASTX	88	88	100.00	97.73	88	AAC74250.1	biofilm/acid-resistance regulator AriR	NA	NA
NA	ERZ3165618.21	5358	9485	-	vactox	vacuolating autotransporter toxin Vat	plus	VIRULENCE	VIRULENCE	NA	NA	BLASTX	1376	1376	100.00	99.93	1376	CAD66214.1	vacuolating autotransporter toxin Vat	NA	NA
NA	ERZ3165618.21	29186	33430	+	fdeC	inverse autotransporter adhesin FdeC	plus	VIRULENCE	VIRULENCE	NA	NA	BLASTX	1415	1416	100.00	97.95	1416	ABE05822.1	inverse autotransporter adhesin FdeC	NA	NA
NA	ERZ3165618.22	63506	63937	-	marR_S3N	Escherichia ampicillin/chloramphenicol/quinolone/rifampin/tetracycline resistant MarR	core	AMR	POINT	MULTIDRUG	AMPICILLIN/CHLORAMPHENICOL/QUINOLONE/RIFAMPIN/TETRACYCLINE	POINTX	144	144	100.00	97.92	144	WP_000843414.1	transcriptional regulator MarR	NA	NA
NA	ERZ3165618.3	57171	57500	+	emrE	multidrug efflux SMR transporter EmrE	plus	STRESS	BIOCIDE	EFFLUX	EFFLUX	BLASTX	110	110	100.00	98.18	110	CAA77936.1	multidrug efflux SMR transporter EmrE	NA	NA
NA	ERZ3165618.38	24344	26389	-	ireA	TonB-dependent siderophore receptor IreA	plus	VIRULENCE	VIRULENCE	NA	NA	BLASTX	682	682	100.00	99.85	682	AAN83596.1	TonB-dependent siderophore receptor IreA	NA	NA
NA	ERZ3165618.45	587	2761	+	iroN	siderophore salmochelin receptor IroN	plus	VIRULENCE	VIRULENCE	NA	NA	BLASTX	725	725	100.00	99.31	725	ABB61187.1	siderophore salmochelin receptor IroN	NA	NA
NA	ERZ3165618.45	2812	3765	-	iroE	catecholate siderophore esterase IroE	plus	VIRULENCE	VIRULENCE	NA	NA	BLASTX	318	318	100.00	99.06	318	ACJ63530.1	catecholate siderophore esterase IroE	NA	NA
NA	ERZ3165618.45	3853	5079	-	iroD	catecholate siderophore esterase IroD	plus	VIRULENCE	VIRULENCE	NA	NA	BLASTX	409	409	100.00	99.27	409	ACJ63529.1	catecholate siderophore esterase IroD	NA	NA
NA	ERZ3165618.45	5186	8842	-	iroC	salmochelin/enterobactin export ABC transporter IroC	plus	VIRULENCE	VIRULENCE	NA	NA	BLASTX	1219	1219	100.00	99.34	1219	AUH19662.1	salmochelin/enterobactin export ABC transporter IroC	NA	NA
NA	ERZ3165618.45	8985	10097	-	iroB	salmochelin biosynthesis C-glycosyltransferase IroB	plus	VIRULENCE	VIRULENCE	NA	NA	BLASTX	371	371	100.00	99.46	371	EOW04219.1	salmochelin biosynthesis C-glycosyltransferase IroB	NA	NA
NA	ERZ3165618.57	1861	2151	-	iss	increased serum survival lipoprotein Iss	plus	VIRULENCE	VIRULENCE	NA	NA	EXACTX	97	97	100.00	100.00	97	ADN71659.1	increased serum survival lipoprotein Iss	NA	NA
NA	ERZ3165618.65	1048	1596	+	papA	P fimbria major subunit PapA	plus	VIRULENCE	VIRULENCE	NA	NA	BLASTX	183	184	100.00	83.70	184	ENA25238.1	P fimbria major subunit PapA	NA	NA
NA	ERZ3165618.65	2308	4815	+	papC	P fimbrial usher protein PapC	plus	VIRULENCE	VIRULENCE	NA	NA	BLASTX	836	836	100.00	96.55	841	CAA43564.1	P fimbrial usher protein PapC	NA	NA
NA	ERZ3165618.65	6814	7332	+	papE	P fimbrial minor subunit PapE	plus	VIRULENCE	VIRULENCE	NA	NA	BLASTX	173	173	100.00	99.42	173	CAA43568.1	P fimbrial minor subunit PapE	NA	NA
NA	ERZ3165618.70	70	1152	+	mchF	microcin H47 export transporter peptidase/ATP-binding subunit MchF	plus	VIRULENCE	VIRULENCE	NA	NA	PARTIALX	361	698	51.72	99.45	361	CAD56186.1	microcin H47 export transporter peptidase/ATP-binding subunit MchF	NA	NA
NA	ERZ3165618.71	1068	4109	+	cnf1	cytotoxic necrotizing factor CNF1	plus	VIRULENCE	VIRULENCE	NA	NA	EXACTX	1014	1014	100.00	100.00	1014	ABE10324.1	cytotoxic necrotizing factor CNF1	NA	NA
NA	ERZ3165618.73	1454	4081	+	sfaF	S/F1C fimbrial biogenesis usher protein SfaF/FocD	plus	VIRULENCE	VIRULENCE	NA	NA	BLASTX	876	876	100.00	99.66	876	EIL44824.1	S/F1C fimbrial biogenesis usher protein SfaF/FocD	NA	NA
NA	ERZ3165618.99	1	501	+	papF	P fimbrial tip protein PapF	plus	VIRULENCE	VIRULENCE	NA	NA	BLASTX	167	167	100.00	97.01	167	CAA43569.1	P fimbrial tip protein PapF	NA	NA
NA	ERZ3165618.99	548	1552	+	papG-III	P fimbria tip G-adhesin PapG-III	plus	VIRULENCE	VIRULENCE	NA	NA	BLASTX	335	335	100.00	96.42	335	CAA43558.1	P fimbria tip G-adhesin PapG-III	NA	NA
