Protein id	Contig id	Start	Stop	Strand	Element symbol	Element name	Scope	Type	Subtype	Class	Subclass	Method	Target length	Reference sequence length	% Coverage of reference	% Identity to reference	Alignment length	Closest reference accession	Closest reference name	HMM accession	HMM description
NA	ERZ3164824.11	5362	8463	-	acrF	multidrug efflux RND transporter permease subunit AcrF	plus	AMR	AMR	EFFLUX	EFFLUX	BLASTX	1034	1034	100.00	99.61	1034	AAC76298.1	multidrug efflux RND transporter permease subunit AcrF	NA	NA
NA	ERZ3164824.115	208	1020	-	aph(3')-Ia	aminoglycoside O-phosphotransferase APH(3')-Ia	core	AMR	AMR	AMINOGLYCOSIDE	KANAMYCIN	EXACTX	271	271	100.00	100.00	271	WP_000018329.1	aminoglycoside O-phosphotransferase APH(3')-Ia	NA	NA
NA	ERZ3164824.123	132	479	-	merT	mercuric transport protein MerT	plus	STRESS	METAL	MERCURY	MERCURY	EXACTX	116	116	100.00	100.00	116	AAB59075.1	mercuric transport protein MerT	NA	NA
NA	ERZ3164824.123	551	982	+	merR	mercury resistance transcriptional regulator MerR	plus	STRESS	METAL	MERCURY	MERCURY	BLASTX	144	144	100.00	93.75	144	CAA77320.1	mercury resistance transcriptional regulator MerR	NA	NA
NA	ERZ3164824.16	105761	106024	+	ariR	biofilm/acid-resistance regulator AriR	plus	STRESS	ACID	NA	NA	EXACTX	88	88	100.00	100.00	88	AAC74250.1	biofilm/acid-resistance regulator AriR	NA	NA
NA	ERZ3164824.17	71658	75905	-	fdeC	inverse autotransporter adhesin FdeC	plus	VIRULENCE	VIRULENCE	NA	NA	BLASTX	1416	1416	100.00	94.21	1416	ABE05822.1	inverse autotransporter adhesin FdeC	NA	NA
NA	ERZ3164824.3	3050	4849	-	ybtQ	yersiniabactin ABC transporter ATP-binding/permease protein YbtQ	plus	VIRULENCE	VIRULENCE	NA	NA	BLASTX	600	600	100.00	99.67	600	AAC69584.1	yersiniabactin ABC transporter ATP-binding/permease protein YbtQ	NA	NA
NA	ERZ3164824.3	4839	6638	-	ybtP	yersiniabactin ABC transporter ATP-binding/permease protein YbtP	plus	VIRULENCE	VIRULENCE	NA	NA	BLASTX	600	600	100.00	99.83	600	CAA21388.1	yersiniabactin ABC transporter ATP-binding/permease protein YbtP	NA	NA
NA	ERZ3164824.30	29986	30555	+	lpfA-O113	long polar fimbria major subunit LpfA-O113	plus	VIRULENCE	VIRULENCE	NA	NA	EXACTX	190	190	100.00	100.00	190	AAT76975.1	long polar fimbria major subunit LpfA-O113	NA	NA
NA	ERZ3164824.32	15579	18620	-	cnf1	cytotoxic necrotizing factor CNF1	plus	VIRULENCE	VIRULENCE	NA	NA	BLASTX	1014	1014	100.00	99.90	1014	ABE10324.1	cytotoxic necrotizing factor CNF1	NA	NA
NA	ERZ3164824.32	23218	26289	-	hlyA-alpha	RTX toxin hemolysin HlyA	plus	VIRULENCE	VIRULENCE	NA	NA	BLASTX	1024	1024	100.00	96.09	1024	CAQ77251.1	RTX toxin hemolysin HlyA	NA	NA
NA	ERZ3164824.33	37456	37965	-	bmaE	M agglutinin-type afimbrial adhesin BmaE/AfaE-8	plus	VIRULENCE	VIRULENCE	NA	NA	EXACTX	170	170	100.00	100.00	170	AAA23523.1	M agglutinin-type afimbrial adhesin BmaE/AfaE-8	NA	NA
NA	ERZ3164824.4	209552	212176	+	gyrA_S83L	Escherichia quinolone resistant GyrA	core	AMR	POINT	QUINOLONE	QUINOLONE	POINTX	875	878	99.66	99.09	875	WP_001281243.1	DNA gyrase subunit A GyrA	NA	NA
NA	ERZ3164824.49	15226	16356	-	blaEC	BlaEC family class C beta-lactamase	plus	AMR	AMR	BETA-LACTAM	BETA-LACTAM	BLASTX	377	377	100.00	99.73	377	WP_063610930.1	extended-spectrum class C beta-lactamase EC-15	NA	NA
NA	ERZ3164824.49	16224	16468	-	ampC_C-11T	Escherichia cephalosporin resistant ampC promoter	core	AMR	POINT	BETA-LACTAM	CEPHALOSPORIN	POINTN	245	245	100.00	97.55	245	NZ_CP041538.1:1149245-1149489	ampC/blaEC promoter region	NA	NA
NA	ERZ3164824.50	24365	25591	-	mdtM	multidrug efflux MFS transporter MdtM	plus	AMR	AMR	EFFLUX	EFFLUX	BLASTX	409	410	99.76	98.04	409	AAC77293.1	multidrug efflux MFS transporter MdtM	NA	NA
NA	ERZ3164824.53	1940	2266	-	emrE	multidrug efflux SMR transporter EmrE	plus	STRESS	BIOCIDE	EFFLUX	EFFLUX	INTERNAL_STOP	109	110	99.09	97.25	109	CAA77936.1	multidrug efflux SMR transporter EmrE	NA	NA
NA	ERZ3164824.54	2451	2759	+	cvaC	colicin V	plus	VIRULENCE	VIRULENCE	NA	NA	EXACTX	103	103	100.00	100.00	103	CAA40746.1	colicin V	NA	NA
NA	ERZ3164824.54	2935	5028	-	cvaB	colicin V export peptidase/ABC transporter CvaB	plus	VIRULENCE	VIRULENCE	NA	NA	EXACTX	698	698	100.00	100.00	698	CAA40744.1	colicin V export peptidase/ABC transporter CvaB	NA	NA
NA	ERZ3164824.54	10231	12405	+	iroN	siderophore salmochelin receptor IroN	plus	VIRULENCE	VIRULENCE	NA	NA	EXACTX	725	725	100.00	100.00	725	AAN76093.1	siderophore salmochelin receptor IroN	NA	NA
NA	ERZ3164824.54	12456	13409	-	iroE	catecholate siderophore esterase IroE	plus	VIRULENCE	VIRULENCE	NA	NA	BLASTX	318	318	100.00	99.06	318	ACJ63530.1	catecholate siderophore esterase IroE	NA	NA
NA	ERZ3164824.54	13497	14723	-	iroD	catecholate siderophore esterase IroD	plus	VIRULENCE	VIRULENCE	NA	NA	BLASTX	409	409	100.00	99.51	409	ACJ63529.1	catecholate siderophore esterase IroD	NA	NA
NA	ERZ3164824.54	14830	18486	-	iroC	salmochelin/enterobactin export ABC transporter IroC	plus	VIRULENCE	VIRULENCE	NA	NA	BLASTX	1219	1219	100.00	99.59	1219	AUH19662.1	salmochelin/enterobactin export ABC transporter IroC	NA	NA
NA	ERZ3164824.54	18629	19741	-	iroB	salmochelin biosynthesis C-glycosyltransferase IroB	plus	VIRULENCE	VIRULENCE	NA	NA	BLASTX	371	371	100.00	99.73	371	EOW04219.1	salmochelin biosynthesis C-glycosyltransferase IroB	NA	NA
NA	ERZ3164824.54	22890	23180	-	iss	increased serum survival lipoprotein Iss	plus	VIRULENCE	VIRULENCE	NA	NA	EXACTX	97	97	100.00	100.00	97	ADR26561.1	increased serum survival lipoprotein Iss	NA	NA
NA	ERZ3164824.60	4107	5108	-	papG-III	P fimbria tip G-adhesin PapG-III	plus	VIRULENCE	VIRULENCE	NA	NA	BLASTX	334	335	100.00	94.03	335	CAA43558.1	P fimbria tip G-adhesin PapG-III	NA	NA
NA	ERZ3164824.60	8256	10763	-	papC	P fimbrial usher protein PapC	plus	VIRULENCE	VIRULENCE	NA	NA	BLASTX	836	836	100.00	96.43	841	CAA43564.1	P fimbrial usher protein PapC	NA	NA
NA	ERZ3164824.60	10825	11409	-	papH	P fimbrial minor subunit PapH	plus	VIRULENCE	VIRULENCE	NA	NA	BLASTX	195	195	100.00	99.49	195	CAA43563.1	P fimbrial minor subunit PapH	NA	NA
NA	ERZ3164824.60	11476	12027	-	papA	P fimbria major subunit PapA	plus	VIRULENCE	VIRULENCE	NA	NA	BLASTX	184	185	100.00	99.46	185	CAA43562.1	P fimbria major subunit PapA	NA	NA
NA	ERZ3164824.61	7149	8870	+	iucA	aerobactin synthase IucA	plus	VIRULENCE	VIRULENCE	NA	NA	BLASTX	574	576	100.00	95.31	576	EGI25746.1	aerobactin synthase IucA	NA	NA
NA	ERZ3164824.61	8874	9818	+	iucB	N(6)-hydroxylysine O-acetyltransferase IucB	plus	VIRULENCE	VIRULENCE	NA	NA	BLASTX	315	315	100.00	95.87	315	AAN82074.1	N(6)-hydroxylysine O-acetyltransferase IucB	NA	NA
NA	ERZ3164824.61	9821	11560	+	iucC	NIS family aerobactin synthetase IucC	plus	VIRULENCE	VIRULENCE	NA	NA	BLASTX	580	580	100.00	97.59	580	AAN82073.1	NIS family aerobactin synthetase IucC	NA	NA
NA	ERZ3164824.61	11560	12834	+	iucD	NADPH-dependent L-lysine N(6)-monooxygenase IucD	plus	VIRULENCE	VIRULENCE	NA	NA	BLASTX	425	445	95.51	97.65	425	AAD44749.1	NADPH-dependent L-lysine N(6)-monooxygenase IucD	NA	NA
NA	ERZ3164824.61	12931	15117	+	iutA	ferric aerobactin receptor IutA	plus	VIRULENCE	VIRULENCE	NA	NA	BLASTX	729	731	99.73	89.71	729	AAN45165.2	ferric aerobactin receptor IutA	NA	NA
NA	ERZ3164824.65	5478	5948	+	dfrA1	trimethoprim-resistant dihydrofolate reductase DfrA1	core	AMR	AMR	TRIMETHOPRIM	TRIMETHOPRIM	EXACTX	157	157	100.00	100.00	157	WP_000777554.1	trimethoprim-resistant dihydrofolate reductase DfrA1	NA	NA
NA	ERZ3164824.65	6044	6832	+	aadA11	ANT(3'')-Ia family aminoglycoside nucleotidyltransferase AadA11	core	AMR	AMR	AMINOGLYCOSIDE	STREPTOMYCIN	EXACTX	263	263	100.00	100.00	263	WP_032495379.1	ANT(3'')-Ia family aminoglycoside nucleotidyltransferase AadA11	NA	NA
NA	ERZ3164824.65	6999	7343	+	qacEdelta1	quaternary ammonium compound efflux SMR transporter QacE delta 1	core	STRESS	BIOCIDE	QUATERNARY AMMONIUM	QUATERNARY AMMONIUM	ALLELEX	115	115	100.00	100.00	115	WP_000679427.1	quaternary ammonium compound efflux SMR transporter QacE delta 1	NA	NA
NA	ERZ3164824.65	7340	8176	+	sul1	sulfonamide-resistant dihydropteroate synthase Sul1	core	AMR	AMR	SULFONAMIDE	SULFONAMIDE	EXACTX	279	279	100.00	100.00	279	WP_000259031.1	sulfonamide-resistant dihydropteroate synthase Sul1	NA	NA
NA	ERZ3164824.74	93	1121	-	f17g	F17G fimbrial adhesin	plus	VIRULENCE	VIRULENCE	NA	NA	EXACTX	343	343	100.00	100.00	343	ACT33471.1	F17G fimbrial adhesin	NA	NA
NA	ERZ3164824.74	4468	5010	-	f17a	F17A fimbrial adhesin	plus	VIRULENCE	VIRULENCE	NA	NA	EXACTX	181	181	100.00	100.00	181	AAA85087.1	F17A fimbrial adhesin	NA	NA
NA	ERZ3164824.78	3941	4798	+	blaTEM-1	broad-spectrum class A beta-lactamase TEM-1	core	AMR	AMR	BETA-LACTAM	BETA-LACTAM	ALLELEX	286	286	100.00	100.00	286	WP_000027057.1	broad-spectrum class A beta-lactamase TEM-1	NA	NA
NA	ERZ3164824.79	1747	2559	+	sul2	sulfonamide-resistant dihydropteroate synthase Sul2	core	AMR	AMR	SULFONAMIDE	SULFONAMIDE	EXACTX	271	271	100.00	100.00	271	WP_001043265.1	sulfonamide-resistant dihydropteroate synthase Sul2	NA	NA
NA	ERZ3164824.79	2623	3423	+	aph(3'')-Ib	aminoglycoside O-phosphotransferase APH(3'')-Ib	core	AMR	AMR	AMINOGLYCOSIDE	STREPTOMYCIN	EXACTX	267	267	100.00	100.00	267	WP_001082319.1	aminoglycoside O-phosphotransferase APH(3'')-Ib	NA	NA
NA	ERZ3164824.79	3426	4259	+	aph(6)-Id	aminoglycoside O-phosphotransferase APH(6)-Id	core	AMR	AMR	AMINOGLYCOSIDE	STREPTOMYCIN	EXACTX	278	278	100.00	100.00	278	WP_000480968.1	aminoglycoside O-phosphotransferase APH(6)-Id	NA	NA
NA	ERZ3164824.81	2063	3259	+	tet(A)	tetracycline efflux MFS transporter Tet(A)	core	AMR	AMR	TETRACYCLINE	TETRACYCLINE	EXACTX	399	399	100.00	100.00	399	WP_000804064.1	tetracycline efflux MFS transporter Tet(A)	NA	NA
NA	ERZ3164824.87	3027	3446	-	merC	organomercurial transporter MerC	plus	STRESS	METAL	MERCURY	ORGANOMERCURY	EXACTX	140	140	100.00	100.00	140	AAC33908.1	organomercurial transporter MerC	NA	NA
NA	ERZ3164824.9	47303	48376	-	espX1	type III secretion system effector EspX1	plus	VIRULENCE	VIRULENCE	NA	NA	PARTIALX	358	473	75.69	89.66	358	ADD54679.1	type III secretion system effector EspX1	NA	NA
NA	ERZ3164824.97	96	386	-	iss	increased serum survival lipoprotein Iss	plus	VIRULENCE	VIRULENCE	NA	NA	EXACTX	97	97	100.00	100.00	97	AGC85979.1	increased serum survival lipoprotein Iss	NA	NA
