Protein id	Contig id	Start	Stop	Strand	Element symbol	Element name	Scope	Type	Subtype	Class	Subclass	Method	Target length	Reference sequence length	% Coverage of reference	% Identity to reference	Alignment length	Closest reference accession	Closest reference name	HMM accession	HMM description
NA	ERZ3165990.1	180642	182009	+	ibeA	putative intracellular survival FAD-dependent oxidoreductase IbeA	plus	VIRULENCE	VIRULENCE	NA	NA	BLASTX	456	456	100.00	98.03	456	AAF98391.2	putative intracellular survival FAD-dependent oxidoreductase IbeA	NA	NA
NA	ERZ3165990.19	383	3061	-	vactox	vacuolating autotransporter toxin Vat	plus	VIRULENCE	VIRULENCE	NA	NA	PARTIALX	893	1376	64.90	100.00	893	AAN78874.1	vacuolating autotransporter toxin Vat	NA	NA
NA	ERZ3165990.19	22768	27015	+	fdeC	inverse autotransporter adhesin FdeC	plus	VIRULENCE	VIRULENCE	NA	NA	BLASTX	1416	1416	100.00	99.58	1416	ABE05822.1	inverse autotransporter adhesin FdeC	NA	NA
NA	ERZ3165990.2	294688	295017	-	emrE	multidrug efflux SMR transporter EmrE	plus	STRESS	BIOCIDE	EFFLUX	EFFLUX	BLASTX	110	110	100.00	98.18	110	CAA77936.1	multidrug efflux SMR transporter EmrE	NA	NA
NA	ERZ3165990.2	367605	369404	-	ybtQ	yersiniabactin ABC transporter ATP-binding/permease protein YbtQ	plus	VIRULENCE	VIRULENCE	NA	NA	BLASTX	600	600	100.00	99.50	600	AAC69584.1	yersiniabactin ABC transporter ATP-binding/permease protein YbtQ	NA	NA
NA	ERZ3165990.2	369394	371193	-	ybtP	yersiniabactin ABC transporter ATP-binding/permease protein YbtP	plus	VIRULENCE	VIRULENCE	NA	NA	BLASTX	600	600	100.00	99.83	600	CAA21388.1	yersiniabactin ABC transporter ATP-binding/permease protein YbtP	NA	NA
NA	ERZ3165990.2	414497	418861	-	clbN	colibactin non-ribosomal peptide synthetase ClbN	plus	VIRULENCE	VIRULENCE	NA	NA	EXACTX	1455	1455	100.00	100.00	1455	AMH08480.1	colibactin non-ribosomal peptide synthetase ClbN	NA	NA
NA	ERZ3165990.2	448961	458578	-	clbB	colibactin hybrid non-ribosomal peptide synthetase/type I polyketide synthase ClbB	plus	VIRULENCE	VIRULENCE	NA	NA	BLASTX	3206	3206	100.00	99.97	3206	AMQ58400.1	colibactin hybrid non-ribosomal peptide synthetase/type I polyketide synthase ClbB	NA	NA
NA	ERZ3165990.21	12421	12684	+	ariR	biofilm/acid-resistance regulator AriR	plus	STRESS	ACID	NA	NA	BLASTX	88	88	100.00	97.73	88	AAC74250.1	biofilm/acid-resistance regulator AriR	NA	NA
NA	ERZ3165990.3	33314	37873	-	sslE	lipoprotein metalloprotease SslE	plus	VIRULENCE	VIRULENCE	NA	NA	BLASTX	1520	1520	100.00	98.22	1520	ADE89421.1	lipoprotein metalloprotease SslE	NA	NA
NA	ERZ3165990.3	358060	361161	+	acrF	multidrug efflux RND transporter permease subunit AcrF	plus	AMR	AMR	EFFLUX	EFFLUX	BLASTX	1034	1034	100.00	99.42	1034	AAC76298.1	multidrug efflux RND transporter permease subunit AcrF	NA	NA
NA	ERZ3165990.33	27141	31253	-	pic	serine protease autotransporter toxin Pic	plus	VIRULENCE	VIRULENCE	NA	NA	BLASTX	1371	1371	100.00	99.93	1371	AAN78833.1	serine protease autotransporter toxin Pic	NA	NA
NA	ERZ3165990.39	13220	14350	+	blaEC-5	cephalosporin-hydrolyzing class C beta-lactamase EC-5	plus	AMR	AMR	BETA-LACTAM	CEPHALOSPORIN	ALLELEX	377	377	100.00	100.00	377	AAZ85965.1	cephalosporin-hydrolyzing class C beta-lactamase EC-5	NA	NA
NA	ERZ3165990.43	6866	9937	+	hlyA-alpha	RTX toxin hemolysin HlyA	plus	VIRULENCE	VIRULENCE	NA	NA	BLASTX	1024	1024	100.00	97.66	1024	CAQ77251.1	RTX toxin hemolysin HlyA	NA	NA
NA	ERZ3165990.43	14537	17578	+	cnf1	cytotoxic necrotizing factor CNF1	plus	VIRULENCE	VIRULENCE	NA	NA	EXACTX	1014	1014	100.00	100.00	1014	CAK02719.1	cytotoxic necrotizing factor CNF1	NA	NA
NA	ERZ3165990.5	80857	82044	-	emrD	multidrug efflux MFS transporter EmrD	plus	AMR	AMR	EFFLUX	EFFLUX	BLASTX	396	396	100.00	99.24	396	EFF04178.1	multidrug efflux MFS transporter EmrD	NA	NA
NA	ERZ3165990.5	88257	89645	+	uhpT_E350Q	Escherichia fosfomycin resistant UhpT	core	AMR	POINT	FOSFOMYCIN	FOSFOMYCIN	POINTX	463	463	100.00	99.78	463	WP_000879194.1	hexose phosphate transporter UhpT	NA	NA
NA	ERZ3165990.53	934	2046	+	iroB	salmochelin biosynthesis C-glycosyltransferase IroB	plus	VIRULENCE	VIRULENCE	NA	NA	BLASTX	371	371	100.00	99.19	371	EOW04219.1	salmochelin biosynthesis C-glycosyltransferase IroB	NA	NA
NA	ERZ3165990.53	2189	5845	+	iroC	salmochelin/enterobactin export ABC transporter IroC	plus	VIRULENCE	VIRULENCE	NA	NA	BLASTX	1219	1219	100.00	99.67	1219	AUH19662.1	salmochelin/enterobactin export ABC transporter IroC	NA	NA
NA	ERZ3165990.53	5952	7178	+	iroD	catecholate siderophore esterase IroD	plus	VIRULENCE	VIRULENCE	NA	NA	BLASTX	409	409	100.00	99.76	409	ACJ63529.1	catecholate siderophore esterase IroD	NA	NA
NA	ERZ3165990.53	7266	8219	+	iroE	catecholate siderophore esterase IroE	plus	VIRULENCE	VIRULENCE	NA	NA	BLASTX	318	318	100.00	99.37	318	ACJ63530.1	catecholate siderophore esterase IroE	NA	NA
NA	ERZ3165990.53	8270	10444	-	iroN	siderophore salmochelin receptor IroN	plus	VIRULENCE	VIRULENCE	NA	NA	BLASTX	725	725	100.00	99.72	725	AAN79707.1	siderophore salmochelin receptor IroN	NA	NA
NA	ERZ3165990.56	6213	7070	-	blaTEM-1	broad-spectrum class A beta-lactamase TEM-1	core	AMR	AMR	BETA-LACTAM	BETA-LACTAM	ALLELEX	286	286	100.00	100.00	286	WP_000027057.1	broad-spectrum class A beta-lactamase TEM-1	NA	NA
NA	ERZ3165990.61	3038	3328	+	iss	increased serum survival lipoprotein Iss	plus	VIRULENCE	VIRULENCE	NA	NA	EXACTX	97	97	100.00	100.00	97	AGC85979.1	increased serum survival lipoprotein Iss	NA	NA
NA	ERZ3165990.71	978	3023	+	ireA	TonB-dependent siderophore receptor IreA	plus	VIRULENCE	VIRULENCE	NA	NA	EXACTX	682	682	100.00	100.00	682	AAN83596.1	TonB-dependent siderophore receptor IreA	NA	NA
NA	ERZ3165990.73	1449	4076	+	sfaF	S/F1C fimbrial biogenesis usher protein SfaF/FocD	plus	VIRULENCE	VIRULENCE	NA	NA	BLASTX	876	876	100.00	99.43	876	ASJ31253.1	S/F1C fimbrial biogenesis usher protein SfaF/FocD	NA	NA
NA	ERZ3165990.84	1260	3137	+	mchF	microcin H47 export transporter peptidase/ATP-binding subunit MchF	plus	VIRULENCE	VIRULENCE	NA	NA	PARTIAL_CONTIG_ENDX	626	700	89.43	99.52	626	AFS85685.1	microcin H47 export transporter peptidase/ATP-binding subunit MchF	NA	NA
NA	ERZ3165990.97	1468	1692	-	mchB	microcin H47	plus	VIRULENCE	VIRULENCE	NA	NA	EXACTX	75	75	100.00	100.00	75	CAB54534.2	microcin H47	NA	NA
