Protein id	Contig id	Start	Stop	Strand	Element symbol	Element name	Scope	Type	Subtype	Class	Subclass	Method	Target length	Reference sequence length	% Coverage of reference	% Identity to reference	Alignment length	Closest reference accession	Closest reference name	HMM accession	HMM description
NA	ERZ3166243.105	136	1038	+	mph(A)	Mph(A) family macrolide 2'-phosphotransferase	core	AMR	AMR	MACROLIDE	AZITHROMYCIN/ERYTHROMYCIN/SPIRAMYCIN/TELITHROMYCIN	EXACTX	301	301	100.00	100.00	301	WP_000219391.1	Mph(A) family macrolide 2'-phosphotransferase	NA	NA
NA	ERZ3166243.106	78	911	-	aph(6)-Id	aminoglycoside O-phosphotransferase APH(6)-Id	core	AMR	AMR	AMINOGLYCOSIDE	STREPTOMYCIN	EXACTX	278	278	100.00	100.00	278	WP_000480968.1	aminoglycoside O-phosphotransferase APH(6)-Id	NA	NA
NA	ERZ3166243.106	914	1714	-	aph(3'')-Ib	aminoglycoside O-phosphotransferase APH(3'')-Ib	core	AMR	AMR	AMINOGLYCOSIDE	STREPTOMYCIN	EXACTX	267	267	100.00	100.00	267	WP_001082319.1	aminoglycoside O-phosphotransferase APH(3'')-Ib	NA	NA
NA	ERZ3166243.106	1778	2590	-	sul2	sulfonamide-resistant dihydropteroate synthase Sul2	core	AMR	AMR	SULFONAMIDE	SULFONAMIDE	EXACTX	271	271	100.00	100.00	271	WP_001043265.1	sulfonamide-resistant dihydropteroate synthase Sul2	NA	NA
NA	ERZ3166243.110	1879	2163	+	papA	P fimbria major subunit PapA	plus	VIRULENCE	VIRULENCE	NA	NA	PARTIALX	95	185	51.89	87.50	96	CAA43562.1	P fimbria major subunit PapA	NA	NA
NA	ERZ3166243.119	605	1462	-	blaTEM-1	broad-spectrum class A beta-lactamase TEM-1	core	AMR	AMR	BETA-LACTAM	BETA-LACTAM	ALLELEX	286	286	100.00	100.00	286	WP_000027057.1	broad-spectrum class A beta-lactamase TEM-1	NA	NA
NA	ERZ3166243.12	5193	8294	-	acrF	multidrug efflux RND transporter permease subunit AcrF	plus	AMR	AMR	EFFLUX	EFFLUX	BLASTX	1034	1034	100.00	99.42	1034	AAC76298.1	multidrug efflux RND transporter permease subunit AcrF	NA	NA
NA	ERZ3166243.18	43389	45932	+	cyaA_S352T	Escherichia fosmidomycin resistant CyaA	core	AMR	POINT	FOSMIDOMYCIN	FOSMIDOMYCIN	POINTX	848	848	100.00	99.29	848	WP_000281668.1	adenylate cyclase CyaA	NA	NA
NA	ERZ3166243.19	31229	32458	-	mdtM	multidrug efflux MFS transporter MdtM	plus	AMR	AMR	EFFLUX	EFFLUX	EXACTX	410	410	100.00	100.00	410	AAC77293.1	multidrug efflux MFS transporter MdtM	NA	NA
NA	ERZ3166243.2	201768	203186	+	espX1	type III secretion system effector EspX1	plus	VIRULENCE	VIRULENCE	NA	NA	BLASTX	473	473	100.00	92.60	473	ADD54679.1	type III secretion system effector EspX1	NA	NA
NA	ERZ3166243.20	84810	85709	-	blaEC	BlaEC family class C beta-lactamase	plus	AMR	AMR	BETA-LACTAM	BETA-LACTAM	PARTIALX	300	377	79.58	98.67	300	AAZ85968.1	cephalosporin-hydrolyzing class C beta-lactamase EC-8	NA	NA
NA	ERZ3166243.26	36631	37200	-	lpfA-O113	long polar fimbria major subunit LpfA-O113	plus	VIRULENCE	VIRULENCE	NA	NA	EXACTX	190	190	100.00	100.00	190	ACB16424.1	long polar fimbria major subunit LpfA-O113	NA	NA
NA	ERZ3166243.31	18374	22615	+	fdeC	inverse autotransporter adhesin FdeC	plus	VIRULENCE	VIRULENCE	NA	NA	BLASTX	1414	1416	99.93	92.44	1415	ABE05822.1	inverse autotransporter adhesin FdeC	NA	NA
NA	ERZ3166243.44	11636	12823	+	emrD	multidrug efflux MFS transporter EmrD	plus	AMR	AMR	EFFLUX	EFFLUX	BLASTX	396	396	100.00	99.75	396	EFF04178.1	multidrug efflux MFS transporter EmrD	NA	NA
NA	ERZ3166243.49	6242	16495	+	air	inverse autotransporter adhesin EaeX/Air	plus	VIRULENCE	VIRULENCE	NA	NA	EXACTX	3418	3418	100.00	100.00	3418	CAR15326.1	inverse autotransporter adhesin EaeX/Air	NA	NA
NA	ERZ3166243.49	16553	18247	-	eilA	HilA family transcriptional regulator EilA	plus	VIRULENCE	VIRULENCE	NA	NA	EXACTX	565	565	100.00	100.00	565	CBG36837.1	HilA family transcriptional regulator EilA	NA	NA
NA	ERZ3166243.5	194241	194600	+	arsD	arsenite efflux transporter metallochaperone ArsD	plus	STRESS	METAL	ARSENIC	ARSENITE	BLASTX	120	120	100.00	90.00	120	AAB09625.1	arsenite efflux transporter metallochaperone ArsD	NA	NA
NA	ERZ3166243.59	14476	14739	+	ariR	biofilm/acid-resistance regulator AriR	plus	STRESS	ACID	NA	NA	BLASTX	88	88	100.00	98.86	88	AAC74250.1	biofilm/acid-resistance regulator AriR	NA	NA
NA	ERZ3166243.69	277	4161	-	sat	serine protease autotransporter toxin Sat	plus	VIRULENCE	VIRULENCE	NA	NA	BLASTX	1295	1295	100.00	99.85	1295	CAE55775.1	serine protease autotransporter toxin Sat	NA	NA
NA	ERZ3166243.69	5097	7283	-	iutA	ferric aerobactin receptor IutA	plus	VIRULENCE	VIRULENCE	NA	NA	BLASTX	729	731	99.73	89.85	729	AAN45165.2	ferric aerobactin receptor IutA	NA	NA
NA	ERZ3166243.69	7380	8654	-	iucD	NADPH-dependent L-lysine N(6)-monooxygenase IucD	plus	VIRULENCE	VIRULENCE	NA	NA	BLASTX	425	445	95.51	97.65	425	AAD44749.1	NADPH-dependent L-lysine N(6)-monooxygenase IucD	NA	NA
NA	ERZ3166243.69	8654	10393	-	iucC	NIS family aerobactin synthetase IucC	plus	VIRULENCE	VIRULENCE	NA	NA	BLASTX	580	580	100.00	99.14	580	AAN82073.1	NIS family aerobactin synthetase IucC	NA	NA
NA	ERZ3166243.69	10396	11340	-	iucB	N(6)-hydroxylysine O-acetyltransferase IucB	plus	VIRULENCE	VIRULENCE	NA	NA	BLASTX	315	315	100.00	99.37	315	AAN82074.1	N(6)-hydroxylysine O-acetyltransferase IucB	NA	NA
NA	ERZ3166243.69	11344	13065	-	iucA	aerobactin synthase IucA	plus	VIRULENCE	VIRULENCE	NA	NA	BLASTX	574	576	100.00	98.61	576	EGI25746.1	aerobactin synthase IucA	NA	NA
NA	ERZ3166243.75	6001	6471	+	dfrA17	trimethoprim-resistant dihydrofolate reductase DfrA17	core	AMR	AMR	TRIMETHOPRIM	TRIMETHOPRIM	EXACTX	157	157	100.00	100.00	157	WP_001389366.1	trimethoprim-resistant dihydrofolate reductase DfrA17	NA	NA
NA	ERZ3166243.75	6605	7390	+	aadA5	ANT(3'')-Ia family aminoglycoside nucleotidyltransferase AadA5	core	AMR	AMR	AMINOGLYCOSIDE	STREPTOMYCIN	EXACTX	262	262	100.00	100.00	262	WP_000503573.1	ANT(3'')-Ia family aminoglycoside nucleotidyltransferase AadA5	NA	NA
NA	ERZ3166243.75	7599	7943	+	qacEdelta1	quaternary ammonium compound efflux SMR transporter QacE delta 1	core	STRESS	BIOCIDE	QUATERNARY AMMONIUM	QUATERNARY AMMONIUM	ALLELEX	115	115	100.00	100.00	115	WP_000679427.1	quaternary ammonium compound efflux SMR transporter QacE delta 1	NA	NA
NA	ERZ3166243.75	7940	8776	+	sul1	sulfonamide-resistant dihydropteroate synthase Sul1	core	AMR	AMR	SULFONAMIDE	SULFONAMIDE	EXACTX	279	279	100.00	100.00	279	WP_000259031.1	sulfonamide-resistant dihydropteroate synthase Sul1	NA	NA
NA	ERZ3166243.76	8469	9641	+	senB	enterotoxin production-related protein TieB	plus	VIRULENCE	VIRULENCE	NA	NA	EXACTX	391	391	100.00	100.00	391	AAZ89288.1	enterotoxin production-related protein TieB	NA	NA
NA	ERZ3166243.79	648	2735	+	iha	bifunctional siderophore receptor/adhesin Iha	plus	VIRULENCE	VIRULENCE	NA	NA	EXACTX	696	696	100.00	100.00	696	ADN47767.1	bifunctional siderophore receptor/adhesin Iha	NA	NA
NA	ERZ3166243.89	162	593	-	merR	mercury resistance transcriptional regulator MerR	plus	STRESS	METAL	MERCURY	MERCURY	BLASTX	144	144	100.00	93.75	144	CAA77320.1	mercury resistance transcriptional regulator MerR	NA	NA
NA	ERZ3166243.89	665	1012	+	merT	mercuric transport protein MerT	plus	STRESS	METAL	MERCURY	MERCURY	EXACTX	116	116	100.00	100.00	116	AAB59075.1	mercuric transport protein MerT	NA	NA
NA	ERZ3166243.89	1029	1301	+	merP	mercury resistance system periplasmic binding protein MerP	plus	STRESS	METAL	MERCURY	MERCURY	BLASTX	91	91	100.00	90.11	91	AAC38219.1	mercury resistance system periplasmic binding protein MerP	NA	NA
NA	ERZ3166243.89	1340	1759	+	merC	organomercurial transporter MerC	plus	STRESS	METAL	MERCURY	ORGANOMERCURY	EXACTX	140	140	100.00	100.00	140	AAC33908.1	organomercurial transporter MerC	NA	NA
NA	ERZ3166243.9	106897	108696	+	ybtP	yersiniabactin ABC transporter ATP-binding/permease protein YbtP	plus	VIRULENCE	VIRULENCE	NA	NA	BLASTX	600	600	100.00	99.83	600	CAA21388.1	yersiniabactin ABC transporter ATP-binding/permease protein YbtP	NA	NA
NA	ERZ3166243.9	108686	110485	+	ybtQ	yersiniabactin ABC transporter ATP-binding/permease protein YbtQ	plus	VIRULENCE	VIRULENCE	NA	NA	BLASTX	600	600	100.00	99.83	600	AAC69584.1	yersiniabactin ABC transporter ATP-binding/permease protein YbtQ	NA	NA
NA	ERZ3166243.91	1404	1694	+	iss	increased serum survival lipoprotein Iss	plus	VIRULENCE	VIRULENCE	NA	NA	EXACTX	97	97	100.00	100.00	97	CAR12622.1	increased serum survival lipoprotein Iss	NA	NA
