Protein id	Contig id	Start	Stop	Strand	Element symbol	Element name	Scope	Type	Subtype	Class	Subclass	Method	Target length	Reference sequence length	% Coverage of reference	% Identity to reference	Alignment length	Closest reference accession	Closest reference name	HMM accession	HMM description
NA	ERZ3165778.1	195677	197476	-	ybtQ	yersiniabactin ABC transporter ATP-binding/permease protein YbtQ	plus	VIRULENCE	VIRULENCE	NA	NA	BLASTX	600	600	100.00	99.83	600	AAC69584.1	yersiniabactin ABC transporter ATP-binding/permease protein YbtQ	NA	NA
NA	ERZ3165778.1	197466	199265	-	ybtP	yersiniabactin ABC transporter ATP-binding/permease protein YbtP	plus	VIRULENCE	VIRULENCE	NA	NA	BLASTX	600	600	100.00	99.67	600	CAA21388.1	yersiniabactin ABC transporter ATP-binding/permease protein YbtP	NA	NA
NA	ERZ3165778.104	605	1462	-	blaTEM-1	broad-spectrum class A beta-lactamase TEM-1	core	AMR	AMR	BETA-LACTAM	BETA-LACTAM	ALLELEX	286	286	100.00	100.00	286	WP_000027057.1	broad-spectrum class A beta-lactamase TEM-1	NA	NA
NA	ERZ3165778.120	168	824	-	catA1	type A-1 chloramphenicol O-acetyltransferase	core	AMR	AMR	PHENICOL	CHLORAMPHENICOL	EXACTX	219	219	100.00	100.00	219	WP_000412211.1	type A-1 chloramphenicol O-acetyltransferase	NA	NA
NA	ERZ3165778.13	11638	12825	+	emrD	multidrug efflux MFS transporter EmrD	plus	AMR	AMR	EFFLUX	EFFLUX	BLASTX	396	396	100.00	99.75	396	EFF04178.1	multidrug efflux MFS transporter EmrD	NA	NA
NA	ERZ3165778.13	72333	72902	-	lpfA-O113	long polar fimbria major subunit LpfA-O113	plus	VIRULENCE	VIRULENCE	NA	NA	EXACTX	190	190	100.00	100.00	190	ACB16424.1	long polar fimbria major subunit LpfA-O113	NA	NA
NA	ERZ3165778.15	53371	54789	-	espX1	type III secretion system effector EspX1	plus	VIRULENCE	VIRULENCE	NA	NA	BLASTX	473	473	100.00	92.60	473	ADD54679.1	type III secretion system effector EspX1	NA	NA
NA	ERZ3165778.16	14755	15018	+	ariR	biofilm/acid-resistance regulator AriR	plus	STRESS	ACID	NA	NA	BLASTX	88	88	100.00	98.86	88	AAC74250.1	biofilm/acid-resistance regulator AriR	NA	NA
NA	ERZ3165778.19	42230	44773	-	cyaA_S352T	Escherichia fosmidomycin resistant CyaA	core	AMR	POINT	FOSMIDOMYCIN	FOSMIDOMYCIN	POINTX	848	848	100.00	99.29	848	WP_000281668.1	adenylate cyclase CyaA	NA	NA
NA	ERZ3165778.2	5429	8530	-	acrF	multidrug efflux RND transporter permease subunit AcrF	plus	AMR	AMR	EFFLUX	EFFLUX	BLASTX	1034	1034	100.00	99.32	1034	AAC76298.1	multidrug efflux RND transporter permease subunit AcrF	NA	NA
NA	ERZ3165778.22	24609	25838	-	mdtM	multidrug efflux MFS transporter MdtM	plus	AMR	AMR	EFFLUX	EFFLUX	EXACTX	410	410	100.00	100.00	410	AAC77293.1	multidrug efflux MFS transporter MdtM	NA	NA
NA	ERZ3165778.30	18374	22615	+	fdeC	inverse autotransporter adhesin FdeC	plus	VIRULENCE	VIRULENCE	NA	NA	BLASTX	1414	1416	99.93	92.44	1415	ABE05822.1	inverse autotransporter adhesin FdeC	NA	NA
NA	ERZ3165778.4	194241	194600	+	arsD	arsenite efflux transporter metallochaperone ArsD	plus	STRESS	METAL	ARSENIC	ARSENITE	BLASTX	120	120	100.00	90.00	120	AAB09625.1	arsenite efflux transporter metallochaperone ArsD	NA	NA
NA	ERZ3165778.46	6242	16495	+	air	inverse autotransporter adhesin EaeX/Air	plus	VIRULENCE	VIRULENCE	NA	NA	EXACTX	3418	3418	100.00	100.00	3418	CAR15326.1	inverse autotransporter adhesin EaeX/Air	NA	NA
NA	ERZ3165778.46	16553	18247	-	eilA	HilA family transcriptional regulator EilA	plus	VIRULENCE	VIRULENCE	NA	NA	EXACTX	565	565	100.00	100.00	565	CBG36837.1	HilA family transcriptional regulator EilA	NA	NA
NA	ERZ3165778.66	1018	2190	-	senB	enterotoxin production-related protein TieB	plus	VIRULENCE	VIRULENCE	NA	NA	EXACTX	391	391	100.00	100.00	391	AAZ89288.1	enterotoxin production-related protein TieB	NA	NA
NA	ERZ3165778.7	12928	14058	+	blaEC	BlaEC family class C beta-lactamase	plus	AMR	AMR	BETA-LACTAM	BETA-LACTAM	BLASTX	377	377	100.00	98.67	377	AAZ85968.1	cephalosporin-hydrolyzing class C beta-lactamase EC-8	NA	NA
NA	ERZ3165778.73	1843	2679	-	sul1	sulfonamide-resistant dihydropteroate synthase Sul1	core	AMR	AMR	SULFONAMIDE	SULFONAMIDE	EXACTX	279	279	100.00	100.00	279	WP_000259031.1	sulfonamide-resistant dihydropteroate synthase Sul1	NA	NA
NA	ERZ3165778.73	2676	3020	-	qacEdelta1	quaternary ammonium compound efflux SMR transporter QacE delta 1	core	STRESS	BIOCIDE	QUATERNARY AMMONIUM	QUATERNARY AMMONIUM	ALLELEX	115	115	100.00	100.00	115	WP_000679427.1	quaternary ammonium compound efflux SMR transporter QacE delta 1	NA	NA
NA	ERZ3165778.73	3229	4014	-	aadA5	ANT(3'')-Ia family aminoglycoside nucleotidyltransferase AadA5	core	AMR	AMR	AMINOGLYCOSIDE	STREPTOMYCIN	EXACTX	262	262	100.00	100.00	262	WP_000503573.1	ANT(3'')-Ia family aminoglycoside nucleotidyltransferase AadA5	NA	NA
NA	ERZ3165778.73	4148	4618	-	dfrA17	trimethoprim-resistant dihydrofolate reductase DfrA17	core	AMR	AMR	TRIMETHOPRIM	TRIMETHOPRIM	EXACTX	157	157	100.00	100.00	157	WP_001389366.1	trimethoprim-resistant dihydrofolate reductase DfrA17	NA	NA
NA	ERZ3165778.74	1404	1694	+	iss	increased serum survival lipoprotein Iss	plus	VIRULENCE	VIRULENCE	NA	NA	EXACTX	97	97	100.00	100.00	97	CAR12622.1	increased serum survival lipoprotein Iss	NA	NA
NA	ERZ3165778.93	135	1037	+	mph(A)	Mph(A) family macrolide 2'-phosphotransferase	core	AMR	AMR	MACROLIDE	AZITHROMYCIN/ERYTHROMYCIN/SPIRAMYCIN/TELITHROMYCIN	EXACTX	301	301	100.00	100.00	301	WP_000219391.1	Mph(A) family macrolide 2'-phosphotransferase	NA	NA
NA	ERZ3165778.96	1929	2741	+	sul2	sulfonamide-resistant dihydropteroate synthase Sul2	core	AMR	AMR	SULFONAMIDE	SULFONAMIDE	BLASTX	271	271	100.00	100.00	271	WP_001043265.1	sulfonamide-resistant dihydropteroate synthase Sul2	NA	NA
