Protein id	Contig id	Start	Stop	Strand	Element symbol	Element name	Scope	Type	Subtype	Class	Subclass	Method	Target length	Reference sequence length	% Coverage of reference	% Identity to reference	Alignment length	Closest reference accession	Closest reference name	HMM accession	HMM description
NA	ERZ3166165.1	31130	31459	+	emrE	multidrug efflux SMR transporter EmrE	plus	STRESS	BIOCIDE	EFFLUX	EFFLUX	BLASTX	110	110	100.00	98.18	110	CAA77936.1	multidrug efflux SMR transporter EmrE	NA	NA
NA	ERZ3166165.101	3594	4094	-	papF	P fimbrial tip protein PapF	plus	VIRULENCE	VIRULENCE	NA	NA	BLASTX	167	167	100.00	98.20	167	CAA43569.1	P fimbrial tip protein PapF	NA	NA
NA	ERZ3166165.13	1354	5601	-	fdeC	inverse autotransporter adhesin FdeC	plus	VIRULENCE	VIRULENCE	NA	NA	BLASTX	1416	1416	100.00	94.77	1416	ABE05822.1	inverse autotransporter adhesin FdeC	NA	NA
NA	ERZ3166165.131	1880	2419	+	papA	P fimbria major subunit PapA	plus	VIRULENCE	VIRULENCE	NA	NA	BLASTX	180	185	96.22	86.19	181	CAA43562.1	P fimbria major subunit PapA	NA	NA
NA	ERZ3166165.16	42173	44716	+	cyaA_S352T	Escherichia fosmidomycin resistant CyaA	core	AMR	POINT	FOSMIDOMYCIN	FOSMIDOMYCIN	POINTX	848	848	100.00	99.29	848	WP_000281668.1	adenylate cyclase CyaA	NA	NA
NA	ERZ3166165.23	12623	14317	+	eilA	HilA family transcriptional regulator EilA	plus	VIRULENCE	VIRULENCE	NA	NA	BLASTX	565	565	100.00	99.65	565	ACB16655.1	HilA family transcriptional regulator EilA	NA	NA
NA	ERZ3166165.23	14375	25792	-	air	inverse autotransporter adhesin EaeX/Air	plus	VIRULENCE	VIRULENCE	NA	NA	BLASTX	3806	3806	100.00	90.46	3806	CBG36838.1	inverse autotransporter adhesin EaeX/Air	NA	NA
NA	ERZ3166165.23	43662	44849	+	emrD	multidrug efflux MFS transporter EmrD	plus	AMR	AMR	EFFLUX	EFFLUX	BLASTX	396	396	100.00	99.75	396	EFF04178.1	multidrug efflux MFS transporter EmrD	NA	NA
NA	ERZ3166165.38	5193	8294	-	acrF	multidrug efflux RND transporter permease subunit AcrF	plus	AMR	AMR	EFFLUX	EFFLUX	BLASTX	1034	1034	100.00	99.42	1034	AAC76298.1	multidrug efflux RND transporter permease subunit AcrF	NA	NA
NA	ERZ3166165.42	6830	8629	-	ybtQ	yersiniabactin ABC transporter ATP-binding/permease protein YbtQ	plus	VIRULENCE	VIRULENCE	NA	NA	BLASTX	600	600	100.00	99.67	600	AAC69584.1	yersiniabactin ABC transporter ATP-binding/permease protein YbtQ	NA	NA
NA	ERZ3166165.42	8619	10418	-	ybtP	yersiniabactin ABC transporter ATP-binding/permease protein YbtP	plus	VIRULENCE	VIRULENCE	NA	NA	BLASTX	600	600	100.00	99.50	600	CAA21388.1	yersiniabactin ABC transporter ATP-binding/permease protein YbtP	NA	NA
NA	ERZ3166165.5	144481	145611	-	blaEC	BlaEC family class C beta-lactamase	plus	AMR	AMR	BETA-LACTAM	BETA-LACTAM	BLASTX	377	377	100.00	98.14	377	AAZ85968.1	cephalosporin-hydrolyzing class C beta-lactamase EC-8	NA	NA
NA	ERZ3166165.68	1946	3667	+	iucA	aerobactin synthase IucA	plus	VIRULENCE	VIRULENCE	NA	NA	BLASTX	574	576	100.00	98.61	576	EGI25746.1	aerobactin synthase IucA	NA	NA
NA	ERZ3166165.68	3671	4615	+	iucB	N(6)-hydroxylysine O-acetyltransferase IucB	plus	VIRULENCE	VIRULENCE	NA	NA	BLASTX	315	315	100.00	99.68	315	AAN82074.1	N(6)-hydroxylysine O-acetyltransferase IucB	NA	NA
NA	ERZ3166165.68	4618	6357	+	iucC	NIS family aerobactin synthetase IucC	plus	VIRULENCE	VIRULENCE	NA	NA	BLASTX	580	580	100.00	99.14	580	AAN82073.1	NIS family aerobactin synthetase IucC	NA	NA
NA	ERZ3166165.68	6357	7631	+	iucD	NADPH-dependent L-lysine N(6)-monooxygenase IucD	plus	VIRULENCE	VIRULENCE	NA	NA	BLASTX	425	445	95.51	97.65	425	AAD44749.1	NADPH-dependent L-lysine N(6)-monooxygenase IucD	NA	NA
NA	ERZ3166165.68	7728	9914	+	iutA	ferric aerobactin receptor IutA	plus	VIRULENCE	VIRULENCE	NA	NA	BLASTX	729	731	99.73	89.85	729	AAN45165.2	ferric aerobactin receptor IutA	NA	NA
NA	ERZ3166165.68	10862	14746	+	sat	serine protease autotransporter toxin Sat	plus	VIRULENCE	VIRULENCE	NA	NA	EXACTX	1295	1295	100.00	100.00	1295	CAE55775.1	serine protease autotransporter toxin Sat	NA	NA
NA	ERZ3166165.7	17799	19217	-	espX1	type III secretion system effector EspX1	plus	VIRULENCE	VIRULENCE	NA	NA	BLASTX	473	473	100.00	90.70	473	ADD54679.1	type III secretion system effector EspX1	NA	NA
NA	ERZ3166165.74	338	1564	+	mdtM	multidrug efflux MFS transporter MdtM	plus	AMR	AMR	EFFLUX	EFFLUX	BLASTX	409	410	99.76	96.82	409	AAC77293.1	multidrug efflux MFS transporter MdtM	NA	NA
NA	ERZ3166165.8	1765	2028	-	ariR	biofilm/acid-resistance regulator AriR	plus	STRESS	ACID	NA	NA	BLASTX	88	88	100.00	98.86	88	AAC74250.1	biofilm/acid-resistance regulator AriR	NA	NA
NA	ERZ3166165.80	8672	9844	+	senB	enterotoxin production-related protein TieB	plus	VIRULENCE	VIRULENCE	NA	NA	BLASTX	391	391	100.00	99.74	391	AAZ89288.1	enterotoxin production-related protein TieB	NA	NA
NA	ERZ3166165.83	648	2735	+	iha	bifunctional siderophore receptor/adhesin Iha	plus	VIRULENCE	VIRULENCE	NA	NA	EXACTX	696	696	100.00	100.00	696	AEQ14190.1	bifunctional siderophore receptor/adhesin Iha	NA	NA
NA	ERZ3166165.87	1227	1517	+	iss	increased serum survival lipoprotein Iss	plus	VIRULENCE	VIRULENCE	NA	NA	EXACTX	97	97	100.00	100.00	97	BAG76115.1	increased serum survival lipoprotein Iss	NA	NA
