Protein id	Contig id	Start	Stop	Strand	Element symbol	Element name	Scope	Type	Subtype	Class	Subclass	Method	Target length	Reference sequence length	% Coverage of reference	% Identity to reference	Alignment length	Closest reference accession	Closest reference name	HMM accession	HMM description
NA	ERZ3164776.1	291087	292886	-	ybtQ	yersiniabactin ABC transporter ATP-binding/permease protein YbtQ	plus	VIRULENCE	VIRULENCE	NA	NA	BLASTX	600	600	100.00	99.83	600	AAC69584.1	yersiniabactin ABC transporter ATP-binding/permease protein YbtQ	NA	NA
NA	ERZ3164776.1	292876	294675	-	ybtP	yersiniabactin ABC transporter ATP-binding/permease protein YbtP	plus	VIRULENCE	VIRULENCE	NA	NA	BLASTX	600	600	100.00	99.67	600	CAA21388.1	yersiniabactin ABC transporter ATP-binding/permease protein YbtP	NA	NA
NA	ERZ3164776.125	605	1462	-	blaTEM-1	broad-spectrum class A beta-lactamase TEM-1	core	AMR	AMR	BETA-LACTAM	BETA-LACTAM	ALLELEX	286	286	100.00	100.00	286	WP_000027057.1	broad-spectrum class A beta-lactamase TEM-1	NA	NA
NA	ERZ3164776.13	11638	12825	+	emrD	multidrug efflux MFS transporter EmrD	plus	AMR	AMR	EFFLUX	EFFLUX	BLASTX	396	396	100.00	99.75	396	EFF04178.1	multidrug efflux MFS transporter EmrD	NA	NA
NA	ERZ3164776.13	72333	72902	-	lpfA-O113	long polar fimbria major subunit LpfA-O113	plus	VIRULENCE	VIRULENCE	NA	NA	EXACTX	190	190	100.00	100.00	190	ACB16424.1	long polar fimbria major subunit LpfA-O113	NA	NA
NA	ERZ3164776.16	42230	44773	-	cyaA_S352T	Escherichia fosmidomycin resistant CyaA	core	AMR	POINT	FOSMIDOMYCIN	FOSMIDOMYCIN	POINTX	848	848	100.00	99.29	848	WP_000281668.1	adenylate cyclase CyaA	NA	NA
NA	ERZ3164776.17	54154	55383	+	mdtM	multidrug efflux MFS transporter MdtM	plus	AMR	AMR	EFFLUX	EFFLUX	EXACTX	410	410	100.00	100.00	410	AAC77293.1	multidrug efflux MFS transporter MdtM	NA	NA
NA	ERZ3164776.24	28432	28791	-	arsD	arsenite efflux transporter metallochaperone ArsD	plus	STRESS	METAL	ARSENIC	ARSENITE	BLASTX	120	120	100.00	90.00	120	AAB09625.1	arsenite efflux transporter metallochaperone ArsD	NA	NA
NA	ERZ3164776.28	39077	43318	-	fdeC	inverse autotransporter adhesin FdeC	plus	VIRULENCE	VIRULENCE	NA	NA	BLASTX	1414	1416	99.93	92.44	1415	ABE05822.1	inverse autotransporter adhesin FdeC	NA	NA
NA	ERZ3164776.3	252489	255590	+	acrF	multidrug efflux RND transporter permease subunit AcrF	plus	AMR	AMR	EFFLUX	EFFLUX	BLASTX	1034	1034	100.00	99.42	1034	AAC76298.1	multidrug efflux RND transporter permease subunit AcrF	NA	NA
NA	ERZ3164776.4	201768	203186	+	espX1	type III secretion system effector EspX1	plus	VIRULENCE	VIRULENCE	NA	NA	BLASTX	473	473	100.00	92.60	473	ADD54679.1	type III secretion system effector EspX1	NA	NA
NA	ERZ3164776.49	12762	14456	+	eilA	HilA family transcriptional regulator EilA	plus	VIRULENCE	VIRULENCE	NA	NA	EXACTX	565	565	100.00	100.00	565	CBG36837.1	HilA family transcriptional regulator EilA	NA	NA
NA	ERZ3164776.49	14514	24767	-	air	inverse autotransporter adhesin EaeX/Air	plus	VIRULENCE	VIRULENCE	NA	NA	EXACTX	3418	3418	100.00	100.00	3418	CAR15326.1	inverse autotransporter adhesin EaeX/Air	NA	NA
NA	ERZ3164776.53	14912	16042	-	blaEC	BlaEC family class C beta-lactamase	plus	AMR	AMR	BETA-LACTAM	BETA-LACTAM	BLASTX	377	377	100.00	98.67	377	AAZ85968.1	cephalosporin-hydrolyzing class C beta-lactamase EC-8	NA	NA
NA	ERZ3164776.64	1267	1530	-	ariR	biofilm/acid-resistance regulator AriR	plus	STRESS	ACID	NA	NA	BLASTX	88	88	100.00	98.86	88	AAC74250.1	biofilm/acid-resistance regulator AriR	NA	NA
NA	ERZ3164776.68	4098	4682	+	papH	P fimbrial minor subunit PapH	plus	VIRULENCE	VIRULENCE	NA	NA	BLASTX	195	195	100.00	98.46	195	CAA43563.1	P fimbrial minor subunit PapH	NA	NA
NA	ERZ3164776.68	4744	7251	+	papC	P fimbrial usher protein PapC	plus	VIRULENCE	VIRULENCE	NA	NA	BLASTX	836	836	100.00	96.31	841	CAA43564.1	P fimbrial usher protein PapC	NA	NA
NA	ERZ3164776.68	9852	10349	+	papF	P fimbrial tip protein PapF	plus	VIRULENCE	VIRULENCE	NA	NA	BLASTX	166	167	100.00	91.02	167	CAA43569.1	P fimbrial tip protein PapF	NA	NA
NA	ERZ3164776.68	10396	11403	+	papG-II	P fimbria tip G-adhesin PapG-II	plus	VIRULENCE	VIRULENCE	NA	NA	BLASTX	336	337	100.00	97.33	337	AAA24293.1	P fimbria tip G-adhesin PapG-II	NA	NA
NA	ERZ3164776.80	161	592	-	merR	mercury resistance transcriptional regulator MerR	plus	STRESS	METAL	MERCURY	MERCURY	BLASTX	144	144	100.00	93.75	144	CAA77320.1	mercury resistance transcriptional regulator MerR	NA	NA
NA	ERZ3164776.80	664	1011	+	merT	mercuric transport protein MerT	plus	STRESS	METAL	MERCURY	MERCURY	EXACTX	116	116	100.00	100.00	116	AAB59075.1	mercuric transport protein MerT	NA	NA
NA	ERZ3164776.80	1028	1300	+	merP	mercury resistance system periplasmic binding protein MerP	plus	STRESS	METAL	MERCURY	MERCURY	BLASTX	91	91	100.00	90.11	91	AAC38219.1	mercury resistance system periplasmic binding protein MerP	NA	NA
NA	ERZ3164776.80	1339	1758	+	merC	organomercurial transporter MerC	plus	STRESS	METAL	MERCURY	ORGANOMERCURY	EXACTX	140	140	100.00	100.00	140	AAC33908.1	organomercurial transporter MerC	NA	NA
NA	ERZ3164776.87	4516	4806	-	iss	increased serum survival lipoprotein Iss	plus	VIRULENCE	VIRULENCE	NA	NA	EXACTX	97	97	100.00	100.00	97	CAR12622.1	increased serum survival lipoprotein Iss	NA	NA
NA	ERZ3164776.96	1929	2741	+	sul2	sulfonamide-resistant dihydropteroate synthase Sul2	core	AMR	AMR	SULFONAMIDE	SULFONAMIDE	EXACTX	271	271	100.00	100.00	271	WP_001043265.1	sulfonamide-resistant dihydropteroate synthase Sul2	NA	NA
NA	ERZ3164776.96	2805	3605	+	aph(3'')-Ib	aminoglycoside O-phosphotransferase APH(3'')-Ib	core	AMR	AMR	AMINOGLYCOSIDE	STREPTOMYCIN	EXACTX	267	267	100.00	100.00	267	WP_001082319.1	aminoglycoside O-phosphotransferase APH(3'')-Ib	NA	NA
NA	ERZ3164776.96	3608	4441	+	aph(6)-Id	aminoglycoside O-phosphotransferase APH(6)-Id	core	AMR	AMR	AMINOGLYCOSIDE	STREPTOMYCIN	EXACTX	278	278	100.00	100.00	278	WP_000480968.1	aminoglycoside O-phosphotransferase APH(6)-Id	NA	NA
NA	ERZ3164776.99	2399	2869	+	dfrA17	trimethoprim-resistant dihydrofolate reductase DfrA17	core	AMR	AMR	TRIMETHOPRIM	TRIMETHOPRIM	EXACTX	157	157	100.00	100.00	157	WP_001389366.1	trimethoprim-resistant dihydrofolate reductase DfrA17	NA	NA
NA	ERZ3164776.99	3003	3788	+	aadA5	ANT(3'')-Ia family aminoglycoside nucleotidyltransferase AadA5	core	AMR	AMR	AMINOGLYCOSIDE	STREPTOMYCIN	EXACTX	262	262	100.00	100.00	262	WP_000503573.1	ANT(3'')-Ia family aminoglycoside nucleotidyltransferase AadA5	NA	NA
