Protein id	Contig id	Start	Stop	Strand	Element symbol	Element name	Scope	Type	Subtype	Class	Subclass	Method	Target length	Reference sequence length	% Coverage of reference	% Identity to reference	Alignment length	Closest reference accession	Closest reference name	HMM accession	HMM description
NA	ERZ3164687.106	335	625	-	iss	increased serum survival lipoprotein Iss	plus	VIRULENCE	VIRULENCE	NA	NA	EXACTX	97	97	100.00	100.00	97	ADN71659.1	increased serum survival lipoprotein Iss	NA	NA
NA	ERZ3164687.107	1	969	-	papG-II	P fimbria tip G-adhesin PapG-II	plus	VIRULENCE	VIRULENCE	NA	NA	BLASTX	323	337	96.14	97.53	324	AAA24293.1	P fimbria tip G-adhesin PapG-II	NA	NA
NA	ERZ3164687.107	1016	1513	-	papF	P fimbrial tip protein PapF	plus	VIRULENCE	VIRULENCE	NA	NA	BLASTX	166	167	100.00	91.02	167	CAA43569.1	P fimbrial tip protein PapF	NA	NA
NA	ERZ3164687.108	1	966	-	papG-III	P fimbria tip G-adhesin PapG-III	plus	VIRULENCE	VIRULENCE	NA	NA	BLASTX	322	335	96.12	100.00	322	CAA43558.1	P fimbria tip G-adhesin PapG-III	NA	NA
NA	ERZ3164687.108	1013	1513	-	papF	P fimbrial tip protein PapF	plus	VIRULENCE	VIRULENCE	NA	NA	BLASTX	167	167	100.00	98.20	167	CAA43569.1	P fimbrial tip protein PapF	NA	NA
NA	ERZ3164687.108	1592	2110	-	papE	P fimbrial minor subunit PapE	plus	VIRULENCE	VIRULENCE	NA	NA	EXACTX	173	173	100.00	100.00	173	CAA43568.1	P fimbrial minor subunit PapE	NA	NA
NA	ERZ3164687.11	15329	24946	+	clbB	colibactin hybrid non-ribosomal peptide synthetase/type I polyketide synthase ClbB	plus	VIRULENCE	VIRULENCE	NA	NA	EXACTX	3206	3206	100.00	100.00	3206	AMQ58400.1	colibactin hybrid non-ribosomal peptide synthetase/type I polyketide synthase ClbB	NA	NA
NA	ERZ3164687.11	49392	53756	+	clbN	colibactin non-ribosomal peptide synthetase ClbN	plus	VIRULENCE	VIRULENCE	NA	NA	EXACTX	1455	1455	100.00	100.00	1455	AMH08480.1	colibactin non-ribosomal peptide synthetase ClbN	NA	NA
NA	ERZ3164687.11	97060	98859	+	ybtP	yersiniabactin ABC transporter ATP-binding/permease protein YbtP	plus	VIRULENCE	VIRULENCE	NA	NA	BLASTX	600	600	100.00	99.83	600	CAA21388.1	yersiniabactin ABC transporter ATP-binding/permease protein YbtP	NA	NA
NA	ERZ3164687.11	98849	100648	+	ybtQ	yersiniabactin ABC transporter ATP-binding/permease protein YbtQ	plus	VIRULENCE	VIRULENCE	NA	NA	BLASTX	600	600	100.00	99.50	600	AAC69584.1	yersiniabactin ABC transporter ATP-binding/permease protein YbtQ	NA	NA
NA	ERZ3164687.2	5193	8294	-	acrF	multidrug efflux RND transporter permease subunit AcrF	plus	AMR	AMR	EFFLUX	EFFLUX	BLASTX	1034	1034	100.00	99.52	1034	AAC76298.1	multidrug efflux RND transporter permease subunit AcrF	NA	NA
NA	ERZ3164687.22	6466	6729	+	ariR	biofilm/acid-resistance regulator AriR	plus	STRESS	ACID	NA	NA	BLASTX	88	88	100.00	97.73	88	AAC74250.1	biofilm/acid-resistance regulator AriR	NA	NA
NA	ERZ3164687.24	17802	21929	+	vactox	vacuolating autotransporter toxin Vat	plus	VIRULENCE	VIRULENCE	NA	NA	EXACTX	1376	1376	100.00	100.00	1376	AAN78874.1	vacuolating autotransporter toxin Vat	NA	NA
NA	ERZ3164687.24	61163	65275	+	pic	serine protease autotransporter toxin Pic	plus	VIRULENCE	VIRULENCE	NA	NA	EXACTX	1371	1371	100.00	100.00	1371	AAN78833.1	serine protease autotransporter toxin Pic	NA	NA
NA	ERZ3164687.25	57636	61883	-	fdeC	inverse autotransporter adhesin FdeC	plus	VIRULENCE	VIRULENCE	NA	NA	BLASTX	1416	1416	100.00	99.79	1416	ABE05822.1	inverse autotransporter adhesin FdeC	NA	NA
NA	ERZ3164687.26	26092	27318	-	mdtM	multidrug efflux MFS transporter MdtM	plus	AMR	AMR	EFFLUX	EFFLUX	BLASTX	409	410	99.76	97.31	409	AAC77293.1	multidrug efflux MFS transporter MdtM	NA	NA
NA	ERZ3164687.3	39152	39481	+	emrE	multidrug efflux SMR transporter EmrE	plus	STRESS	BIOCIDE	EFFLUX	EFFLUX	BLASTX	110	110	100.00	98.18	110	CAA77936.1	multidrug efflux SMR transporter EmrE	NA	NA
NA	ERZ3164687.36	18834	19946	+	iroB	salmochelin biosynthesis C-glycosyltransferase IroB	plus	VIRULENCE	VIRULENCE	NA	NA	BLASTX	371	371	100.00	99.19	371	EOW04219.1	salmochelin biosynthesis C-glycosyltransferase IroB	NA	NA
NA	ERZ3164687.36	20089	23745	+	iroC	salmochelin/enterobactin export ABC transporter IroC	plus	VIRULENCE	VIRULENCE	NA	NA	BLASTX	1219	1219	100.00	99.59	1219	AUH19662.1	salmochelin/enterobactin export ABC transporter IroC	NA	NA
NA	ERZ3164687.36	23852	25078	+	iroD	catecholate siderophore esterase IroD	plus	VIRULENCE	VIRULENCE	NA	NA	BLASTX	409	409	100.00	99.51	409	ACJ63529.1	catecholate siderophore esterase IroD	NA	NA
NA	ERZ3164687.36	25166	26119	+	iroE	catecholate siderophore esterase IroE	plus	VIRULENCE	VIRULENCE	NA	NA	BLASTX	318	318	100.00	99.06	318	ACJ63530.1	catecholate siderophore esterase IroE	NA	NA
NA	ERZ3164687.36	26170	28344	-	iroN	siderophore salmochelin receptor IroN	plus	VIRULENCE	VIRULENCE	NA	NA	EXACTX	725	725	100.00	100.00	725	AAN79707.1	siderophore salmochelin receptor IroN	NA	NA
NA	ERZ3164687.36	32643	33143	-	focG	F1C fimbria minor subunit FocG	plus	VIRULENCE	VIRULENCE	NA	NA	BLASTX	167	166	100.00	98.80	167	AAB20438.1	F1C fimbria minor subunit FocG	NA	NA
NA	ERZ3164687.36	33708	36335	-	sfaF	S/F1C fimbrial biogenesis usher protein SfaF/FocD	plus	VIRULENCE	VIRULENCE	NA	NA	EXACTX	876	876	100.00	100.00	876	EIL44824.1	S/F1C fimbrial biogenesis usher protein SfaF/FocD	NA	NA
NA	ERZ3164687.42	14924	16054	-	blaEC-5	cephalosporin-hydrolyzing class C beta-lactamase EC-5	plus	AMR	AMR	BETA-LACTAM	CEPHALOSPORIN	ALLELEX	377	377	100.00	100.00	377	AAZ85965.1	cephalosporin-hydrolyzing class C beta-lactamase EC-5	NA	NA
NA	ERZ3164687.46	10961	12682	+	iucA	aerobactin synthase IucA	plus	VIRULENCE	VIRULENCE	NA	NA	BLASTX	574	576	100.00	98.61	576	EGI25746.1	aerobactin synthase IucA	NA	NA
NA	ERZ3164687.46	12686	13630	+	iucB	N(6)-hydroxylysine O-acetyltransferase IucB	plus	VIRULENCE	VIRULENCE	NA	NA	EXACTX	315	315	100.00	100.00	315	AAN82074.1	N(6)-hydroxylysine O-acetyltransferase IucB	NA	NA
NA	ERZ3164687.46	13633	15372	+	iucC	NIS family aerobactin synthetase IucC	plus	VIRULENCE	VIRULENCE	NA	NA	EXACTX	580	580	100.00	100.00	580	AAN82073.1	NIS family aerobactin synthetase IucC	NA	NA
NA	ERZ3164687.46	15372	16706	+	iucD	NADPH-dependent L-lysine N(6)-monooxygenase IucD	plus	VIRULENCE	VIRULENCE	NA	NA	BLASTX	445	445	100.00	98.88	445	AAD44749.1	NADPH-dependent L-lysine N(6)-monooxygenase IucD	NA	NA
NA	ERZ3164687.46	16715	18907	+	iutA	ferric aerobactin receptor IutA	plus	VIRULENCE	VIRULENCE	NA	NA	BLASTX	731	731	100.00	99.45	731	AAN45165.2	ferric aerobactin receptor IutA	NA	NA
NA	ERZ3164687.46	19854	23738	+	sat	serine protease autotransporter toxin Sat	plus	VIRULENCE	VIRULENCE	NA	NA	BLASTX	1295	1295	100.00	99.54	1295	AFK88558.1	serine protease autotransporter toxin Sat	NA	NA
NA	ERZ3164687.55	4703	6790	+	iha	bifunctional siderophore receptor/adhesin Iha	plus	VIRULENCE	VIRULENCE	NA	NA	EXACTX	696	696	100.00	100.00	696	AAN82058.1	bifunctional siderophore receptor/adhesin Iha	NA	NA
NA	ERZ3164687.62	1259	1483	+	mchB	microcin H47	plus	VIRULENCE	VIRULENCE	NA	NA	EXACTX	75	75	100.00	100.00	75	CAB54534.2	microcin H47	NA	NA
NA	ERZ3164687.62	5206	7299	+	mchF	microcin H47 export transporter peptidase/ATP-binding subunit MchF	plus	VIRULENCE	VIRULENCE	NA	NA	BLASTX	698	698	100.00	99.14	698	CAD56186.1	microcin H47 export transporter peptidase/ATP-binding subunit MchF	NA	NA
NA	ERZ3164687.66	3	2594	-	hlyA-alpha	RTX toxin hemolysin HlyA	plus	VIRULENCE	VIRULENCE	NA	NA	PARTIAL_CONTIG_ENDX	864	1024	84.38	97.34	864	CAQ77251.1	RTX toxin hemolysin HlyA	NA	NA
NA	ERZ3164687.7	82099	83286	-	emrD	multidrug efflux MFS transporter EmrD	plus	AMR	AMR	EFFLUX	EFFLUX	BLASTX	396	396	100.00	99.49	396	EFF04178.1	multidrug efflux MFS transporter EmrD	NA	NA
NA	ERZ3164687.73	975	1526	+	papA	P fimbria major subunit PapA	plus	VIRULENCE	VIRULENCE	NA	NA	BLASTX	184	185	100.00	99.46	185	CAA43562.1	P fimbria major subunit PapA	NA	NA
NA	ERZ3164687.73	1593	2177	+	papH	P fimbrial minor subunit PapH	plus	VIRULENCE	VIRULENCE	NA	NA	BLASTX	195	195	100.00	99.49	195	CAA43563.1	P fimbrial minor subunit PapH	NA	NA
NA	ERZ3164687.73	2239	4746	+	papC	P fimbrial usher protein PapC	plus	VIRULENCE	VIRULENCE	NA	NA	BLASTX	836	836	100.00	96.55	841	CAA43564.1	P fimbrial usher protein PapC	NA	NA
NA	ERZ3164687.81	3941	4798	+	blaTEM-30	inhibitor-resistant broad-spectrum class A beta-lactamase TEM-30	core	AMR	AMR	BETA-LACTAM	BETA-LACTAM	ALLELEX	286	286	100.00	100.00	286	WP_021561477.1	inhibitor-resistant broad-spectrum class A beta-lactamase TEM-30	NA	NA
NA	ERZ3164687.83	948	3989	-	cnf1	cytotoxic necrotizing factor CNF1	plus	VIRULENCE	VIRULENCE	NA	NA	BLASTX	1014	1014	100.00	99.90	1014	ABE10324.1	cytotoxic necrotizing factor CNF1	NA	NA
