Protein id	Contig id	Start	Stop	Strand	Element symbol	Element name	Scope	Type	Subtype	Class	Subclass	Method	Target length	Reference sequence length	% Coverage of reference	% Identity to reference	Alignment length	Closest reference accession	Closest reference name	HMM accession	HMM description
NA	ERZ3485574.12	15359	15649	+	iss	increased serum survival lipoprotein Iss	plus	VIRULENCE	VIRULENCE	NA	NA	EXACTX	97	97	100.00	100.00	97	ADN71659.1	increased serum survival lipoprotein Iss	NA	NA
NA	ERZ3485574.2	14706	24323	+	clbB	colibactin hybrid non-ribosomal peptide synthetase/type I polyketide synthase ClbB	plus	VIRULENCE	VIRULENCE	NA	NA	EXACTX	3206	3206	100.00	100.00	3206	AMQ58400.1	colibactin hybrid non-ribosomal peptide synthetase/type I polyketide synthase ClbB	NA	NA
NA	ERZ3485574.2	54422	58786	+	clbN	colibactin non-ribosomal peptide synthetase ClbN	plus	VIRULENCE	VIRULENCE	NA	NA	EXACTX	1455	1455	100.00	100.00	1455	AMH08480.1	colibactin non-ribosomal peptide synthetase ClbN	NA	NA
NA	ERZ3485574.2	102092	103891	+	ybtP	yersiniabactin ABC transporter ATP-binding/permease protein YbtP	plus	VIRULENCE	VIRULENCE	NA	NA	BLASTX	600	600	100.00	99.83	600	CAA21388.1	yersiniabactin ABC transporter ATP-binding/permease protein YbtP	NA	NA
NA	ERZ3485574.2	103881	105680	+	ybtQ	yersiniabactin ABC transporter ATP-binding/permease protein YbtQ	plus	VIRULENCE	VIRULENCE	NA	NA	BLASTX	600	600	100.00	99.67	600	AAC69584.1	yersiniabactin ABC transporter ATP-binding/permease protein YbtQ	NA	NA
NA	ERZ3485574.2	163780	164109	+	emrE	multidrug efflux SMR transporter EmrE	plus	STRESS	BIOCIDE	EFFLUX	EFFLUX	BLASTX	110	110	100.00	98.18	110	CAA77936.1	multidrug efflux SMR transporter EmrE	NA	NA
NA	ERZ3485574.2	522761	523192	-	marR_S3N	Escherichia ampicillin/chloramphenicol/quinolone/rifampin/tetracycline resistant MarR	core	AMR	POINT	MULTIDRUG	AMPICILLIN/CHLORAMPHENICOL/QUINOLONE/RIFAMPIN/TETRACYCLINE	POINTX	144	144	100.00	97.92	144	WP_000843414.1	transcriptional regulator MarR	NA	NA
NA	ERZ3485574.20	1998	6125	-	vactox	vacuolating autotransporter toxin Vat	plus	VIRULENCE	VIRULENCE	NA	NA	BLASTX	1376	1376	100.00	99.85	1376	CAD66214.1	vacuolating autotransporter toxin Vat	NA	NA
NA	ERZ3485574.20	25826	30070	+	fdeC	inverse autotransporter adhesin FdeC	plus	VIRULENCE	VIRULENCE	NA	NA	BLASTX	1415	1416	100.00	97.95	1416	ABE05822.1	inverse autotransporter adhesin FdeC	NA	NA
NA	ERZ3485574.21	71330	72952	-	mcr-3.4	phosphoethanolamine--lipid A transferase MCR-3.4	core	AMR	AMR	COLISTIN	COLISTIN	ALLELEX	541	541	100.00	100.00	541	WP_065804663.1	phosphoethanolamine--lipid A transferase MCR-3.4	NA	NA
NA	ERZ3485574.21	75090	75947	-	aac(3)-IId	aminoglycoside N-acetyltransferase AAC(3)-IId	core	AMR	AMR	AMINOGLYCOSIDE	GENTAMICIN	EXACTX	286	286	100.00	100.00	286	WP_000557454.1	aminoglycoside N-acetyltransferase AAC(3)-IId	NA	NA
NA	ERZ3485574.29	938	3979	-	cnf1	cytotoxic necrotizing factor CNF1	plus	VIRULENCE	VIRULENCE	NA	NA	EXACTX	1014	1014	100.00	100.00	1014	ABE10324.1	cytotoxic necrotizing factor CNF1	NA	NA
NA	ERZ3485574.29	8577	11648	-	hlyA-alpha	RTX toxin hemolysin HlyA	plus	VIRULENCE	VIRULENCE	NA	NA	BLASTX	1024	1024	100.00	96.09	1024	CAQ77251.1	RTX toxin hemolysin HlyA	NA	NA
NA	ERZ3485574.3	362640	365741	+	acrF	multidrug efflux RND transporter permease subunit AcrF	plus	AMR	AMR	EFFLUX	EFFLUX	BLASTX	1034	1034	100.00	99.42	1034	AAC76298.1	multidrug efflux RND transporter permease subunit AcrF	NA	NA
NA	ERZ3485574.30	18639	19751	+	iroB	salmochelin biosynthesis C-glycosyltransferase IroB	plus	VIRULENCE	VIRULENCE	NA	NA	BLASTX	371	371	100.00	99.19	371	EOW04219.1	salmochelin biosynthesis C-glycosyltransferase IroB	NA	NA
NA	ERZ3485574.30	19894	23550	+	iroC	salmochelin/enterobactin export ABC transporter IroC	plus	VIRULENCE	VIRULENCE	NA	NA	BLASTX	1219	1219	100.00	99.67	1219	AUH19662.1	salmochelin/enterobactin export ABC transporter IroC	NA	NA
NA	ERZ3485574.30	23657	24883	+	iroD	catecholate siderophore esterase IroD	plus	VIRULENCE	VIRULENCE	NA	NA	BLASTX	409	409	100.00	99.76	409	ACJ63529.1	catecholate siderophore esterase IroD	NA	NA
NA	ERZ3485574.30	24971	25924	+	iroE	catecholate siderophore esterase IroE	plus	VIRULENCE	VIRULENCE	NA	NA	BLASTX	318	318	100.00	99.37	318	ACJ63530.1	catecholate siderophore esterase IroE	NA	NA
NA	ERZ3485574.30	25975	28149	-	iroN	siderophore salmochelin receptor IroN	plus	VIRULENCE	VIRULENCE	NA	NA	BLASTX	725	725	100.00	99.72	725	AAN79707.1	siderophore salmochelin receptor IroN	NA	NA
NA	ERZ3485574.33	1815	2039	+	mchB	microcin H47	plus	VIRULENCE	VIRULENCE	NA	NA	EXACTX	75	75	100.00	100.00	75	CAB54534.2	microcin H47	NA	NA
NA	ERZ3485574.33	5759	7852	+	mchF	microcin H47 export transporter peptidase/ATP-binding subunit MchF	plus	VIRULENCE	VIRULENCE	NA	NA	BLASTX	698	698	100.00	98.57	698	CAD56186.1	microcin H47 export transporter peptidase/ATP-binding subunit MchF	NA	NA
NA	ERZ3485574.33	17804	20431	+	sfaF	S/F1C fimbrial biogenesis usher protein SfaF/FocD	plus	VIRULENCE	VIRULENCE	NA	NA	BLASTX	876	876	100.00	99.66	876	ASJ31253.1	S/F1C fimbrial biogenesis usher protein SfaF/FocD	NA	NA
NA	ERZ3485574.37	625	1497	+	blaCTX-M-55	extended-spectrum class A beta-lactamase CTX-M-55	core	AMR	AMR	BETA-LACTAM	CEPHALOSPORIN	ALLELEX	291	291	100.00	100.00	291	WP_015387340.1	extended-spectrum class A beta-lactamase CTX-M-55	NA	NA
NA	ERZ3485574.37	5740	6393	+	qnrS1	quinolone resistance pentapeptide repeat protein QnrS1	core	AMR	AMR	QUINOLONE	QUINOLONE	ALLELEX	218	218	100.00	100.00	218	WP_001516695.1	quinolone resistance pentapeptide repeat protein QnrS1	NA	NA
NA	ERZ3485574.37	10439	11341	-	mph(A)	Mph(A) family macrolide 2'-phosphotransferase	core	AMR	AMR	MACROLIDE	AZITHROMYCIN/ERYTHROMYCIN/SPIRAMYCIN/TELITHROMYCIN	EXACTX	301	301	100.00	100.00	301	WP_000219391.1	Mph(A) family macrolide 2'-phosphotransferase	NA	NA
NA	ERZ3485574.39	264	1268	-	papG-III	P fimbria tip G-adhesin PapG-III	plus	VIRULENCE	VIRULENCE	NA	NA	BLASTX	335	335	100.00	99.10	335	CAA43558.1	P fimbria tip G-adhesin PapG-III	NA	NA
NA	ERZ3485574.39	1315	1815	-	papF	P fimbrial tip protein PapF	plus	VIRULENCE	VIRULENCE	NA	NA	BLASTX	167	167	100.00	97.01	167	CAA43569.1	P fimbrial tip protein PapF	NA	NA
NA	ERZ3485574.39	1894	2412	-	papE	P fimbrial minor subunit PapE	plus	VIRULENCE	VIRULENCE	NA	NA	EXACTX	173	173	100.00	100.00	173	CAA43568.1	P fimbrial minor subunit PapE	NA	NA
NA	ERZ3485574.39	4411	6918	-	papC	P fimbrial usher protein PapC	plus	VIRULENCE	VIRULENCE	NA	NA	BLASTX	836	836	100.00	96.43	841	CAA43564.1	P fimbrial usher protein PapC	NA	NA
NA	ERZ3485574.39	6980	7564	-	papH	P fimbrial minor subunit PapH	plus	VIRULENCE	VIRULENCE	NA	NA	BLASTX	195	195	100.00	98.97	195	CAA43563.1	P fimbrial minor subunit PapH	NA	NA
NA	ERZ3485574.5	82144	83331	-	emrD	multidrug efflux MFS transporter EmrD	plus	AMR	AMR	EFFLUX	EFFLUX	BLASTX	396	396	100.00	99.24	396	EFF04178.1	multidrug efflux MFS transporter EmrD	NA	NA
NA	ERZ3485574.50	1636	2370	-	erm(B)	23S rRNA (adenine(2058)-N(6))-methyltransferase Erm(B)	core	AMR	AMR	LINCOSAMIDE/MACROLIDE/STREPTOGRAMIN	CLINDAMYCIN/ERYTHROMYCIN/STREPTOGRAMIN B	BLASTX	245	245	100.00	99.59	245	WP_002321849.1	23S rRNA (adenine(2058)-N(6))-methyltransferase Erm(B)	NA	NA
NA	ERZ3485574.63	366	914	-	papA	P fimbria major subunit PapA	plus	VIRULENCE	VIRULENCE	NA	NA	BLASTX	183	184	100.00	83.70	184	ENA25238.1	P fimbria major subunit PapA	NA	NA
NA	ERZ3485574.64	173	811	-	catA2	type A-2 chloramphenicol O-acetyltransferase CatII	core	AMR	AMR	PHENICOL	CHLORAMPHENICOL	EXACTX	213	213	100.00	100.00	213	WP_001011939.1	type A-2 chloramphenicol O-acetyltransferase CatII	NA	NA
NA	ERZ3485574.7	206083	206346	-	ariR	biofilm/acid-resistance regulator AriR	plus	STRESS	ACID	NA	NA	BLASTX	88	88	100.00	97.73	88	AAC74250.1	biofilm/acid-resistance regulator AriR	NA	NA
NA	ERZ3485574.8	84411	85541	-	blaEC	BlaEC family class C beta-lactamase	plus	AMR	AMR	BETA-LACTAM	BETA-LACTAM	BLASTX	377	377	100.00	99.73	377	AAZ85965.1	cephalosporin-hydrolyzing class C beta-lactamase EC-5	NA	NA
