Protein id	Contig id	Start	Stop	Strand	Element symbol	Element name	Scope	Type	Subtype	Class	Subclass	Method	Target length	Reference sequence length	% Coverage of reference	% Identity to reference	Alignment length	Closest reference accession	Closest reference name	HMM accession	HMM description
NA	ERZ3485386.1	290572	293196	-	gyrA_S83L	Escherichia quinolone resistant GyrA	core	AMR	POINT	QUINOLONE	QUINOLONE	POINTX	875	878	99.66	99.09	875	WP_001281243.1	DNA gyrase subunit A GyrA	NA	NA
NA	ERZ3485386.14	5367	8399	-	acrF	multidrug efflux RND transporter permease subunit AcrF	plus	AMR	AMR	EFFLUX	EFFLUX	BLASTX	1011	1034	97.78	99.41	1011	AAC76298.1	multidrug efflux RND transporter permease subunit AcrF	NA	NA
NA	ERZ3485386.2	105672	105935	+	ariR	biofilm/acid-resistance regulator AriR	plus	STRESS	ACID	NA	NA	EXACTX	88	88	100.00	100.00	88	AAC74250.1	biofilm/acid-resistance regulator AriR	NA	NA
NA	ERZ3485386.25	3788	8029	-	fdeC	inverse autotransporter adhesin FdeC	plus	VIRULENCE	VIRULENCE	NA	NA	BLASTX	1414	1416	99.93	91.31	1415	ABE05822.1	inverse autotransporter adhesin FdeC	NA	NA
NA	ERZ3485386.32	229	657	+	silE	silver-binding protein SilE	plus	STRESS	METAL	SILVER	SILVER	EXACTX	143	143	100.00	100.00	143	AAD11743.1	silver-binding protein SilE	NA	NA
NA	ERZ3485386.4	4665	5795	-	blaEC	BlaEC family class C beta-lactamase	plus	AMR	AMR	BETA-LACTAM	BETA-LACTAM	BLASTX	377	377	100.00	98.67	377	WP_063610930.1	extended-spectrum class C beta-lactamase EC-15	NA	NA
NA	ERZ3485386.4	179168	180394	-	mdtM	multidrug efflux MFS transporter MdtM	plus	AMR	AMR	EFFLUX	EFFLUX	BLASTX	409	410	99.76	98.29	409	AAC77293.1	multidrug efflux MFS transporter MdtM	NA	NA
NA	ERZ3485386.45	261	1658	-	pcoS	copper resistance membrane spanning protein PcoS	plus	STRESS	METAL	COPPER	COPPER	BLASTX	466	466	100.00	99.79	466	CAA58530.1	copper resistance membrane spanning protein PcoS	NA	NA
NA	ERZ3485386.45	1658	2335	-	pcoR	copper response regulator transcription factor PcoR	plus	STRESS	METAL	COPPER	COPPER	EXACTX	226	226	100.00	100.00	226	CAA58529.1	copper response regulator transcription factor PcoR	NA	NA
NA	ERZ3485386.45	2393	3319	-	pcoD	copper resistance inner membrane protein PcoD	plus	STRESS	METAL	COPPER	COPPER	EXACTX	309	309	100.00	100.00	309	CAA58528.1	copper resistance inner membrane protein PcoD	NA	NA
NA	ERZ3485386.45	3327	3704	-	pcoC	copper resistance system metallochaperone PcoC	plus	STRESS	METAL	COPPER	COPPER	EXACTX	126	126	100.00	100.00	126	CAA58527.1	copper resistance system metallochaperone PcoC	NA	NA
NA	ERZ3485386.45	3747	4634	-	pcoB	copper-binding protein PcoB	plus	STRESS	METAL	COPPER	COPPER	EXACTX	296	296	100.00	100.00	296	CAA58526.1	copper-binding protein PcoB	NA	NA
NA	ERZ3485386.45	4643	6457	-	pcoA	multicopper oxidase PcoA	plus	STRESS	METAL	COPPER	COPPER	EXACTX	605	605	100.00	100.00	605	CAA58525.1	multicopper oxidase PcoA	NA	NA
NA	ERZ3485386.45	8428	10902	-	silP	Ag(+)-translocating P-type ATPase SilP	plus	STRESS	METAL	SILVER	SILVER	BLASTX	825	824	100.00	94.19	826	AAD11750.1	Ag(+)-translocating P-type ATPase SilP	NA	NA
NA	ERZ3485386.45	11529	14672	-	silA	Cu(+)/Ag(+) efflux RND transporter permease subunit SilA	plus	STRESS	METAL	COPPER/SILVER	COPPER/SILVER	BLASTX	1048	1048	100.00	96.76	1048	AAD11749.1	Cu(+)/Ag(+) efflux RND transporter permease subunit SilA	NA	NA
NA	ERZ3485386.45	14686	15975	-	silB	Cu(+)/Ag(+) efflux RND transporter periplasmic adaptor subunit SilB	plus	STRESS	METAL	COPPER/SILVER	COPPER/SILVER	BLASTX	430	430	100.00	96.28	430	AAD11748.1	Cu(+)/Ag(+) efflux RND transporter periplasmic adaptor subunit SilB	NA	NA
NA	ERZ3485386.45	16092	16442	-	silF	Cu(+)/Ag(+) efflux RND transporter periplasmic metallochaperone SilF	plus	STRESS	METAL	COPPER/SILVER	COPPER/SILVER	BLASTX	117	117	100.00	97.44	117	KGL71342.1	Cu(+)/Ag(+) efflux RND transporter periplasmic metallochaperone SilF	NA	NA
NA	ERZ3485386.45	16473	17855	-	silC	Cu(+)/Ag(+) efflux RND transporter outer membrane channel SilC	plus	STRESS	METAL	COPPER/SILVER	COPPER/SILVER	EXACTX	461	461	100.00	100.00	461	SPD96884.1	Cu(+)/Ag(+) efflux RND transporter outer membrane channel SilC	NA	NA
NA	ERZ3485386.45	18045	18722	+	silR	copper/silver response regulator transcription factor SilR	plus	STRESS	METAL	COPPER/SILVER	COPPER/SILVER	BLASTX	226	226	100.00	98.23	226	SPD96883.1	copper/silver response regulator transcription factor SilR	NA	NA
NA	ERZ3485386.45	18718	20190	+	silS	copper/silver sensor histidine kinase SilS	plus	STRESS	METAL	COPPER/SILVER	COPPER/SILVER	BLASTX	491	491	100.00	98.57	491	SPD96882.1	copper/silver sensor histidine kinase SilS	NA	NA
NA	ERZ3485386.46	12301	12729	-	silE	silver-binding protein SilE	plus	STRESS	METAL	SILVER	SILVER	BLASTX	143	143	100.00	92.31	143	AAD11743.1	silver-binding protein SilE	NA	NA
NA	ERZ3485386.47	10837	11268	-	pcoE	copper resistance system metallochaperone PcoE	plus	STRESS	METAL	COPPER	COPPER	EXACTX	144	144	100.00	100.00	144	CAA58532.1	copper resistance system metallochaperone PcoE	NA	NA
NA	ERZ3485386.5	192953	194371	+	espX1	type III secretion system effector EspX1	plus	VIRULENCE	VIRULENCE	NA	NA	BLASTX	473	473	100.00	91.33	473	ADD54679.1	type III secretion system effector EspX1	NA	NA
NA	ERZ3485386.51	136	1008	-	blaCTX-M-14	extended-spectrum class A beta-lactamase CTX-M-14	core	AMR	AMR	BETA-LACTAM	CEPHALOSPORIN	ALLELEX	291	291	100.00	100.00	291	WP_001617865.1	extended-spectrum class A beta-lactamase CTX-M-14	NA	NA
NA	ERZ3485386.51	6780	7115	+	qnrS	QnrS family quinolone resistance pentapeptide repeat protein	core	AMR	AMR	QUINOLONE	QUINOLONE	PARTIALX	112	218	51.38	100.00	112	WP_001516695.1	quinolone resistance pentapeptide repeat protein QnrS1	NA	NA
NA	ERZ3485386.52	372	1160	+	aadA22	ANT(3'')-Ia family aminoglycoside nucleotidyltransferase AadA22	core	AMR	AMR	AMINOGLYCOSIDE	STREPTOMYCIN	EXACTX	263	263	100.00	100.00	263	WP_024198294.1	ANT(3'')-Ia family aminoglycoside nucleotidyltransferase AadA22	NA	NA
NA	ERZ3485386.52	1330	2226	+	aac(3)-VIa	aminoglycoside N-acetyltransferase AAC(3)-VIa	core	AMR	AMR	AMINOGLYCOSIDE	GENTAMICIN	EXACTX	299	299	100.00	100.00	299	WP_000131886.1	aminoglycoside N-acetyltransferase AAC(3)-VIa	NA	NA
NA	ERZ3485386.56	923	2839	+	tet(M)	tetracycline resistance ribosomal protection protein Tet(M)	core	AMR	AMR	TETRACYCLINE	TETRACYCLINE	BLASTX	639	639	100.00	98.12	639	WP_063856397.1	tetracycline resistance ribosomal protection protein Tet(M)	NA	NA
NA	ERZ3485386.64	1111	2322	-	floR	chloramphenicol/florfenicol efflux MFS transporter FloR	core	AMR	AMR	PHENICOL	CHLORAMPHENICOL/FLORFENICOL	BLASTX	404	404	100.00	99.50	404	WP_000214123.1	chloramphenicol/florfenicol efflux MFS transporter FloR	NA	NA
NA	ERZ3485386.67	40	471	+	pcoE	copper resistance system metallochaperone PcoE	plus	STRESS	METAL	COPPER	COPPER	BLASTX	144	144	100.00	92.36	144	CAA58532.1	copper resistance system metallochaperone PcoE	NA	NA
NA	ERZ3485386.7	39138	39467	+	emrE	multidrug efflux SMR transporter EmrE	plus	STRESS	BIOCIDE	EFFLUX	EFFLUX	BLASTX	110	110	100.00	98.18	110	CAA77936.1	multidrug efflux SMR transporter EmrE	NA	NA
NA	ERZ3485386.7	47633	47923	-	iss	increased serum survival lipoprotein Iss	plus	VIRULENCE	VIRULENCE	NA	NA	EXACTX	97	97	100.00	100.00	97	BAG76115.1	increased serum survival lipoprotein Iss	NA	NA
NA	ERZ3485386.8	30202	30771	+	lpfA-O113	long polar fimbria major subunit LpfA-O113	plus	VIRULENCE	VIRULENCE	NA	NA	EXACTX	190	190	100.00	100.00	190	AAT76975.1	long polar fimbria major subunit LpfA-O113	NA	NA
NA	ERZ3485386.91	308	1165	-	blaTEM-1	broad-spectrum class A beta-lactamase TEM-1	core	AMR	AMR	BETA-LACTAM	BETA-LACTAM	ALLELEX	286	286	100.00	100.00	286	WP_000027057.1	broad-spectrum class A beta-lactamase TEM-1	NA	NA
