Protein id	Contig id	Start	Stop	Strand	Element symbol	Element name	Scope	Type	Subtype	Class	Subclass	Method	Target length	Reference sequence length	% Coverage of reference	% Identity to reference	Alignment length	Closest reference accession	Closest reference name	HMM accession	HMM description
NA	ERZ3484952.1	501611	503410	-	ybtQ	yersiniabactin ABC transporter ATP-binding/permease protein YbtQ	plus	VIRULENCE	VIRULENCE	NA	NA	BLASTX	600	600	100.00	99.67	600	AAC69584.1	yersiniabactin ABC transporter ATP-binding/permease protein YbtQ	NA	NA
NA	ERZ3484952.1	503400	505199	-	ybtP	yersiniabactin ABC transporter ATP-binding/permease protein YbtP	plus	VIRULENCE	VIRULENCE	NA	NA	BLASTX	600	600	100.00	99.67	600	CAA21388.1	yersiniabactin ABC transporter ATP-binding/permease protein YbtP	NA	NA
NA	ERZ3484952.102	1283	2140	-	blaTEM-1	broad-spectrum class A beta-lactamase TEM-1	core	AMR	AMR	BETA-LACTAM	BETA-LACTAM	ALLELEX	286	286	100.00	100.00	286	WP_000027057.1	broad-spectrum class A beta-lactamase TEM-1	NA	NA
NA	ERZ3484952.107	3	1172	-	tet(A)	tetracycline efflux MFS transporter Tet(A)	core	AMR	AMR	TETRACYCLINE	TETRACYCLINE	BLASTX	390	399	97.74	100.00	390	WP_000804063.1	tetracycline efflux MFS transporter Tet(A)	NA	NA
NA	ERZ3484952.119	707	1213	-	dfrA8	trimethoprim-resistant dihydrofolate reductase DfrA8	core	AMR	AMR	TRIMETHOPRIM	TRIMETHOPRIM	EXACTX	169	169	100.00	100.00	169	WP_000571065.1	trimethoprim-resistant dihydrofolate reductase DfrA8	NA	NA
NA	ERZ3484952.14	13584	14303	-	nfsA_Q67STOP	Escherichia nitrofurantoin resistant NfsA	core	AMR	POINT	NITROFURAN	NITROFURANTOIN	POINTX	240	240	100.00	97.08	240	WP_089631889.1	nitroreductase NfsA	NA	NA
NA	ERZ3484952.15	101104	101394	-	iss	increased serum survival lipoprotein Iss	plus	VIRULENCE	VIRULENCE	NA	NA	EXACTX	97	97	100.00	100.00	97	CAR12622.1	increased serum survival lipoprotein Iss	NA	NA
NA	ERZ3484952.16	87556	88743	-	emrD	multidrug efflux MFS transporter EmrD	plus	AMR	AMR	EFFLUX	EFFLUX	BLASTX	396	396	100.00	99.75	396	EFF04178.1	multidrug efflux MFS transporter EmrD	NA	NA
NA	ERZ3484952.16	106601	113620	+	air	inverse autotransporter adhesin EaeX/Air	plus	VIRULENCE	VIRULENCE	NA	NA	PARTIAL_CONTIG_ENDX	2340	3418	68.46	90.68	2340	CAR15326.1	inverse autotransporter adhesin EaeX/Air	NA	NA
NA	ERZ3484952.19	45142	47685	-	cyaA_S352T	Escherichia fosmidomycin resistant CyaA	core	AMR	POINT	FOSMIDOMYCIN	FOSMIDOMYCIN	POINTX	848	848	100.00	99.29	848	WP_000281668.1	adenylate cyclase CyaA	NA	NA
NA	ERZ3484952.2	5815	8916	-	acrF	multidrug efflux RND transporter permease subunit AcrF	plus	AMR	AMR	EFFLUX	EFFLUX	BLASTX	1034	1034	100.00	99.32	1034	AAC76298.1	multidrug efflux RND transporter permease subunit AcrF	NA	NA
NA	ERZ3484952.20	4212	5906	-	eilA	HilA family transcriptional regulator EilA	plus	VIRULENCE	VIRULENCE	NA	NA	BLASTX	565	565	100.00	99.47	565	ACB16655.1	HilA family transcriptional regulator EilA	NA	NA
NA	ERZ3484952.23	63657	63920	-	ariR	biofilm/acid-resistance regulator AriR	plus	STRESS	ACID	NA	NA	BLASTX	88	88	100.00	98.86	88	AAC74250.1	biofilm/acid-resistance regulator AriR	NA	NA
NA	ERZ3484952.46	3402	3749	+	aap	dispersin Aap	plus	VIRULENCE	VIRULENCE	NA	NA	BLASTX	116	116	100.00	95.69	116	CBG27807.1	dispersin Aap	NA	NA
NA	ERZ3484952.46	5077	5190	-	astA	heat-stable enterotoxin EAST1	plus	VIRULENCE	VIRULENCE	NA	NA	BLASTX	38	38	100.00	92.11	38	AAM88299.1	heat-stable enterotoxin EAST1	NA	NA
NA	ERZ3484952.5	76761	78179	-	espX1	type III secretion system effector EspX1	plus	VIRULENCE	VIRULENCE	NA	NA	BLASTX	473	473	100.00	93.45	473	ADD54679.1	type III secretion system effector EspX1	NA	NA
NA	ERZ3484952.50	17845	19071	-	mdtM	multidrug efflux MFS transporter MdtM	plus	AMR	AMR	EFFLUX	EFFLUX	BLASTX	409	410	99.76	97.56	409	AAC77293.1	multidrug efflux MFS transporter MdtM	NA	NA
NA	ERZ3484952.51	6171	10262	+	eatA	serine protease autotransporter toxin EatA	plus	VIRULENCE	VIRULENCE	NA	NA	BLASTX	1364	1364	100.00	98.90	1364	CAI79539.1	serine protease autotransporter toxin EatA	NA	NA
NA	ERZ3484952.61	5699	6415	+	nfaE	Dr family non-fimbrial adhesin I chaperone NfaE	plus	VIRULENCE	VIRULENCE	NA	NA	BLASTX	239	247	96.76	99.58	239	AAK17180.1	Dr family non-fimbrial adhesin I chaperone NfaE	NA	NA
NA	ERZ3484952.61	6536	9115	+	afaC	AfaC-I/III family usher protein	plus	VIRULENCE	VIRULENCE	NA	NA	BLASTX	860	860	100.00	99.30	860	CAW30799.1	AfaC-I/III family usher protein	NA	NA
NA	ERZ3484952.63	148	1050	+	mph(A)	Mph(A) family macrolide 2'-phosphotransferase	core	AMR	AMR	MACROLIDE	AZITHROMYCIN/ERYTHROMYCIN/SPIRAMYCIN/TELITHROMYCIN	EXACTX	301	301	100.00	100.00	301	WP_000219391.1	Mph(A) family macrolide 2'-phosphotransferase	NA	NA
NA	ERZ3484952.63	6367	7203	-	sul1	sulfonamide-resistant dihydropteroate synthase Sul1	core	AMR	AMR	SULFONAMIDE	SULFONAMIDE	EXACTX	279	279	100.00	100.00	279	WP_000259031.1	sulfonamide-resistant dihydropteroate synthase Sul1	NA	NA
NA	ERZ3484952.63	7200	7544	-	qacEdelta1	quaternary ammonium compound efflux SMR transporter QacE delta 1	core	STRESS	BIOCIDE	QUATERNARY AMMONIUM	QUATERNARY AMMONIUM	ALLELEX	115	115	100.00	100.00	115	WP_000679427.1	quaternary ammonium compound efflux SMR transporter QacE delta 1	NA	NA
NA	ERZ3484952.63	7753	8538	-	aadA5	ANT(3'')-Ia family aminoglycoside nucleotidyltransferase AadA5	core	AMR	AMR	AMINOGLYCOSIDE	STREPTOMYCIN	EXACTX	262	262	100.00	100.00	262	WP_000503573.1	ANT(3'')-Ia family aminoglycoside nucleotidyltransferase AadA5	NA	NA
NA	ERZ3484952.63	8672	9142	-	dfrA17	trimethoprim-resistant dihydrofolate reductase DfrA17	core	AMR	AMR	TRIMETHOPRIM	TRIMETHOPRIM	EXACTX	157	157	100.00	100.00	157	WP_001389366.1	trimethoprim-resistant dihydrofolate reductase DfrA17	NA	NA
NA	ERZ3484952.77	2081	3166	-	capU	putative hexosyltransferase CapU	plus	VIRULENCE	VIRULENCE	NA	NA	INTERNAL_STOP	362	362	100.00	99.72	362	CAV02025.1	putative hexosyltransferase CapU	NA	NA
NA	ERZ3484952.8	13461	14591	+	blaEC	BlaEC family class C beta-lactamase	plus	AMR	AMR	BETA-LACTAM	BETA-LACTAM	BLASTX	377	377	100.00	98.14	377	AAZ85968.1	cephalosporin-hydrolyzing class C beta-lactamase EC-8	NA	NA
NA	ERZ3484952.86	2536	3408	-	blaCTX-M-27	extended-spectrum class A beta-lactamase CTX-M-27	core	AMR	AMR	BETA-LACTAM	CEPHALOSPORIN	ALLELEX	291	291	100.00	100.00	291	WP_032277257.1	extended-spectrum class A beta-lactamase CTX-M-27	NA	NA
NA	ERZ3484952.9	106317	110564	-	fdeC	inverse autotransporter adhesin FdeC	plus	VIRULENCE	VIRULENCE	NA	NA	BLASTX	1416	1416	100.00	94.21	1416	ABE05822.1	inverse autotransporter adhesin FdeC	NA	NA
NA	ERZ3484952.97	110	943	-	aph(6)-Id	aminoglycoside O-phosphotransferase APH(6)-Id	core	AMR	AMR	AMINOGLYCOSIDE	STREPTOMYCIN	EXACTX	278	278	100.00	100.00	278	WP_000480972.1	aminoglycoside O-phosphotransferase APH(6)-Id	NA	NA
NA	ERZ3484952.97	946	1728	-	aph(3'')-Ib	aminoglycoside O-phosphotransferase APH(3'')-Ib	core	AMR	AMR	AMINOGLYCOSIDE	STREPTOMYCIN	BLASTX	261	267	97.75	100.00	261	WP_001082319.1	aminoglycoside O-phosphotransferase APH(3'')-Ib	NA	NA
NA	ERZ3484952.97	1809	2621	-	sul2	sulfonamide-resistant dihydropteroate synthase Sul2	core	AMR	AMR	SULFONAMIDE	SULFONAMIDE	EXACTX	271	271	100.00	100.00	271	WP_001043260.1	sulfonamide-resistant dihydropteroate synthase Sul2	NA	NA
