Protein id	Contig id	Start	Stop	Strand	Element symbol	Element name	Scope	Type	Subtype	Class	Subclass	Method	Target length	Reference sequence length	% Coverage of reference	% Identity to reference	Alignment length	Closest reference accession	Closest reference name	HMM accession	HMM description
NA	ERZ3485857.104	543	1769	+	mef(B)	macrolide efflux MFS transporter Mef(B)	core	AMR	AMR	MACROLIDE	AZITHROMYCIN/ERYTHROMYCIN	EXACTX	409	409	100.00	100.00	409	WP_032492336.1	macrolide efflux MFS transporter Mef(B)	NA	NA
NA	ERZ3485857.104	3533	4321	+	sul3	sulfonamide-resistant dihydropteroate synthase Sul3	core	AMR	AMR	SULFONAMIDE	SULFONAMIDE	EXACTX	263	263	100.00	100.00	263	WP_000034420.1	sulfonamide-resistant dihydropteroate synthase Sul3	NA	NA
NA	ERZ3485857.107	1947	2378	-	pcoE	copper resistance system metallochaperone PcoE	plus	STRESS	METAL	COPPER	COPPER	BLASTX	144	144	100.00	92.36	144	CAA58532.1	copper resistance system metallochaperone PcoE	NA	NA
NA	ERZ3485857.107	2599	3996	-	pcoS	copper resistance membrane spanning protein PcoS	plus	STRESS	METAL	COPPER	COPPER	BLASTX	466	466	100.00	99.36	466	CAA58530.1	copper resistance membrane spanning protein PcoS	NA	NA
NA	ERZ3485857.108	1767	2963	-	tet(A)	tetracycline efflux MFS transporter Tet(A)	core	AMR	AMR	TETRACYCLINE	TETRACYCLINE	BLASTX	399	399	100.00	99.75	399	WP_000804064.1	tetracycline efflux MFS transporter Tet(A)	NA	NA
NA	ERZ3485857.110	2712	3569	-	aac(3)-IId	aminoglycoside N-acetyltransferase AAC(3)-IId	core	AMR	AMR	AMINOGLYCOSIDE	GENTAMICIN	EXACTX	286	286	100.00	100.00	286	WP_000557454.1	aminoglycoside N-acetyltransferase AAC(3)-IId	NA	NA
NA	ERZ3485857.115	1189	2400	-	floR	chloramphenicol/florfenicol efflux MFS transporter FloR	core	AMR	AMR	PHENICOL	CHLORAMPHENICOL/FLORFENICOL	BLASTX	404	404	100.00	99.50	404	WP_000214123.1	chloramphenicol/florfenicol efflux MFS transporter FloR	NA	NA
NA	ERZ3485857.118	925	2841	+	tet(M)	tetracycline resistance ribosomal protection protein Tet(M)	core	AMR	AMR	TETRACYCLINE	TETRACYCLINE	BLASTX	639	639	100.00	98.12	639	WP_063856397.1	tetracycline resistance ribosomal protection protein Tet(M)	NA	NA
NA	ERZ3485857.131	412	1224	-	sul2	sulfonamide-resistant dihydropteroate synthase Sul2	core	AMR	AMR	SULFONAMIDE	SULFONAMIDE	EXACTX	271	271	100.00	100.00	271	WP_001043260.1	sulfonamide-resistant dihydropteroate synthase Sul2	NA	NA
NA	ERZ3485857.28	870	3344	-	silP	Ag(+)-translocating P-type ATPase SilP	plus	STRESS	METAL	SILVER	SILVER	BLASTX	825	824	100.00	94.19	826	AAD11750.1	Ag(+)-translocating P-type ATPase SilP	NA	NA
NA	ERZ3485857.28	3972	7115	-	silA	Cu(+)/Ag(+) efflux RND transporter permease subunit SilA	plus	STRESS	METAL	COPPER/SILVER	COPPER/SILVER	BLASTX	1048	1048	100.00	98.47	1048	AAD11749.1	Cu(+)/Ag(+) efflux RND transporter permease subunit SilA	NA	NA
NA	ERZ3485857.28	7129	8418	-	silB	Cu(+)/Ag(+) efflux RND transporter periplasmic adaptor subunit SilB	plus	STRESS	METAL	COPPER/SILVER	COPPER/SILVER	BLASTX	430	430	100.00	96.74	430	AAD11748.1	Cu(+)/Ag(+) efflux RND transporter periplasmic adaptor subunit SilB	NA	NA
NA	ERZ3485857.28	8535	8885	-	silF	Cu(+)/Ag(+) efflux RND transporter periplasmic metallochaperone SilF	plus	STRESS	METAL	COPPER/SILVER	COPPER/SILVER	BLASTX	117	117	100.00	97.44	117	KGL71342.1	Cu(+)/Ag(+) efflux RND transporter periplasmic metallochaperone SilF	NA	NA
NA	ERZ3485857.28	8916	10298	-	silC	Cu(+)/Ag(+) efflux RND transporter outer membrane channel SilC	plus	STRESS	METAL	COPPER/SILVER	COPPER/SILVER	BLASTX	461	461	100.00	97.83	461	SPD96884.1	Cu(+)/Ag(+) efflux RND transporter outer membrane channel SilC	NA	NA
NA	ERZ3485857.28	10488	11165	+	silR	copper/silver response regulator transcription factor SilR	plus	STRESS	METAL	COPPER/SILVER	COPPER/SILVER	BLASTX	226	226	100.00	97.79	226	SPD96883.1	copper/silver response regulator transcription factor SilR	NA	NA
NA	ERZ3485857.28	11161	12633	+	silS	copper/silver sensor histidine kinase SilS	plus	STRESS	METAL	COPPER/SILVER	COPPER/SILVER	BLASTX	491	491	100.00	98.57	491	SPD96882.1	copper/silver sensor histidine kinase SilS	NA	NA
NA	ERZ3485857.28	12887	13315	+	silE	silver-binding protein SilE	plus	STRESS	METAL	SILVER	SILVER	EXACTX	143	143	100.00	100.00	143	AAD11743.1	silver-binding protein SilE	NA	NA
NA	ERZ3485857.42	6532	7758	+	mdtM	multidrug efflux MFS transporter MdtM	plus	AMR	AMR	EFFLUX	EFFLUX	BLASTX	409	410	99.76	98.29	409	AAC77293.1	multidrug efflux MFS transporter MdtM	NA	NA
NA	ERZ3485857.48	24653	27277	-	gyrA_S83L	Escherichia quinolone resistant GyrA	core	AMR	POINT	QUINOLONE	QUINOLONE	POINTX	875	878	99.66	98.97	875	WP_001281243.1	DNA gyrase subunit A GyrA	NA	NA
NA	ERZ3485857.59	684	3785	-	acrF	multidrug efflux RND transporter permease subunit AcrF	plus	AMR	AMR	EFFLUX	EFFLUX	BLASTX	1034	1034	100.00	99.90	1034	AAC76298.1	multidrug efflux RND transporter permease subunit AcrF	NA	NA
NA	ERZ3485857.72	77	3628	+	fdeC	inverse autotransporter adhesin FdeC	plus	VIRULENCE	VIRULENCE	NA	NA	PARTIALX	1184	1416	83.62	93.67	1184	ABE05822.1	inverse autotransporter adhesin FdeC	NA	NA
NA	ERZ3485857.73	12938	14068	+	blaEC	BlaEC family class C beta-lactamase	plus	AMR	AMR	BETA-LACTAM	BETA-LACTAM	BLASTX	377	377	100.00	99.47	377	ABS58643.1	BlaEC family class C beta-lactamase	NA	NA
NA	ERZ3485857.83	172	603	-	merR	mercury resistance transcriptional regulator MerR	plus	STRESS	METAL	MERCURY	MERCURY	BLASTX	144	144	100.00	93.75	144	CAA77320.1	mercury resistance transcriptional regulator MerR	NA	NA
NA	ERZ3485857.83	675	1022	+	merT	mercuric transport protein MerT	plus	STRESS	METAL	MERCURY	MERCURY	EXACTX	116	116	100.00	100.00	116	AAB59075.1	mercuric transport protein MerT	NA	NA
NA	ERZ3485857.83	1177	2034	-	blaTEM-1	broad-spectrum class A beta-lactamase TEM-1	core	AMR	AMR	BETA-LACTAM	BETA-LACTAM	ALLELEX	286	286	100.00	100.00	286	WP_000027057.1	broad-spectrum class A beta-lactamase TEM-1	NA	NA
NA	ERZ3485857.83	4856	5728	+	blaCTX-M-55	extended-spectrum class A beta-lactamase CTX-M-55	core	AMR	AMR	BETA-LACTAM	CEPHALOSPORIN	ALLELEX	291	291	100.00	100.00	291	WP_015387340.1	extended-spectrum class A beta-lactamase CTX-M-55	NA	NA
NA	ERZ3485857.83	10372	11025	+	qnrS1	quinolone resistance pentapeptide repeat protein QnrS1	core	AMR	AMR	QUINOLONE	QUINOLONE	ALLELEX	218	218	100.00	100.00	218	WP_001516695.1	quinolone resistance pentapeptide repeat protein QnrS1	NA	NA
NA	ERZ3485857.89	8053	8166	+	astA	heat-stable enterotoxin EAST1	plus	VIRULENCE	VIRULENCE	NA	NA	EXACTX	38	38	100.00	100.00	38	AAD43578.1	heat-stable enterotoxin EAST1	NA	NA
NA	ERZ3485857.90	561	890	-	qacL	quaternary ammonium compound efflux SMR transporter QacL	core	STRESS	BIOCIDE	QUATERNARY AMMONIUM	QUATERNARY AMMONIUM	EXACTX	110	110	100.00	100.00	110	WP_000800531.1	quaternary ammonium compound efflux SMR transporter QacL	NA	NA
NA	ERZ3485857.90	1063	1851	-	aadA25	ANT(3'')-Ia family aminoglycoside nucleotidyltransferase AadA25	core	AMR	AMR	AMINOGLYCOSIDE	STREPTOMYCIN	EXACTX	263	263	100.00	100.00	263	WP_011113049.1	ANT(3'')-Ia family aminoglycoside nucleotidyltransferase AadA25	NA	NA
NA	ERZ3485857.90	2262	2756	-	dfrA12	trimethoprim-resistant dihydrofolate reductase DfrA12	core	AMR	AMR	TRIMETHOPRIM	TRIMETHOPRIM	EXACTX	165	165	100.00	100.00	165	WP_001083725.1	trimethoprim-resistant dihydrofolate reductase DfrA12	NA	NA
