Protein id	Contig id	Start	Stop	Strand	Element symbol	Element name	Scope	Type	Subtype	Class	Subclass	Method	Target length	Reference sequence length	% Coverage of reference	% Identity to reference	Alignment length	Closest reference accession	Closest reference name	HMM accession	HMM description
NA	ERZ3485262.11	589	852	+	ariR	biofilm/acid-resistance regulator AriR	plus	STRESS	ACID	NA	NA	EXACTX	88	88	100.00	100.00	88	AAC74250.1	biofilm/acid-resistance regulator AriR	NA	NA
NA	ERZ3485262.112	403	2319	-	tet(M)	tetracycline resistance ribosomal protection protein Tet(M)	core	AMR	AMR	TETRACYCLINE	TETRACYCLINE	BLASTX	639	639	100.00	98.12	639	WP_063856397.1	tetracycline resistance ribosomal protection protein Tet(M)	NA	NA
NA	ERZ3485262.120	1640	2428	+	sul3	sulfonamide-resistant dihydropteroate synthase Sul3	core	AMR	AMR	SULFONAMIDE	SULFONAMIDE	EXACTX	263	263	100.00	100.00	263	WP_000034420.1	sulfonamide-resistant dihydropteroate synthase Sul3	NA	NA
NA	ERZ3485262.125	625	1497	+	blaCTX-M-55	extended-spectrum class A beta-lactamase CTX-M-55	core	AMR	AMR	BETA-LACTAM	CEPHALOSPORIN	ALLELEX	291	291	100.00	100.00	291	WP_015387340.1	extended-spectrum class A beta-lactamase CTX-M-55	NA	NA
NA	ERZ3485262.156	219	1031	-	aph(3')-Ia	aminoglycoside O-phosphotransferase APH(3')-Ia	core	AMR	AMR	AMINOGLYCOSIDE	KANAMYCIN	EXACTX	271	271	100.00	100.00	271	WP_000018329.1	aminoglycoside O-phosphotransferase APH(3')-Ia	NA	NA
NA	ERZ3485262.165	174	812	-	catA2	type A-2 chloramphenicol O-acetyltransferase CatII	core	AMR	AMR	PHENICOL	CHLORAMPHENICOL	EXACTX	213	213	100.00	100.00	213	WP_001011939.1	type A-2 chloramphenicol O-acetyltransferase CatII	NA	NA
NA	ERZ3485262.3	39720	40850	-	blaEC	BlaEC family class C beta-lactamase	plus	AMR	AMR	BETA-LACTAM	BETA-LACTAM	BLASTX	377	377	100.00	98.14	377	WP_063610930.1	extended-spectrum class C beta-lactamase EC-15	NA	NA
NA	ERZ3485262.33	47257	50358	+	acrF	multidrug efflux RND transporter permease subunit AcrF	plus	AMR	AMR	EFFLUX	EFFLUX	BLASTX	1034	1034	100.00	99.71	1034	AAC76298.1	multidrug efflux RND transporter permease subunit AcrF	NA	NA
NA	ERZ3485262.57	450	878	-	silE	silver-binding protein SilE	plus	STRESS	METAL	SILVER	SILVER	EXACTX	143	143	100.00	100.00	143	AAD11743.1	silver-binding protein SilE	NA	NA
NA	ERZ3485262.57	1132	2604	-	silS	copper/silver sensor histidine kinase SilS	plus	STRESS	METAL	COPPER/SILVER	COPPER/SILVER	BLASTX	491	491	100.00	98.57	491	SPD96882.1	copper/silver sensor histidine kinase SilS	NA	NA
NA	ERZ3485262.57	2600	3277	-	silR	copper/silver response regulator transcription factor SilR	plus	STRESS	METAL	COPPER/SILVER	COPPER/SILVER	BLASTX	226	226	100.00	97.79	226	SPD96883.1	copper/silver response regulator transcription factor SilR	NA	NA
NA	ERZ3485262.57	3467	4849	+	silC	Cu(+)/Ag(+) efflux RND transporter outer membrane channel SilC	plus	STRESS	METAL	COPPER/SILVER	COPPER/SILVER	BLASTX	461	461	100.00	97.83	461	SPD96884.1	Cu(+)/Ag(+) efflux RND transporter outer membrane channel SilC	NA	NA
NA	ERZ3485262.57	4880	5230	+	silF	Cu(+)/Ag(+) efflux RND transporter periplasmic metallochaperone SilF	plus	STRESS	METAL	COPPER/SILVER	COPPER/SILVER	BLASTX	117	117	100.00	97.44	117	KGL71342.1	Cu(+)/Ag(+) efflux RND transporter periplasmic metallochaperone SilF	NA	NA
NA	ERZ3485262.57	5347	6636	+	silB	Cu(+)/Ag(+) efflux RND transporter periplasmic adaptor subunit SilB	plus	STRESS	METAL	COPPER/SILVER	COPPER/SILVER	BLASTX	430	430	100.00	96.28	430	AAD11748.1	Cu(+)/Ag(+) efflux RND transporter periplasmic adaptor subunit SilB	NA	NA
NA	ERZ3485262.57	6650	9793	+	silA	Cu(+)/Ag(+) efflux RND transporter permease subunit SilA	plus	STRESS	METAL	COPPER/SILVER	COPPER/SILVER	BLASTX	1048	1048	100.00	98.66	1048	AAD11749.1	Cu(+)/Ag(+) efflux RND transporter permease subunit SilA	NA	NA
NA	ERZ3485262.57	10429	12894	+	silP	Ag(+)-translocating P-type ATPase SilP	plus	STRESS	METAL	SILVER	SILVER	BLASTX	822	824	99.64	95.02	823	AAD11750.1	Ag(+)-translocating P-type ATPase SilP	NA	NA
NA	ERZ3485262.57	14879	16693	+	pcoA	multicopper oxidase PcoA	plus	STRESS	METAL	COPPER	COPPER	BLASTX	605	605	100.00	99.67	605	CAA58525.1	multicopper oxidase PcoA	NA	NA
NA	ERZ3485262.57	16702	17589	+	pcoB	copper-binding protein PcoB	plus	STRESS	METAL	COPPER	COPPER	EXACTX	296	296	100.00	100.00	296	CAA58526.1	copper-binding protein PcoB	NA	NA
NA	ERZ3485262.57	17632	18009	+	pcoC	copper resistance system metallochaperone PcoC	plus	STRESS	METAL	COPPER	COPPER	EXACTX	126	126	100.00	100.00	126	CAA58527.1	copper resistance system metallochaperone PcoC	NA	NA
NA	ERZ3485262.57	18017	18943	+	pcoD	copper resistance inner membrane protein PcoD	plus	STRESS	METAL	COPPER	COPPER	EXACTX	309	309	100.00	100.00	309	CAA58528.1	copper resistance inner membrane protein PcoD	NA	NA
NA	ERZ3485262.57	19001	19678	+	pcoR	copper response regulator transcription factor PcoR	plus	STRESS	METAL	COPPER	COPPER	EXACTX	226	226	100.00	100.00	226	CAA58529.1	copper response regulator transcription factor PcoR	NA	NA
NA	ERZ3485262.57	19678	21075	+	pcoS	copper resistance membrane spanning protein PcoS	plus	STRESS	METAL	COPPER	COPPER	BLASTX	466	466	100.00	99.57	466	CAA58530.1	copper resistance membrane spanning protein PcoS	NA	NA
NA	ERZ3485262.57	21296	21727	+	pcoE	copper resistance system metallochaperone PcoE	plus	STRESS	METAL	COPPER	COPPER	BLASTX	144	144	100.00	92.36	144	CAA58532.1	copper resistance system metallochaperone PcoE	NA	NA
NA	ERZ3485262.64	9890	11116	+	mdtM	multidrug efflux MFS transporter MdtM	plus	AMR	AMR	EFFLUX	EFFLUX	BLASTX	409	410	99.76	97.56	409	AAC77293.1	multidrug efflux MFS transporter MdtM	NA	NA
NA	ERZ3485262.77	145	474	-	qacL	quaternary ammonium compound efflux SMR transporter QacL	core	STRESS	BIOCIDE	QUATERNARY AMMONIUM	QUATERNARY AMMONIUM	EXACTX	110	110	100.00	100.00	110	WP_000800531.1	quaternary ammonium compound efflux SMR transporter QacL	NA	NA
NA	ERZ3485262.77	647	1435	-	aadA1	ANT(3'')-Ia family aminoglycoside nucleotidyltransferase AadA1	core	AMR	AMR	AMINOGLYCOSIDE	STREPTOMYCIN	EXACTX	263	263	100.00	100.00	263	WP_001206316.1	ANT(3'')-Ia family aminoglycoside nucleotidyltransferase AadA1	NA	NA
NA	ERZ3485262.77	1531	2787	-	cmlA1	chloramphenicol efflux MFS transporter CmlA1	core	AMR	AMR	PHENICOL	CHLORAMPHENICOL	EXACTX	419	419	100.00	100.00	419	WP_000095725.1	chloramphenicol efflux MFS transporter CmlA1	NA	NA
NA	ERZ3485262.77	3052	3840	-	aadA2	ANT(3'')-Ia family aminoglycoside nucleotidyltransferase AadA2	core	AMR	AMR	AMINOGLYCOSIDE	STREPTOMYCIN	EXACTX	263	263	100.00	100.00	263	WP_001206356.1	ANT(3'')-Ia family aminoglycoside nucleotidyltransferase AadA2	NA	NA
NA	ERZ3485262.77	4251	4745	-	dfrA12	trimethoprim-resistant dihydrofolate reductase DfrA12	core	AMR	AMR	TRIMETHOPRIM	TRIMETHOPRIM	EXACTX	165	165	100.00	100.00	165	WP_001083725.1	trimethoprim-resistant dihydrofolate reductase DfrA12	NA	NA
NA	ERZ3485262.77	9142	9999	-	blaTEM-1	broad-spectrum class A beta-lactamase TEM-1	core	AMR	AMR	BETA-LACTAM	BETA-LACTAM	ALLELEX	286	286	100.00	100.00	286	WP_000027057.1	broad-spectrum class A beta-lactamase TEM-1	NA	NA
NA	ERZ3485262.9	11816	12289	+	dfrA51	trimethoprim-resistant dihydrofolate reductase DfrA51	core	AMR	AMR	TRIMETHOPRIM	TRIMETHOPRIM	BLASTX	158	158	100.00	96.20	158	WP_000781812.1	trimethoprim-resistant dihydrofolate reductase DfrA51	NA	NA
NA	ERZ3485262.90	4154	5356	+	tet(B)	tetracycline efflux MFS transporter Tet(B)	core	AMR	AMR	TETRACYCLINE	TETRACYCLINE	EXACTX	401	401	100.00	100.00	401	WP_001089068.1	tetracycline efflux MFS transporter Tet(B)	NA	NA
NA	ERZ3485262.94	5026	5883	-	aac(3)-IId	aminoglycoside N-acetyltransferase AAC(3)-IId	core	AMR	AMR	AMINOGLYCOSIDE	GENTAMICIN	EXACTX	286	286	100.00	100.00	286	WP_000557454.1	aminoglycoside N-acetyltransferase AAC(3)-IId	NA	NA
